ength 212
02:46:49.912150 IP comp3134-Winter2023.ssh > bras-base-toroon63ztr-grc-42-174-91-170-42.dsl.bell.ca.56476: Flags [P.], seq 4703332:4703544, ack 2665, win 501, length 212
02:46:49.912209 IP comp3134-Winter2023.ssh > bras-base-toroon63ztr-grc-42-174-91-170-42.dsl.bell.ca.56476: Flags [P.], seq 4703544:4703756, ack 2665, win 501, length 212
02:46:49.912255 IP comp3134-Winter2023.ssh > bras-base-toroon63ztr-grc-42-174-91-170-42.dsl.bell.ca.56476: Flags [P.], seq 4703756:4703968, ack 2665, win 501, length 212
02:46:49.912293 IP comp3134-Winter2023.ssh > bras-base-toroon63ztr-grc-42-174-91-170-42.dsl.bell.ca.56476: Flags [P.], seq 4703968:4704180, ack 2665, win 501, length 212
02:46:49.912351 IP comp3134-Winter2023.ssh > bras-base-toroon63ztr-grc-42-174-91-170-42.dsl.bell.ca.56476: Flags [P.], seq 4704180:4704392, ack 2665, win 501, length 212
02:46:49.912406 IP comp3134-Winter2023.ssh > bras-base-toroon63ztr-grc-42-174-91-170-42.dsl.bell.ca.56476: Flags [P.], seq 4704392:4704604, ack 2665, win 501, length 212
02:46:49.912451 IP comp3134-Winter2023.ssh > bras-base-toroon63ztr-grc-42-174-91-170-42.dsl.bell.ca.56476: Flags [P.], seq 4704604:4704816, ack 2665, win 501, length 212
02:46:49.912508 IP comp3134-Winter2023.ssh > bras-base-toroon63ztr-grc-42-174-91-170-42.dsl.bell.ca.56476: Flags [P.], seq 4704816:4705028, ack 2665, win 501, length 212
02:46:49.912578 IP comp3134-Winter2023.ssh > bras-base-toroon63ztr-grc-42-174-91-170-42.dsl.bell.ca.56476: Flags [P.], seq 4705028:4705240, ack 2665, win 501, length 212
02:46:49.912672 IP comp3134-Winter2023.ssh > bras-base-toroon63ztr-grc-42-174-91-170-42.dsl.bell.ca.56476: Flags [P.], seq 4705240:4705452, ack 2665, win 501, length 212
02:46:49.912721 IP comp3134-Winter2023.ssh > bras-base-toroon63ztr-grc-42-174-91-170-42.dsl.bell.ca.56476: Flags [P.], seq 4705452:4705664, ack 2665, win 501, length 212
02:46:49.912757 IP comp3134-Winter2023.ssh > bras-base-toroon63ztr-grc-42-174-91-170-42.dsl.bell.ca.56476: Flags [P.], seq 4705664:4705876, ack 2665, win 501, length 212
02:46:49.912825 IP comp3134-Winter2023.ssh > bras-base-toroon63ztr-grc-42-174-91-170-42.dsl.bell.ca.56476: Flags [P.], seq 4705876:4706088, ack 2665, win 501, length 212
02:46:49.912864 IP comp3134-Winter2023.ssh > bras-base-toroon63ztr-grc-42-174-91-170-42.dsl.bell.ca.56476: Flags [P.], seq 4706088:4706300, ack 2665, win 501, length 212
02:46:49.912899 IP comp3134-Winter2023.ssh > bras-base-toroon63ztr-grc-42-174-91-170-42.dsl.bell.ca.56476: Flags [P.], seq 4706300:4706512, ack 2665, win 501, length 212
02:46:49.912934 IP comp3134-Winter2023.ssh > bras-base-toroon63ztr-grc-42-174-91-170-42.dsl.bell.ca.56476: Flags [P.], seq 4706512:4706724, ack 2665, win 501, length 212
02:46:49.912969 IP comp3134-Winter2023.ssh > bras-base-toroon63ztr-grc-42-174-91-170-42.dsl.bell.ca.56476: Flags [P.], seq 4706724:4706936, ack 2665, win 501, length 212
02:46:49.913027 IP comp3134-Winter2023.ssh > bras-base-toroon63ztr-grc-42-174-91-170-42.dsl.bell.ca.56476: Flags [P.], seq 4706936:4707148, ack 2665, win 501, length 212
02:46:49.913066 IP comp3134-Winter2023.ssh > bras-base-toroon63ztr-grc-42-174-91-170-42.dsl.bell.ca.56476: Flags [P.], seq 4707148:4707360, ack 2665, win 501, length 212
02:46:49.913099 IP comp3134-Winter2023.ssh > bras-base-toroon63ztr-grc-42-174-91-170-42.dsl.bell.ca.56476: Flags [P.], seq 4707360:4707572, ack 2665, win 501, length 212
02:46:49.913137 IP bras-base-toroon63ztr-grc-42-174-91-170-42.dsl.bell.ca.56476 > comp3134-Winter2023.ssh: Flags [.], ack 4697932, win 8337, length 0
02:46:49.913201 IP comp3134-Winter2023.ssh > bras-base-toroon63ztr-grc-42-174-91-170-42.dsl.bell.ca.56476: Flags [P.], seq 4707572:4707928, ack 2665, win 501, length 356
02:46:49.913241 IP comp3134-Winter2023.ssh > bras-base-toroon63ztr-grc-42-174-91-170-42.dsl.bell.ca.56476: Flags [P.], seq 4707928:4708140, ack 2665, win 501, length 212
02:46:49.913284 IP comp3134-Winter2023.ssh > bras-base-toroon63ztr-grc-42-174-91-170-42.dsl.bell.ca.56476: Flags [P.], seq 4708140:4708352, ack 2665, win 501, length 212
02:46:49.913320 IP comp3134-Winter2023.ssh > bras-base-toroon63ztr-grc-42-174-91-170-42.dsl.bell.ca.56476: Flags [P.], seq 4708352:4708564, ack 2665, win 501, length 212
02:46:49.913363 IP comp3134-Winter2023.ssh > bras-base-toroon63ztr-grc-42-174-91-170-42.dsl.bell.ca.56476: Flags [P.], seq 4708564:4708776, ack 2665, win 501, length 212
02:46:49.913399 IP comp3134-Winter2023.ssh > bras-base-toroon63ztr-grc-42-174-91-170-42.dsl.bell.ca.56476: Flags [P.], seq 4708776:4708988, ack 2665, win 501, length 212
02:46:49.913435 IP comp3134-Winter2023.ssh > bras-base-toroon63ztr-grc-42-174-91-170-42.dsl.bell.ca.56476: Flags [P.], seq 4708988:4709200, ack 2665, win 501, length 212
02:46:49.913471 IP comp3134-Winter2023.ssh > bras-base-toroon63ztr-grc-42-174-91-170-42.dsl.bell.ca.56476: Flags [P.], seq 4709200:4709412, ack 2665, win 501, length 212
02:46:49.913505 IP comp3134-Winter2023.ssh > bras-base-toroon63ztr-grc-42-174-91-170-42.dsl.bell.ca.56476: Flags [P.], seq 4709412:4709624, ack 2665, win 501, length 212
02:46:49.913567 IP comp3134-Winter2023.ssh > bras-base-toroon63ztr-grc-42-174-91-170-42.dsl.bell.ca.56476: Flags [P.], seq 4709624:4709836, ack 2665, win 501, length 212
02:46:49.913607 IP comp3134-Winter2023.ssh > bras-base-toroon63ztr-grc-42-174-91-170-42.dsl.bell.ca.56476: Flags [P.], seq 4709836:4710048, ack 2665, win 501, length 212
02:46:49.913649 IP comp3134-Winter2023.ssh > bras-base-toroon63ztr-grc-42-174-91-170-42.dsl.bell.ca.56476: Flags [P.], seq 4710048:4710260, ack 2665, win 501, length 212
02:46:49.913695 IP comp3134-Winter2023.ssh > bras-base-toroon63ztr-grc-42-174-91-170-42.dsl.bell.ca.56476: Flags [P.], seq 4710260:4710472, ack 2665, win 501, length 212
02:46:49.913732 IP comp3134-Winter2023.ssh > bras-base-toroon63ztr-grc-42-174-91-170-42.dsl.bell.ca.56476: Flags [P.], seq 4710472:4710684, ack 2665, win 501, length 212
02:46:49.913770 IP comp3134-Winter2023.ssh > bras-base-toroon63ztr-grc-42-174-91-170-42.dsl.bell.ca.56476: Flags [P.], seq 4710684:4710896, ack 2665, win 501, length 212
02:46:49.913818 IP comp3134-Winter2023.ssh > bras-base-toroon63ztr-grc-42-174-91-170-42.dsl.bell.ca.56476: Flags [P.], seq 4710896:4711108, ack 2665, win 501, length 212
02:46:49.913864 IP comp3134-Winter2023.ssh > bras-base-toroon63ztr-grc-42-174-91-170-42.dsl.bell.ca.56476: Flags [P.], seq 4711108:4711320, ack 2665, win 501, length 212
02:46:49.913914 IP comp3134-Winter2023.ssh > bras-base-toroon63ztr-grc-42-174-91-170-42.dsl.bell.ca.56476: Flags [P.], seq 4711320:4711532, ack 2665, win 501, length 212
02:46:49.913958 IP comp3134-Winter2023.ssh > bras-base-toroon63ztr-grc-42-174-91-170-42.dsl.bell.ca.56476: Flags [P.], seq 4711532:4711744, ack 2665, win 501, length 212
02:46:49.913994 IP comp3134-Winter2023.ssh > bras-base-toroon63ztr-grc-42-174-91-170-42.dsl.bell.ca.56476: Flags [P.], seq 4711744:4711956, ack 2665, win 501, length 212
02:46:49.914036 IP comp3134-Winter2023.ssh > bras-base-toroon63ztr-grc-42-174-91-170-42.dsl.bell.ca.56476: Flags [P.], seq 4711956:4712168, ack 2665, win 501, length 212
02:46:49.914071 IP comp3134-Winter2023.ssh > bras-base-toroon63ztr-grc-42-174-91-170-42.dsl.bell.ca.56476: Flags [P.], seq 4712168:4712380, ack 2665, win 501, length 212
02:46:49.914108 IP comp3134-Winter2023.ssh > bras-base-toroon63ztr-grc-42-174-91-170-42.dsl.bell.ca.56476: Flags [P.], seq 4712380:4712592, ack 2665, win 501, length 212
02:46:49.914149 IP comp3134-Winter2023.ssh > bras-base-toroon63ztr-grc-42-174-91-170-42.dsl.bell.ca.56476: Flags [P.], seq 4712592:4712804, ack 2665, win 501, length 212
02:46:49.914182 IP comp3134-Winter2023.ssh > bras-base-toroon63ztr-grc-42-174-91-170-42.dsl.bell.ca.56476: Flags [P.], seq 4712804:4713016, ack 2665, win 501, length 212
02:46:49.914218 IP comp3134-Winter2023.ssh > bras-base-toroon63ztr-grc-42-174-91-170-42.dsl.bell.ca.56476: Flags [P.], seq 4713016:4713228, ack 2665, win 501, length 212
02:46:49.914258 IP comp3134-Winter2023.ssh > bras-base-toroon63ztr-grc-42-174-91-170-42.dsl.bell.ca.56476: Flags [P.], seq 4713228:4713440, ack 2665, win 501, length 212
02:46:49.914302 IP comp3134-Winter2023.ssh > bras-base-toroon63ztr-grc-42-174-91-170-42.dsl.bell.ca.56476: Flags [P.], seq 4713440:4713652, ack 2665, win 501, length 212
02:46:49.914338 IP comp3134-Winter2023.ssh > bras-base-toroon63ztr-grc-42-174-91-170-42.dsl.bell.ca.56476: Flags [P.], seq 4713652:4713864, ack 2665, win 501, length 212
02:46:49.914374 IP comp3134-Winter2023.ssh > bras-base-toroon63ztr-grc-42-174-91-170-42.dsl.bell.ca.56476: Flags [P.], seq 4713864:4714076, ack 2665, win 501, length 212
02:46:49.914513 IP comp3134-Winter2023.ssh > bras-base-toroon63ztr-grc-42-174-91-170-42.dsl.bell.ca.56476: Flags [P.], seq 4714076:4714288, ack 2665, win 501, length 212
02:46:49.914568 IP comp3134-Winter2023.ssh > bras-base-toroon63ztr-grc-42-174-91-170-42.dsl.bell.ca.56476: Flags [P.], seq 4714288:4714500, ack 2665, win 501, length 212
02:46:49.914605 IP comp3134-Winter2023.ssh > bras-base-toroon63ztr-grc-42-174-91-170-42.dsl.bell.ca.56476: Flags [P.], seq 4714500:4714712, ack 2665, win 501, length 212
02:46:49.914644 IP comp3134-Winter2023.ssh > bras-base-toroon63ztr-grc-42-174-91-170-42.dsl.bell.ca.56476: Flags [P.], seq 4714712:4714924, ack 2665, win 501, length 212
02:46:49.914685 IP comp3134-Winter2023.ssh > bras-base-toroon63ztr-grc-42-174-91-170-42.dsl.bell.ca.56476: Flags [P.], seq 4714924:4715136, ack 2665, win 501, length 212
02:46:49.914721 IP comp3134-Winter2023.ssh > bras-base-toroon63ztr-grc-42-174-91-170-42.dsl.bell.ca.56476: Flags [P.], seq 4715136:4715348, ack 2665, win 501, length 212
02:46:49.914786 IP comp3134-Winter2023.ssh > bras-base-toroon63ztr-grc-42-174-91-170-42.dsl.bell.ca.56476: Flags [P.], seq 4715348:4715560, ack 2665, win 501, length 212
02:46:49.914837 IP comp3134-Winter2023.ssh > bras-base-toroon63ztr-grc-42-174-91-170-42.dsl.bell.ca.56476: Flags [P.], seq 4715560:4715772, ack 2665, win 501, length 212
02:46:49.915194 IP comp3134-Winter2023.ssh > bras-base-toroon63ztr-grc-42-174-91-170-42.dsl.bell.ca.56476: Flags [P.], seq 4715772:4715984, ack 2665, win 501, length 212
02:46:49.915296 IP bras-base-toroon63ztr-grc-42-174-91-170-42.dsl.bell.ca.56476 > comp3134-Winter2023.ssh: Flags [.], ack 4703332, win 8337, length 0
02:46:49.915296 IP bras-base-toroon63ztr-grc-42-174-91-170-42.dsl.bell.ca.56476 > comp3134-Winter2023.ssh: Flags [.], ack 4704392, win 8333, length 0
02:46:49.915360 IP comp3134-Winter2023.ssh > bras-base-toroon63ztr-grc-42-174-91-170-42.dsl.bell.ca.56476: Flags [P.], seq 4715984:4716196, ack 2665, win 501, length 212
02:46:49.915417 IP comp3134-Winter2023.ssh > bras-base-toroon63ztr-grc-42-174-91-170-42.dsl.bell.ca.56476: Flags [P.], seq 4716196:4716704, ack 2665, win 501, length 508
02:46:49.915521 IP comp3134-Winter2023.ssh > bras-base-toroon63ztr-grc-42-174-91-170-42.dsl.bell.ca.56476: Flags [P.], seq 4716704:4716916, ack 2665, win 501, length 212
02:46:49.915565 IP comp3134-Winter2023.ssh > bras-base-toroon63ztr-grc-42-174-91-170-42.dsl.bell.ca.56476: Flags [P.], seq 4716916:4717128, ack 2665, win 501, length 212
02:46:49.915606 IP comp3134-Winter2023.ssh > bras-base-toroon63ztr-grc-42-174-91-170-42.dsl.bell.ca.56476: Flags [P.], seq 4717128:4717340, ack 2665, win 501, length 212
02:46:49.915649 IP comp3134-Winter2023.ssh > bras-base-toroon63ztr-grc-42-174-91-170-42.dsl.bell.ca.56476: Flags [P.], seq 4717340:4717552, ack 2665, win 501, length 212
02:46:49.915694 IP comp3134-Winter2023.ssh > bras-base-toroon63ztr-grc-42-174-91-170-42.dsl.bell.ca.56476: Flags [P.], seq 4717552:4717764, ack 2665, win 501, length 212
02:46:49.915744 IP comp3134-Winter2023.ssh > bras-base-toroon63ztr-grc-42-174-91-170-42.dsl.bell.ca.56476: Flags [P.], seq 4717764:4717976, ack 2665, win 501, length 212
02:46:49.915799 IP comp3134-Winter2023.ssh > bras-base-toroon63ztr-grc-42-174-91-170-42.dsl.bell.ca.56476: Flags [P.], seq 4717976:4718188, ack 2665, win 501, length 212
02:46:49.916179 IP comp3134-Winter2023.ssh > bras-base-toroon63ztr-grc-42-174-91-170-42.dsl.bell.ca.56476: Flags [P.], seq 4718188:4718400, ack 2665, win 501, length 212
02:46:49.916417 IP comp3134-Winter2023.ssh > bras-base-toroon63ztr-grc-42-174-91-170-42.dsl.bell.ca.56476: Flags [P.], seq 4718400:4718612, ack 2665, win 501, length 212
02:46:49.916463 IP comp3134-Winter2023.ssh > bras-base-toroon63ztr-grc-42-174-91-170-42.dsl.bell.ca.56476: Flags [P.], seq 4718612:4718824, ack 2665, win 501, length 212
02:46:49.916498 IP comp3134-Winter2023.ssh > bras-base-toroon63ztr-grc-42-174-91-170-42.dsl.bell.ca.56476: Flags [P.], seq 4718824:4719036, ack 2665, win 501, length 212
02:46:49.916534 IP comp3134-Winter2023.ssh > bras-base-toroon63ztr-grc-42-174-91-170-42.dsl.bell.ca.56476: Flags [P.], seq 4719036:4719248, ack 2665, win 501, length 212
02:46:49.916582 IP comp3134-Winter2023.ssh > bras-base-toroon63ztr-grc-42-174-91-170-42.dsl.bell.ca.56476: Flags [P.], seq 4719248:4719460, ack 2665, win 501, length 212
02:46:49.916633 IP comp3134-Winter2023.ssh > bras-base-toroon63ztr-grc-42-174-91-170-42.dsl.bell.ca.56476: Flags [P.], seq 4719460:4719672, ack 2665, win 501, length 212
02:46:49.916865 IP comp3134-Winter2023.ssh > bras-base-toroon63ztr-grc-42-174-91-170-42.dsl.bell.ca.56476: Flags [P.], seq 4719672:4719884, ack 2665, win 501, length 212
02:46:49.916966 IP comp3134-Winter2023.ssh > bras-base-toroon63ztr-grc-42-174-91-170-42.dsl.bell.ca.56476: Flags [P.], seq 4719884:4720096, ack 2665, win 501, length 212
02:46:49.917035 IP comp3134-Winter2023.ssh > bras-base-toroon63ztr-grc-42-174-91-170-42.dsl.bell.ca.56476: Flags [P.], seq 4720096:4720308, ack 2665, win 501, length 212
02:46:49.917092 IP comp3134-Winter2023.ssh > bras-base-toroon63ztr-grc-42-174-91-170-42.dsl.bell.ca.56476: Flags [P.], seq 4720308:4720520, ack 2665, win 501, length 212
02:46:49.917421 IP bras-base-toroon63ztr-grc-42-174-91-170-42.dsl.bell.ca.56476 > comp3134-Winter2023.ssh: Flags [.], ack 4709624, win 8337, length 0
02:46:49.917421 IP bras-base-toroon63ztr-grc-42-174-91-170-42.dsl.bell.ca.56476 > comp3134-Winter2023.ssh: Flags [.], ack 4714500, win 8337, length 0
02:46:49.917497 IP comp3134-Winter2023.ssh > bras-base-toroon63ztr-grc-42-174-91-170-42.dsl.bell.ca.56476: Flags [P.], seq 4720520:4720732, ack 2665, win 501, length 212
02:46:49.917706 IP comp3134-Winter2023.ssh > bras-base-toroon63ztr-grc-42-174-91-170-42.dsl.bell.ca.56476: Flags [P.], seq 4720732:4721240, ack 2665, win 501, length 508
02:46:49.917788 IP comp3134-Winter2023.ssh > bras-base-toroon63ztr-grc-42-174-91-170-42.dsl.bell.ca.56476: Flags [P.], seq 4721240:4721452, ack 2665, win 501, length 212
02:46:49.917962 IP comp3134-Winter2023.ssh > bras-base-toroon63ztr-grc-42-174-91-170-42.dsl.bell.ca.56476: Flags [P.], seq 4721452:4721664, ack 2665, win 501, length 212
02:46:49.918177 IP comp3134-Winter2023.ssh > bras-base-toroon63ztr-grc-42-174-91-170-42.dsl.bell.ca.56476: Flags [P.], seq 4721664:4721876, ack 2665, win 501, length 212
02:46:49.918246 IP comp3134-Winter2023.ssh > bras-base-toroon63ztr-grc-42-174-91-170-42.dsl.bell.ca.56476: Flags [P.], seq 4721876:4722088, ack 2665, win 501, length 212
02:46:49.918549 IP comp3134-Winter2023.ssh > bras-base-toroon63ztr-grc-42-174-91-170-42.dsl.bell.ca.56476: Flags [P.], seq 4722088:4722300, ack 2665, win 501, length 212
02:46:49.918634 IP comp3134-Winter2023.ssh > bras-base-toroon63ztr-grc-42-174-91-170-42.dsl.bell.ca.56476: Flags [P.], seq 4722300:4722512, ack 2665, win 501, length 212
02:46:49.918726 IP comp3134-Winter2023.ssh > bras-base-toroon63ztr-grc-42-174-91-170-42.dsl.bell.ca.56476: Flags [P.], seq 4722512:4722724, ack 2665, win 501, length 212
02:46:49.918781 IP comp3134-Winter2023.ssh > bras-base-toroon63ztr-grc-42-174-91-170-42.dsl.bell.ca.56476: Flags [P.], seq 4722724:4722936, ack 2665, win 501, length 212
02:46:49.919086 IP comp3134-Winter2023.ssh > bras-base-toroon63ztr-grc-42-174-91-170-42.dsl.bell.ca.56476: Flags [P.], seq 4722936:4723148, ack 2665, win 501, length 212
02:46:49.919186 IP bras-base-toroon63ztr-grc-42-174-91-170-42.dsl.bell.ca.56476 > comp3134-Winter2023.ssh: Flags [.], ack 4719248, win 8337, length 0
02:46:49.919659 IP comp3134-Winter2023.ssh > bras-base-toroon63ztr-grc-42-174-91-170-42.dsl.bell.ca.56476: Flags [P.], seq 4723148:4723504, ack 2665, win 501, length 356
02:46:49.919733 IP comp3134-Winter2023.ssh > bras-base-toroon63ztr-grc-42-174-91-170-42.dsl.bell.ca.56476: Flags [P.], seq 4723504:4723716, ack 2665, win 501, length 212
02:46:49.919770 IP comp3134-Winter2023.ssh > bras-base-toroon63ztr-grc-42-174-91-170-42.dsl.bell.ca.56476: Flags [P.], seq 4723716:4723928, ack 2665, win 501, length 212
02:46:49.919911 IP comp3134-Winter2023.ssh > bras-base-toroon63ztr-grc-42-174-91-170-42.dsl.bell.ca.56476: Flags [P.], seq 4723928:4724140, ack 2665, win 501, length 212
02:46:49.919961 IP comp3134-Winter2023.ssh > bras-base-toroon63ztr-grc-42-174-91-170-42.dsl.bell.ca.56476: Flags [P.], seq 4724140:4724352, ack 2665, win 501, length 212
02:46:49.919998 IP comp3134-Winter2023.ssh > bras-base-toroon63ztr-grc-42-174-91-170-42.dsl.bell.ca.56476: Flags [P.], seq 4724352:4724564, ack 2665, win 501, length 212
02:46:49.920033 IP comp3134-Winter2023.ssh > bras-base-toroon63ztr-grc-42-174-91-170-42.dsl.bell.ca.56476: Flags [P.], seq 4724564:4724776, ack 2665, win 501, length 212
02:46:49.920067 IP comp3134-Winter2023.ssh > bras-base-toroon63ztr-grc-42-174-91-170-42.dsl.bell.ca.56476: Flags [P.], seq 4724776:4724988, ack 2665, win 501, length 212
02:46:49.920112 IP comp3134-Winter2023.ssh > bras-base-toroon63ztr-grc-42-174-91-170-42.dsl.bell.ca.56476: Flags [P.], seq 4724988:4725200, ack 2665, win 501, length 212
02:46:49.920149 IP comp3134-Winter2023.ssh > bras-base-toroon63ztr-grc-42-174-91-170-42.dsl.bell.ca.56476: Flags [P.], seq 4725200:4725412, ack 2665, win 501, length 212
02:46:49.920182 IP comp3134-Winter2023.ssh > bras-base-toroon63ztr-grc-42-174-91-170-42.dsl.bell.ca.56476: Flags [P.], seq 4725412:4725624, ack 2665, win 501, length 212
02:46:49.920218 IP comp3134-Winter2023.ssh > bras-base-toroon63ztr-grc-42-174-91-170-42.dsl.bell.ca.56476: Flags [P.], seq 4725624:4725836, ack 2665, win 501, length 212
02:46:49.920259 IP comp3134-Winter2023.ssh > bras-base-toroon63ztr-grc-42-174-91-170-42.dsl.bell.ca.56476: Flags [P.], seq 4725836:4726048, ack 2665, win 501, length 212
02:46:49.920310 IP comp3134-Winter2023.ssh > bras-base-toroon63ztr-grc-42-174-91-170-42.dsl.bell.ca.56476: Flags [P.], seq 4726048:4726260, ack 2665, win 501, length 212
02:46:49.920388 IP comp3134-Winter2023.ssh > bras-base-toroon63ztr-grc-42-174-91-170-42.dsl.bell.ca.56476: Flags [P.], seq 4726260:4726472, ack 2665, win 501, length 212
02:46:49.920439 IP comp3134-Winter2023.ssh > bras-base-toroon63ztr-grc-42-174-91-170-42.dsl.bell.ca.56476: Flags [P.], seq 4726472:4726684, ack 2665, win 501, length 212
02:46:49.920475 IP comp3134-Winter2023.ssh > bras-base-toroon63ztr-grc-42-174-91-170-42.dsl.bell.ca.56476: Flags [P.], seq 4726684:4726896, ack 2665, win 501, length 212
02:46:49.920509 IP comp3134-Winter2023.ssh > bras-base-toroon63ztr-grc-42-174-91-170-42.dsl.bell.ca.56476: Flags [P.], seq 4726896:4727108, ack 2665, win 501, length 212
02:46:49.920690 IP comp3134-Winter2023.ssh > bras-base-toroon63ztr-grc-42-174-91-170-42.dsl.bell.ca.56476: Flags [P.], seq 4727108:4727320, ack 2665, win 501, length 212
02:46:49.920755 IP comp3134-Winter2023.ssh > bras-base-toroon63ztr-grc-42-174-91-170-42.dsl.bell.ca.56476: Flags [P.], seq 4727320:4727532, ack 2665, win 501, length 212
02:46:49.920831 IP comp3134-Winter2023.ssh > bras-base-toroon63ztr-grc-42-174-91-170-42.dsl.bell.ca.56476: Flags [P.], seq 4727532:4727744, ack 2665, win 501, length 212
02:46:49.920904 IP comp3134-Winter2023.ssh > bras-base-toroon63ztr-grc-42-174-91-170-42.dsl.bell.ca.56476: Flags [P.], seq 4727744:4727956, ack 2665, win 501, length 212
02:46:49.920960 IP comp3134-Winter2023.ssh > bras-base-toroon63ztr-grc-42-174-91-170-42.dsl.bell.ca.56476: Flags [P.], seq 4727956:4728168, ack 2665, win 501, length 212
02:46:49.921009 IP comp3134-Winter2023.ssh > bras-base-toroon63ztr-grc-42-174-91-170-42.dsl.bell.ca.56476: Flags [P.], seq 4728168:4728380, ack 2665, win 501, length 212
02:46:49.921057 IP comp3134-Winter2023.ssh > bras-base-toroon63ztr-grc-42-174-91-170-42.dsl.bell.ca.56476: Flags [P.], seq 4728380:4728592, ack 2665, win 501, length 212
02:46:49.921117 IP comp3134-Winter2023.ssh > bras-base-toroon63ztr-grc-42-174-91-170-42.dsl.bell.ca.56476: Flags [P.], seq 4728592:4728804, ack 2665, win 501, length 212
02:46:49.921177 IP bras-base-toroon63ztr-grc-42-174-91-170-42.dsl.bell.ca.56476 > comp3134-Winter2023.ssh: Flags [.], ack 4722088, win 8337, length 0
02:46:49.921215 IP comp3134-Winter2023.ssh > bras-base-toroon63ztr-grc-42-174-91-170-42.dsl.bell.ca.56476: Flags [P.], seq 4728804:4729016, ack 2665, win 501, length 212
02:46:49.921278 IP comp3134-Winter2023.ssh > bras-base-toroon63ztr-grc-42-174-91-170-42.dsl.bell.ca.56476: Flags [P.], seq 4729016:4729372, ack 2665, win 501, length 356
02:46:49.921335 IP comp3134-Winter2023.ssh > bras-base-toroon63ztr-grc-42-174-91-170-42.dsl.bell.ca.56476: Flags [P.], seq 4729372:4729584, ack 2665, win 501, length 212
02:46:49.921394 IP comp3134-Winter2023.ssh > bras-base-toroon63ztr-grc-42-174-91-170-42.dsl.bell.ca.56476: Flags [P.], seq 4729584:4729796, ack 2665, win 501, length 212
02:46:49.921440 IP comp3134-Winter2023.ssh > bras-base-toroon63ztr-grc-42-174-91-170-42.dsl.bell.ca.56476: Flags [P.], seq 4729796:4730008, ack 2665, win 501, length 212
02:46:49.921489 IP comp3134-Winter2023.ssh > bras-base-toroon63ztr-grc-42-174-91-170-42.dsl.bell.ca.56476: Flags [P.], seq 4730008:4730220, ack 2665, win 501, length 212
02:46:49.921536 IP comp3134-Winter2023.ssh > bras-base-toroon63ztr-grc-42-174-91-170-42.dsl.bell.ca.56476: Flags [P.], seq 4730220:4730432, ack 2665, win 501, length 212
02:46:49.921585 IP comp3134-Winter2023.ssh > bras-base-toroon63ztr-grc-42-174-91-170-42.dsl.bell.ca.56476: Flags [P.], seq 4730432:4730644, ack 2665, win 501, length 212
02:46:49.921631 IP comp3134-Winter2023.ssh > bras-base-toroon63ztr-grc-42-174-91-170-42.dsl.bell.ca.56476: Flags [P.], seq 4730644:4730856, ack 2665, win 501, length 212
02:46:49.921829 IP comp3134-Winter2023.ssh > bras-base-toroon63ztr-grc-42-174-91-170-42.dsl.bell.ca.56476: Flags [P.], seq 4730856:4731068, ack 2665, win 501, length 212
02:46:49.921943 IP comp3134-Winter2023.ssh > bras-base-toroon63ztr-grc-42-174-91-170-42.dsl.bell.ca.56476: Flags [P.], seq 4731068:4731280, ack 2665, win 501, length 212
02:46:49.922010 IP comp3134-Winter2023.ssh > bras-base-toroon63ztr-grc-42-174-91-170-42.dsl.bell.ca.56476: Flags [P.], seq 4731280:4731492, ack 2665, win 501, length 212
02:46:49.922061 IP comp3134-Winter2023.ssh > bras-base-toroon63ztr-grc-42-174-91-170-42.dsl.bell.ca.56476: Flags [P.], seq 4731492:4731704, ack 2665, win 501, length 212
02:46:49.922111 IP comp3134-Winter2023.ssh > bras-base-toroon63ztr-grc-42-174-91-170-42.dsl.bell.ca.56476: Flags [P.], seq 4731704:4731916, ack 2665, win 501, length 212
02:46:49.922162 IP comp3134-Winter2023.ssh > bras-base-toroon63ztr-grc-42-174-91-170-42.dsl.bell.ca.56476: Flags [P.], seq 4731916:4732128, ack 2665, win 501, length 212
02:46:49.922217 IP comp3134-Winter2023.ssh > bras-base-toroon63ztr-grc-42-174-91-170-42.dsl.bell.ca.56476: Flags [P.], seq 4732128:4732340, ack 2665, win 501, length 212
02:46:49.922265 IP comp3134-Winter2023.ssh > bras-base-toroon63ztr-grc-42-174-91-170-42.dsl.bell.ca.56476: Flags [P.], seq 4732340:4732552, ack 2665, win 501, length 212
02:46:49.922310 IP comp3134-Winter2023.ssh > bras-base-toroon63ztr-grc-42-174-91-170-42.dsl.bell.ca.56476: Flags [P.], seq 4732552:4732764, ack 2665, win 501, length 212
02:46:49.922370 IP comp3134-Winter2023.ssh > bras-base-toroon63ztr-grc-42-174-91-170-42.dsl.bell.ca.56476: Flags [P.], seq 4732764:4732976, ack 2665, win 501, length 212
02:46:49.922718 IP comp3134-Winter2023.ssh > bras-base-toroon63ztr-grc-42-174-91-170-42.dsl.bell.ca.56476: Flags [P.], seq 4732976:4733188, ack 2665, win 501, length 212
02:46:49.922784 IP comp3134-Winter2023.ssh > bras-base-toroon63ztr-grc-42-174-91-170-42.dsl.bell.ca.56476: Flags [P.], seq 4733188:4733400, ack 2665, win 501, length 212
02:46:49.922837 IP comp3134-Winter2023.ssh > bras-base-toroon63ztr-grc-42-174-91-170-42.dsl.bell.ca.56476: Flags [P.], seq 4733400:4733612, ack 2665, win 501, length 212
02:46:49.923148 IP comp3134-Winter2023.ssh > bras-base-toroon63ztr-grc-42-174-91-170-42.dsl.bell.ca.56476: Flags [P.], seq 4733612:4733824, ack 2665, win 501, length 212
02:46:49.923236 IP bras-base-toroon63ztr-grc-42-174-91-170-42.dsl.bell.ca.56476 > comp3134-Winter2023.ssh: Flags [.], ack 4726896, win 8337, length 0
02:46:49.923276 IP comp3134-Winter2023.ssh > bras-base-toroon63ztr-grc-42-174-91-170-42.dsl.bell.ca.56476: Flags [P.], seq 4733824:4734036, ack 2665, win 501, length 212
02:46:49.923358 IP comp3134-Winter2023.ssh > bras-base-toroon63ztr-grc-42-174-91-170-42.dsl.bell.ca.56476: Flags [P.], seq 4734036:4734392, ack 2665, win 501, length 356
02:46:49.923404 IP comp3134-Winter2023.ssh > bras-base-toroon63ztr-grc-42-174-91-170-42.dsl.bell.ca.56476: Flags [P.], seq 4734392:4734604, ack 2665, win 501, length 212
02:46:49.923476 IP comp3134-Winter2023.ssh > bras-base-toroon63ztr-grc-42-174-91-170-42.dsl.bell.ca.56476: Flags [P.], seq 4734604:4734816, ack 2665, win 501, length 212
02:46:49.923523 IP comp3134-Winter2023.ssh > bras-base-toroon63ztr-grc-42-174-91-170-42.dsl.bell.ca.56476: Flags [P.], seq 4734816:4735028, ack 2665, win 501, length 212
02:46:49.923569 IP comp3134-Winter2023.ssh > bras-base-toroon63ztr-grc-42-174-91-170-42.dsl.bell.ca.56476: Flags [P.], seq 4735028:4735240, ack 2665, win 501, length 212
02:46:49.923618 IP comp3134-Winter2023.ssh > bras-base-toroon63ztr-grc-42-174-91-170-42.dsl.bell.ca.56476: Flags [P.], seq 4735240:4735452, ack 2665, win 501, length 212
02:46:49.923668 IP comp3134-Winter2023.ssh > bras-base-toroon63ztr-grc-42-174-91-170-42.dsl.bell.ca.56476: Flags [P.], seq 4735452:4735664, ack 2665, win 501, length 212
02:46:49.923713 IP comp3134-Winter2023.ssh > bras-base-toroon63ztr-grc-42-174-91-170-42.dsl.bell.ca.56476: Flags [P.], seq 4735664:4735876, ack 2665, win 501, length 212
02:46:49.923760 IP comp3134-Winter2023.ssh > bras-base-toroon63ztr-grc-42-174-91-170-42.dsl.bell.ca.56476: Flags [P.], seq 4735876:4736088, ack 2665, win 501, length 212
02:46:49.923830 IP comp3134-Winter2023.ssh > bras-base-toroon63ztr-grc-42-174-91-170-42.dsl.bell.ca.56476: Flags [P.], seq 4736088:4736300, ack 2665, win 501, length 212
02:46:49.923877 IP comp3134-Winter2023.ssh > bras-base-toroon63ztr-grc-42-174-91-170-42.dsl.bell.ca.56476: Flags [P.], seq 4736300:4736512, ack 2665, win 501, length 212
02:46:49.923930 IP comp3134-Winter2023.ssh > bras-base-toroon63ztr-grc-42-174-91-170-42.dsl.bell.ca.56476: Flags [P.], seq 4736512:4736724, ack 2665, win 501, length 212
02:46:49.923974 IP comp3134-Winter2023.ssh > bras-base-toroon63ztr-grc-42-174-91-170-42.dsl.bell.ca.56476: Flags [P.], seq 4736724:4736936, ack 2665, win 501, length 212
02:46:49.924018 IP comp3134-Winter2023.ssh > bras-base-toroon63ztr-grc-42-174-91-170-42.dsl.bell.ca.56476: Flags [P.], seq 4736936:4737148, ack 2665, win 501, length 212
02:46:49.924064 IP comp3134-Winter2023.ssh > bras-base-toroon63ztr-grc-42-174-91-170-42.dsl.bell.ca.56476: Flags [P.], seq 4737148:4737360, ack 2665, win 501, length 212
02:46:49.924114 IP comp3134-Winter2023.ssh > bras-base-toroon63ztr-grc-42-174-91-170-42.dsl.bell.ca.56476: Flags [P.], seq 4737360:4737572, ack 2665, win 501, length 212
02:46:49.924159 IP comp3134-Winter2023.ssh > bras-base-toroon63ztr-grc-42-174-91-170-42.dsl.bell.ca.56476: Flags [P.], seq 4737572:4737784, ack 2665, win 501, length 212
02:46:49.924213 IP comp3134-Winter2023.ssh > bras-base-toroon63ztr-grc-42-174-91-170-42.dsl.bell.ca.56476: Flags [P.], seq 4737784:4737996, ack 2665, win 501, length 212
02:46:49.924258 IP comp3134-Winter2023.ssh > bras-base-toroon63ztr-grc-42-174-91-170-42.dsl.bell.ca.56476: Flags [P.], seq 4737996:4738208, ack 2665, win 501, length 212
02:46:49.924308 IP comp3134-Winter2023.ssh > bras-base-toroon63ztr-grc-42-174-91-170-42.dsl.bell.ca.56476: Flags [P.], seq 4738208:4738420, ack 2665, win 501, length 212
02:46:49.924350 IP comp3134-Winter2023.ssh > bras-base-toroon63ztr-grc-42-174-91-170-42.dsl.bell.ca.56476: Flags [P.], seq 4738420:4738632, ack 2665, win 501, length 212
02:46:49.924400 IP comp3134-Winter2023.ssh > bras-base-toroon63ztr-grc-42-174-91-170-42.dsl.bell.ca.56476: Flags [P.], seq 4738632:4738844, ack 2665, win 501, length 212
02:46:49.924462 IP comp3134-Winter2023.ssh > bras-base-toroon63ztr-grc-42-174-91-170-42.dsl.bell.ca.56476: Flags [P.], seq 4738844:4739056, ack 2665, win 501, length 212
02:46:49.924512 IP comp3134-Winter2023.ssh > bras-base-toroon63ztr-grc-42-174-91-170-42.dsl.bell.ca.56476: Flags [P.], seq 4739056:4739268, ack 2665, win 501, length 212
02:46:49.924669 IP comp3134-Winter2023.ssh > bras-base-toroon63ztr-grc-42-174-91-170-42.dsl.bell.ca.56476: Flags [P.], seq 4739268:4739480, ack 2665, win 501, length 212
02:46:49.924723 IP comp3134-Winter2023.ssh > bras-base-toroon63ztr-grc-42-174-91-170-42.dsl.bell.ca.56476: Flags [P.], seq 4739480:4739692, ack 2665, win 501, length 212
02:46:49.924784 IP comp3134-Winter2023.ssh > bras-base-toroon63ztr-grc-42-174-91-170-42.dsl.bell.ca.56476: Flags [P.], seq 4739692:4739904, ack 2665, win 501, length 212
02:46:49.924981 IP comp3134-Winter2023.ssh > bras-base-toroon63ztr-grc-42-174-91-170-42.dsl.bell.ca.56476: Flags [P.], seq 4739904:4740116, ack 2665, win 501, length 212
02:46:49.925042 IP comp3134-Winter2023.ssh > bras-base-toroon63ztr-grc-42-174-91-170-42.dsl.bell.ca.56476: Flags [P.], seq 4740116:4740328, ack 2665, win 501, length 212
02:46:49.925092 IP comp3134-Winter2023.ssh > bras-base-toroon63ztr-grc-42-174-91-170-42.dsl.bell.ca.56476: Flags [P.], seq 4740328:4740540, ack 2665, win 501, length 212
02:46:49.925138 IP comp3134-Winter2023.ssh > bras-base-toroon63ztr-grc-42-174-91-170-42.dsl.bell.ca.56476: Flags [P.], seq 4740540:4740752, ack 2665, win 501, length 212
02:46:49.925156 IP bras-base-toroon63ztr-grc-42-174-91-170-42.dsl.bell.ca.56476 > comp3134-Winter2023.ssh: Flags [.], ack 4732976, win 8337, length 0
02:46:49.925241 IP comp3134-Winter2023.ssh > bras-base-toroon63ztr-grc-42-174-91-170-42.dsl.bell.ca.56476: Flags [P.], seq 4740752:4741108, ack 2665, win 501, length 356
02:46:49.925286 IP comp3134-Winter2023.ssh > bras-base-toroon63ztr-grc-42-174-91-170-42.dsl.bell.ca.56476: Flags [P.], seq 4741108:4741320, ack 2665, win 501, length 212
02:46:49.925328 IP comp3134-Winter2023.ssh > bras-base-toroon63ztr-grc-42-174-91-170-42.dsl.bell.ca.56476: Flags [P.], seq 4741320:4741532, ack 2665, win 501, length 212
02:46:49.925469 IP comp3134-Winter2023.ssh > bras-base-toroon63ztr-grc-42-174-91-170-42.dsl.bell.ca.56476: Flags [P.], seq 4741532:4741744, ack 2665, win 501, length 212
02:46:49.925534 IP comp3134-Winter2023.ssh > bras-base-toroon63ztr-grc-42-174-91-170-42.dsl.bell.ca.56476: Flags [P.], seq 4741744:4741956, ack 2665, win 501, length 212
02:46:49.925794 IP comp3134-Winter2023.ssh > bras-base-toroon63ztr-grc-42-174-91-170-42.dsl.bell.ca.56476: Flags [P.], seq 4741956:4742168, ack 2665, win 501, length 212
02:46:49.925869 IP comp3134-Winter2023.ssh > bras-base-toroon63ztr-grc-42-174-91-170-42.dsl.bell.ca.56476: Flags [P.], seq 4742168:4742380, ack 2665, win 501, length 212
02:46:49.926004 IP comp3134-Winter2023.ssh > bras-base-toroon63ztr-grc-42-174-91-170-42.dsl.bell.ca.56476: Flags [P.], seq 4742380:4742592, ack 2665, win 501, length 212
02:46:49.926058 IP comp3134-Winter2023.ssh > bras-base-toroon63ztr-grc-42-174-91-170-42.dsl.bell.ca.56476: Flags [P.], seq 4742592:4742804, ack 2665, win 501, length 212
02:46:49.926178 IP comp3134-Winter2023.ssh > bras-base-toroon63ztr-grc-42-174-91-170-42.dsl.bell.ca.56476: Flags [P.], seq 4742804:4743016, ack 2665, win 501, length 212
02:46:49.926230 IP comp3134-Winter2023.ssh > bras-base-toroon63ztr-grc-42-174-91-170-42.dsl.bell.ca.56476: Flags [P.], seq 4743016:4743228, ack 2665, win 501, length 212
02:46:49.926276 IP comp3134-Winter2023.ssh > bras-base-toroon63ztr-grc-42-174-91-170-42.dsl.bell.ca.56476: Flags [P.], seq 4743228:4743440, ack 2665, win 501, length 212
02:46:49.926319 IP comp3134-Winter2023.ssh > bras-base-toroon63ztr-grc-42-174-91-170-42.dsl.bell.ca.56476: Flags [P.], seq 4743440:4743652, ack 2665, win 501, length 212
02:46:49.926398 IP comp3134-Winter2023.ssh > bras-base-toroon63ztr-grc-42-174-91-170-42.dsl.bell.ca.56476: Flags [P.], seq 4743652:4743864, ack 2665, win 501, length 212
02:46:49.926448 IP comp3134-Winter2023.ssh > bras-base-toroon63ztr-grc-42-174-91-170-42.dsl.bell.ca.56476: Flags [P.], seq 4743864:4744076, ack 2665, win 501, length 212
02:46:49.926491 IP comp3134-Winter2023.ssh > bras-base-toroon63ztr-grc-42-174-91-170-42.dsl.bell.ca.56476: Flags [P.], seq 4744076:4744288, ack 2665, win 501, length 212
02:46:49.926533 IP comp3134-Winter2023.ssh > bras-base-toroon63ztr-grc-42-174-91-170-42.dsl.bell.ca.56476: Flags [P.], seq 4744288:4744500, ack 2665, win 501, length 212
02:46:49.926591 IP comp3134-Winter2023.ssh > bras-base-toroon63ztr-grc-42-174-91-170-42.dsl.bell.ca.56476: Flags [P.], seq 4744500:4744712, ack 2665, win 501, length 212
02:46:49.926660 IP comp3134-Winter2023.ssh > bras-base-toroon63ztr-grc-42-174-91-170-42.dsl.bell.ca.56476: Flags [P.], seq 4744712:4744924, ack 2665, win 501, length 212
02:46:49.926703 IP comp3134-Winter2023.ssh > bras-base-toroon63ztr-grc-42-174-91-170-42.dsl.bell.ca.56476: Flags [P.], seq 4744924:4745136, ack 2665, win 501, length 212
02:46:49.926746 IP comp3134-Winter2023.ssh > bras-base-toroon63ztr-grc-42-174-91-170-42.dsl.bell.ca.56476: Flags [P.], seq 4745136:4745348, ack 2665, win 501, length 212
02:46:49.927179 IP bras-base-toroon63ztr-grc-42-174-91-170-42.dsl.bell.ca.56476 > comp3134-Winter2023.ssh: Flags [.], ack 4738208, win 8337, length 0
02:46:49.927179 IP bras-base-toroon63ztr-grc-42-174-91-170-42.dsl.bell.ca.56476 > comp3134-Winter2023.ssh: Flags [.], ack 4738632, win 8336, length 0
02:46:49.927240 IP comp3134-Winter2023.ssh > bras-base-toroon63ztr-grc-42-174-91-170-42.dsl.bell.ca.56476: Flags [P.], seq 4745348:4745560, ack 2665, win 501, length 212
02:46:49.927399 IP comp3134-Winter2023.ssh > bras-base-toroon63ztr-grc-42-174-91-170-42.dsl.bell.ca.56476: Flags [P.], seq 4745560:4746068, ack 2665, win 501, length 508
02:46:49.927474 IP comp3134-Winter2023.ssh > bras-base-toroon63ztr-grc-42-174-91-170-42.dsl.bell.ca.56476: Flags [P.], seq 4746068:4746280, ack 2665, win 501, length 212
02:46:49.927577 IP comp3134-Winter2023.ssh > bras-base-toroon63ztr-grc-42-174-91-170-42.dsl.bell.ca.56476: Flags [P.], seq 4746280:4746492, ack 2665, win 501, length 212
02:46:49.927700 IP comp3134-Winter2023.ssh > bras-base-toroon63ztr-grc-42-174-91-170-42.dsl.bell.ca.56476: Flags [P.], seq 4746492:4746704, ack 2665, win 501, length 212
02:46:49.927889 IP comp3134-Winter2023.ssh > bras-base-toroon63ztr-grc-42-174-91-170-42.dsl.bell.ca.56476: Flags [P.], seq 4746704:4746916, ack 2665, win 501, length 212
02:46:49.927959 IP comp3134-Winter2023.ssh > bras-base-toroon63ztr-grc-42-174-91-170-42.dsl.bell.ca.56476: Flags [P.], seq 4746916:4747128, ack 2665, win 501, length 212
02:46:49.928010 IP comp3134-Winter2023.ssh > bras-base-toroon63ztr-grc-42-174-91-170-42.dsl.bell.ca.56476: Flags [P.], seq 4747128:4747340, ack 2665, win 501, length 212
02:46:49.928060 IP comp3134-Winter2023.ssh > bras-base-toroon63ztr-grc-42-174-91-170-42.dsl.bell.ca.56476: Flags [P.], seq 4747340:4747552, ack 2665, win 501, length 212
02:46:49.928188 IP comp3134-Winter2023.ssh > bras-base-toroon63ztr-grc-42-174-91-170-42.dsl.bell.ca.56476: Flags [P.], seq 4747552:4747764, ack 2665, win 501, length 212
02:46:49.928248 IP comp3134-Winter2023.ssh > bras-base-toroon63ztr-grc-42-174-91-170-42.dsl.bell.ca.56476: Flags [P.], seq 4747764:4747976, ack 2665, win 501, length 212
02:46:49.928301 IP comp3134-Winter2023.ssh > bras-base-toroon63ztr-grc-42-174-91-170-42.dsl.bell.ca.56476: Flags [P.], seq 4747976:4748188, ack 2665, win 501, length 212
02:46:49.928349 IP comp3134-Winter2023.ssh > bras-base-toroon63ztr-grc-42-174-91-170-42.dsl.bell.ca.56476: Flags [P.], seq 4748188:4748400, ack 2665, win 501, length 212
02:46:49.928400 IP comp3134-Winter2023.ssh > bras-base-toroon63ztr-grc-42-174-91-170-42.dsl.bell.ca.56476: Flags [P.], seq 4748400:4748612, ack 2665, win 501, length 212
02:46:49.928720 IP comp3134-Winter2023.ssh > bras-base-toroon63ztr-grc-42-174-91-170-42.dsl.bell.ca.56476: Flags [P.], seq 4748612:4748824, ack 2665, win 501, length 212
02:46:49.928830 IP comp3134-Winter2023.ssh > bras-base-toroon63ztr-grc-42-174-91-170-42.dsl.bell.ca.56476: Flags [P.], seq 4748824:4749036, ack 2665, win 501, length 212
02:46:49.928877 IP comp3134-Winter2023.ssh > bras-base-toroon63ztr-grc-42-174-91-170-42.dsl.bell.ca.56476: Flags [P.], seq 4749036:4749248, ack 2665, win 501, length 212
02:46:49.928915 IP comp3134-Winter2023.ssh > bras-base-toroon63ztr-grc-42-174-91-170-42.dsl.bell.ca.56476: Flags [P.], seq 4749248:4749460, ack 2665, win 501, length 212
02:46:49.928976 IP comp3134-Winter2023.ssh > bras-base-toroon63ztr-grc-42-174-91-170-42.dsl.bell.ca.56476: Flags [P.], seq 4749460:4749672, ack 2665, win 501, length 212
02:46:49.929012 IP comp3134-Winter2023.ssh > bras-base-toroon63ztr-grc-42-174-91-170-42.dsl.bell.ca.56476: Flags [P.], seq 4749672:4749884, ack 2665, win 501, length 212
02:46:49.929184 IP comp3134-Winter2023.ssh > bras-base-toroon63ztr-grc-42-174-91-170-42.dsl.bell.ca.56476: Flags [P.], seq 4749884:4750096, ack 2665, win 501, length 212
02:46:49.929210 IP bras-base-toroon63ztr-grc-42-174-91-170-42.dsl.bell.ca.56476 > comp3134-Winter2023.ssh: Flags [.], ack 4744712, win 8337, length 0
02:46:49.929283 IP comp3134-Winter2023.ssh > bras-base-toroon63ztr-grc-42-174-91-170-42.dsl.bell.ca.56476: Flags [P.], seq 4750096:4750452, ack 2665, win 501, length 356
02:46:49.929321 IP comp3134-Winter2023.ssh > bras-base-toroon63ztr-grc-42-174-91-170-42.dsl.bell.ca.56476: Flags [P.], seq 4750452:4750664, ack 2665, win 501, length 212
02:46:49.929364 IP comp3134-Winter2023.ssh > bras-base-toroon63ztr-grc-42-174-91-170-42.dsl.bell.ca.56476: Flags [P.], seq 4750664:4750876, ack 2665, win 501, length 212
02:46:49.929399 IP comp3134-Winter2023.ssh > bras-base-toroon63ztr-grc-42-174-91-170-42.dsl.bell.ca.56476: Flags [P.], seq 4750876:4751088, ack 2665, win 501, length 212
02:46:49.929434 IP comp3134-Winter2023.ssh > bras-base-toroon63ztr-grc-42-174-91-170-42.dsl.bell.ca.56476: Flags [P.], seq 4751088:4751300, ack 2665, win 501, length 212
02:46:49.929478 IP comp3134-Winter2023.ssh > bras-base-toroon63ztr-grc-42-174-91-170-42.dsl.bell.ca.56476: Flags [P.], seq 4751300:4751512, ack 2665, win 501, length 212
02:46:49.929516 IP comp3134-Winter2023.ssh > bras-base-toroon63ztr-grc-42-174-91-170-42.dsl.bell.ca.56476: Flags [P.], seq 4751512:4751724, ack 2665, win 501, length 212
02:46:49.929749 IP comp3134-Winter2023.ssh > bras-base-toroon63ztr-grc-42-174-91-170-42.dsl.bell.ca.56476: Flags [P.], seq 4751724:4751936, ack 2665, win 501, length 212
02:46:49.929836 IP comp3134-Winter2023.ssh > bras-base-toroon63ztr-grc-42-174-91-170-42.dsl.bell.ca.56476: Flags [P.], seq 4751936:4752148, ack 2665, win 501, length 212
02:46:49.929885 IP comp3134-Winter2023.ssh > bras-base-toroon63ztr-grc-42-174-91-170-42.dsl.bell.ca.56476: Flags [P.], seq 4752148:4752360, ack 2665, win 501, length 212
02:46:49.930031 IP comp3134-Winter2023.ssh > bras-base-toroon63ztr-grc-42-174-91-170-42.dsl.bell.ca.56476: Flags [P.], seq 4752360:4752572, ack 2665, win 501, length 212
