-170-42.dsl.bell.ca.56476: Flags [P.], seq 881380:881584, ack 505, win 501, length 204
02:34:45.925822 IP comp3134-Winter2023.ssh > bras-base-toroon63ztr-grc-42-174-91-170-42.dsl.bell.ca.56476: Flags [P.], seq 881584:881788, ack 505, win 501, length 204
02:34:45.925889 IP comp3134-Winter2023.ssh > bras-base-toroon63ztr-grc-42-174-91-170-42.dsl.bell.ca.56476: Flags [P.], seq 881788:881992, ack 505, win 501, length 204
02:34:45.925937 IP comp3134-Winter2023.ssh > bras-base-toroon63ztr-grc-42-174-91-170-42.dsl.bell.ca.56476: Flags [P.], seq 881992:882196, ack 505, win 501, length 204
02:34:45.925984 IP comp3134-Winter2023.ssh > bras-base-toroon63ztr-grc-42-174-91-170-42.dsl.bell.ca.56476: Flags [P.], seq 882196:882400, ack 505, win 501, length 204
02:34:45.926029 IP comp3134-Winter2023.ssh > bras-base-toroon63ztr-grc-42-174-91-170-42.dsl.bell.ca.56476: Flags [P.], seq 882400:882604, ack 505, win 501, length 204
02:34:45.926098 IP comp3134-Winter2023.ssh > bras-base-toroon63ztr-grc-42-174-91-170-42.dsl.bell.ca.56476: Flags [P.], seq 882604:882808, ack 505, win 501, length 204
02:34:45.926145 IP comp3134-Winter2023.ssh > bras-base-toroon63ztr-grc-42-174-91-170-42.dsl.bell.ca.56476: Flags [P.], seq 882808:883012, ack 505, win 501, length 204
02:34:45.926193 IP comp3134-Winter2023.ssh > bras-base-toroon63ztr-grc-42-174-91-170-42.dsl.bell.ca.56476: Flags [P.], seq 883012:883216, ack 505, win 501, length 204
02:34:45.926239 IP comp3134-Winter2023.ssh > bras-base-toroon63ztr-grc-42-174-91-170-42.dsl.bell.ca.56476: Flags [P.], seq 883216:883420, ack 505, win 501, length 204
02:34:45.926276 IP comp3134-Winter2023.ssh > bras-base-toroon63ztr-grc-42-174-91-170-42.dsl.bell.ca.56476: Flags [P.], seq 883420:883624, ack 505, win 501, length 204
02:34:45.926315 IP comp3134-Winter2023.ssh > bras-base-toroon63ztr-grc-42-174-91-170-42.dsl.bell.ca.56476: Flags [P.], seq 883624:883828, ack 505, win 501, length 204
02:34:45.926350 IP comp3134-Winter2023.ssh > bras-base-toroon63ztr-grc-42-174-91-170-42.dsl.bell.ca.56476: Flags [P.], seq 883828:884032, ack 505, win 501, length 204
02:34:45.926387 IP comp3134-Winter2023.ssh > bras-base-toroon63ztr-grc-42-174-91-170-42.dsl.bell.ca.56476: Flags [P.], seq 884032:884236, ack 505, win 501, length 204
02:34:45.926422 IP comp3134-Winter2023.ssh > bras-base-toroon63ztr-grc-42-174-91-170-42.dsl.bell.ca.56476: Flags [P.], seq 884236:884440, ack 505, win 501, length 204
02:34:45.926458 IP comp3134-Winter2023.ssh > bras-base-toroon63ztr-grc-42-174-91-170-42.dsl.bell.ca.56476: Flags [P.], seq 884440:884644, ack 505, win 501, length 204
02:34:45.926474 IP bras-base-toroon63ztr-grc-42-174-91-170-42.dsl.bell.ca.56476 > comp3134-Winter2023.ssh: Flags [.], ack 875720, win 516, length 0
02:34:45.926544 IP comp3134-Winter2023.ssh > bras-base-toroon63ztr-grc-42-174-91-170-42.dsl.bell.ca.56476: Flags [P.], seq 884644:885000, ack 505, win 501, length 356
02:34:45.926591 IP comp3134-Winter2023.ssh > bras-base-toroon63ztr-grc-42-174-91-170-42.dsl.bell.ca.56476: Flags [P.], seq 885000:885204, ack 505, win 501, length 204
02:34:45.926637 IP comp3134-Winter2023.ssh > bras-base-toroon63ztr-grc-42-174-91-170-42.dsl.bell.ca.56476: Flags [P.], seq 885204:885408, ack 505, win 501, length 204
02:34:45.926687 IP comp3134-Winter2023.ssh > bras-base-toroon63ztr-grc-42-174-91-170-42.dsl.bell.ca.56476: Flags [P.], seq 885408:885612, ack 505, win 501, length 204
02:34:45.927084 IP comp3134-Winter2023.ssh > bras-base-toroon63ztr-grc-42-174-91-170-42.dsl.bell.ca.56476: Flags [P.], seq 885612:885816, ack 505, win 501, length 204
02:34:45.927279 IP comp3134-Winter2023.ssh > bras-base-toroon63ztr-grc-42-174-91-170-42.dsl.bell.ca.56476: Flags [P.], seq 885816:886020, ack 505, win 501, length 204
02:34:45.927391 IP comp3134-Winter2023.ssh > bras-base-toroon63ztr-grc-42-174-91-170-42.dsl.bell.ca.56476: Flags [P.], seq 886020:886224, ack 505, win 501, length 204
02:34:45.927470 IP comp3134-Winter2023.ssh > bras-base-toroon63ztr-grc-42-174-91-170-42.dsl.bell.ca.56476: Flags [P.], seq 886224:886428, ack 505, win 501, length 204
02:34:45.927564 IP comp3134-Winter2023.ssh > bras-base-toroon63ztr-grc-42-174-91-170-42.dsl.bell.ca.56476: Flags [P.], seq 886428:886632, ack 505, win 501, length 204
02:34:45.927611 IP comp3134-Winter2023.ssh > bras-base-toroon63ztr-grc-42-174-91-170-42.dsl.bell.ca.56476: Flags [P.], seq 886632:886836, ack 505, win 501, length 204
02:34:45.927650 IP comp3134-Winter2023.ssh > bras-base-toroon63ztr-grc-42-174-91-170-42.dsl.bell.ca.56476: Flags [P.], seq 886836:887040, ack 505, win 501, length 204
02:34:45.934309 IP bras-base-toroon63ztr-grc-42-174-91-170-42.dsl.bell.ca.56476 > comp3134-Winter2023.ssh: Flags [.], ack 880768, win 516, length 0
02:34:45.934310 IP bras-base-toroon63ztr-grc-42-174-91-170-42.dsl.bell.ca.56476 > comp3134-Winter2023.ssh: Flags [.], ack 886632, win 516, length 0
02:34:45.934310 IP bras-base-toroon63ztr-grc-42-174-91-170-42.dsl.bell.ca.56476 > comp3134-Winter2023.ssh: Flags [P.], seq 505:541, ack 886632, win 516, length 36
02:34:45.934414 IP comp3134-Winter2023.ssh > bras-base-toroon63ztr-grc-42-174-91-170-42.dsl.bell.ca.56476: Flags [P.], seq 887040:887244, ack 505, win 501, length 204
02:34:45.934857 IP comp3134-Winter2023.ssh > bras-base-toroon63ztr-grc-42-174-91-170-42.dsl.bell.ca.56476: Flags [P.], seq 887244:887912, ack 541, win 501, length 668
02:34:45.934946 IP comp3134-Winter2023.ssh > bras-base-toroon63ztr-grc-42-174-91-170-42.dsl.bell.ca.56476: Flags [P.], seq 887912:888116, ack 541, win 501, length 204
02:34:45.934998 IP comp3134-Winter2023.ssh > bras-base-toroon63ztr-grc-42-174-91-170-42.dsl.bell.ca.56476: Flags [P.], seq 888116:888320, ack 541, win 501, length 204
02:34:45.935049 IP comp3134-Winter2023.ssh > bras-base-toroon63ztr-grc-42-174-91-170-42.dsl.bell.ca.56476: Flags [P.], seq 888320:888524, ack 541, win 501, length 204
02:34:45.935091 IP comp3134-Winter2023.ssh > bras-base-toroon63ztr-grc-42-174-91-170-42.dsl.bell.ca.56476: Flags [P.], seq 888524:888728, ack 541, win 501, length 204
02:34:45.935160 IP comp3134-Winter2023.ssh > bras-base-toroon63ztr-grc-42-174-91-170-42.dsl.bell.ca.56476: Flags [P.], seq 888728:888932, ack 541, win 501, length 204
02:34:45.935265 IP comp3134-Winter2023.ssh > bras-base-toroon63ztr-grc-42-174-91-170-42.dsl.bell.ca.56476: Flags [P.], seq 888932:889136, ack 541, win 501, length 204
02:34:45.935322 IP comp3134-Winter2023.ssh > bras-base-toroon63ztr-grc-42-174-91-170-42.dsl.bell.ca.56476: Flags [P.], seq 889136:889340, ack 541, win 501, length 204
02:34:45.935376 IP comp3134-Winter2023.ssh > bras-base-toroon63ztr-grc-42-174-91-170-42.dsl.bell.ca.56476: Flags [P.], seq 889340:889544, ack 541, win 501, length 204
02:34:45.935441 IP comp3134-Winter2023.ssh > bras-base-toroon63ztr-grc-42-174-91-170-42.dsl.bell.ca.56476: Flags [P.], seq 889544:889748, ack 541, win 501, length 204
02:34:45.935488 IP comp3134-Winter2023.ssh > bras-base-toroon63ztr-grc-42-174-91-170-42.dsl.bell.ca.56476: Flags [P.], seq 889748:889952, ack 541, win 501, length 204
02:34:45.935537 IP comp3134-Winter2023.ssh > bras-base-toroon63ztr-grc-42-174-91-170-42.dsl.bell.ca.56476: Flags [P.], seq 889952:890156, ack 541, win 501, length 204
02:34:45.935585 IP comp3134-Winter2023.ssh > bras-base-toroon63ztr-grc-42-174-91-170-42.dsl.bell.ca.56476: Flags [P.], seq 890156:890360, ack 541, win 501, length 204
02:34:45.935632 IP comp3134-Winter2023.ssh > bras-base-toroon63ztr-grc-42-174-91-170-42.dsl.bell.ca.56476: Flags [P.], seq 890360:890564, ack 541, win 501, length 204
02:34:45.935680 IP comp3134-Winter2023.ssh > bras-base-toroon63ztr-grc-42-174-91-170-42.dsl.bell.ca.56476: Flags [P.], seq 890564:890768, ack 541, win 501, length 204
02:34:45.936100 IP comp3134-Winter2023.ssh > bras-base-toroon63ztr-grc-42-174-91-170-42.dsl.bell.ca.56476: Flags [P.], seq 890768:890972, ack 541, win 501, length 204
02:34:45.936342 IP comp3134-Winter2023.ssh > bras-base-toroon63ztr-grc-42-174-91-170-42.dsl.bell.ca.56476: Flags [P.], seq 890972:891176, ack 541, win 501, length 204
02:34:45.936543 IP bras-base-toroon63ztr-grc-42-174-91-170-42.dsl.bell.ca.56476 > comp3134-Winter2023.ssh: Flags [.], ack 887040, win 514, length 0
02:34:45.936578 IP comp3134-Winter2023.ssh > bras-base-toroon63ztr-grc-42-174-91-170-42.dsl.bell.ca.56476: Flags [P.], seq 891176:891380, ack 541, win 501, length 204
02:34:45.936671 IP comp3134-Winter2023.ssh > bras-base-toroon63ztr-grc-42-174-91-170-42.dsl.bell.ca.56476: Flags [P.], seq 891380:891736, ack 541, win 501, length 356
02:34:45.936709 IP comp3134-Winter2023.ssh > bras-base-toroon63ztr-grc-42-174-91-170-42.dsl.bell.ca.56476: Flags [P.], seq 891736:891940, ack 541, win 501, length 204
02:34:45.936748 IP comp3134-Winter2023.ssh > bras-base-toroon63ztr-grc-42-174-91-170-42.dsl.bell.ca.56476: Flags [P.], seq 891940:892144, ack 541, win 501, length 204
02:34:45.936796 IP comp3134-Winter2023.ssh > bras-base-toroon63ztr-grc-42-174-91-170-42.dsl.bell.ca.56476: Flags [P.], seq 892144:892348, ack 541, win 501, length 204
02:34:45.936837 IP comp3134-Winter2023.ssh > bras-base-toroon63ztr-grc-42-174-91-170-42.dsl.bell.ca.56476: Flags [P.], seq 892348:892552, ack 541, win 501, length 204
02:34:45.938530 IP bras-base-toroon63ztr-grc-42-174-91-170-42.dsl.bell.ca.56476 > comp3134-Winter2023.ssh: Flags [.], ack 890564, win 516, length 0
02:34:45.938599 IP comp3134-Winter2023.ssh > bras-base-toroon63ztr-grc-42-174-91-170-42.dsl.bell.ca.56476: Flags [P.], seq 892552:892756, ack 541, win 501, length 204
02:34:45.939165 IP comp3134-Winter2023.ssh > bras-base-toroon63ztr-grc-42-174-91-170-42.dsl.bell.ca.56476: Flags [P.], seq 892756:893112, ack 541, win 501, length 356
02:34:45.939289 IP comp3134-Winter2023.ssh > bras-base-toroon63ztr-grc-42-174-91-170-42.dsl.bell.ca.56476: Flags [P.], seq 893112:893316, ack 541, win 501, length 204
02:34:45.939345 IP comp3134-Winter2023.ssh > bras-base-toroon63ztr-grc-42-174-91-170-42.dsl.bell.ca.56476: Flags [P.], seq 893316:893520, ack 541, win 501, length 204
02:34:45.939394 IP comp3134-Winter2023.ssh > bras-base-toroon63ztr-grc-42-174-91-170-42.dsl.bell.ca.56476: Flags [P.], seq 893520:893724, ack 541, win 501, length 204
02:34:45.939442 IP comp3134-Winter2023.ssh > bras-base-toroon63ztr-grc-42-174-91-170-42.dsl.bell.ca.56476: Flags [P.], seq 893724:893928, ack 541, win 501, length 204
02:34:45.939492 IP comp3134-Winter2023.ssh > bras-base-toroon63ztr-grc-42-174-91-170-42.dsl.bell.ca.56476: Flags [P.], seq 893928:894132, ack 541, win 501, length 204
02:34:45.939540 IP comp3134-Winter2023.ssh > bras-base-toroon63ztr-grc-42-174-91-170-42.dsl.bell.ca.56476: Flags [P.], seq 894132:894336, ack 541, win 501, length 204
02:34:45.939742 IP comp3134-Winter2023.ssh > bras-base-toroon63ztr-grc-42-174-91-170-42.dsl.bell.ca.56476: Flags [P.], seq 894336:894540, ack 541, win 501, length 204
02:34:45.939816 IP comp3134-Winter2023.ssh > bras-base-toroon63ztr-grc-42-174-91-170-42.dsl.bell.ca.56476: Flags [P.], seq 894540:894744, ack 541, win 501, length 204
02:34:45.939938 IP comp3134-Winter2023.ssh > bras-base-toroon63ztr-grc-42-174-91-170-42.dsl.bell.ca.56476: Flags [P.], seq 894744:894948, ack 541, win 501, length 204
02:34:45.939987 IP comp3134-Winter2023.ssh > bras-base-toroon63ztr-grc-42-174-91-170-42.dsl.bell.ca.56476: Flags [P.], seq 894948:895152, ack 541, win 501, length 204
02:34:45.940340 IP comp3134-Winter2023.ssh > bras-base-toroon63ztr-grc-42-174-91-170-42.dsl.bell.ca.56476: Flags [P.], seq 895152:895356, ack 541, win 501, length 204
02:34:45.940507 IP bras-base-toroon63ztr-grc-42-174-91-170-42.dsl.bell.ca.56476 > comp3134-Winter2023.ssh: Flags [.], ack 892348, win 516, length 0
02:34:45.940643 IP comp3134-Winter2023.ssh > bras-base-toroon63ztr-grc-42-174-91-170-42.dsl.bell.ca.56476: Flags [P.], seq 895356:895560, ack 541, win 501, length 204
02:34:45.940692 IP comp3134-Winter2023.ssh > bras-base-toroon63ztr-grc-42-174-91-170-42.dsl.bell.ca.56476: Flags [P.], seq 895560:895952, ack 541, win 501, length 392
02:34:45.940732 IP comp3134-Winter2023.ssh > bras-base-toroon63ztr-grc-42-174-91-170-42.dsl.bell.ca.56476: Flags [P.], seq 895952:896156, ack 541, win 501, length 204
02:34:45.940768 IP comp3134-Winter2023.ssh > bras-base-toroon63ztr-grc-42-174-91-170-42.dsl.bell.ca.56476: Flags [P.], seq 896156:896360, ack 541, win 501, length 204
02:34:45.940805 IP comp3134-Winter2023.ssh > bras-base-toroon63ztr-grc-42-174-91-170-42.dsl.bell.ca.56476: Flags [P.], seq 896360:896564, ack 541, win 501, length 204
02:34:45.940840 IP comp3134-Winter2023.ssh > bras-base-toroon63ztr-grc-42-174-91-170-42.dsl.bell.ca.56476: Flags [P.], seq 896564:896768, ack 541, win 501, length 204
02:34:45.940875 IP comp3134-Winter2023.ssh > bras-base-toroon63ztr-grc-42-174-91-170-42.dsl.bell.ca.56476: Flags [P.], seq 896768:896972, ack 541, win 501, length 204
02:34:45.941651 IP bras-base-toroon63ztr-grc-42-174-91-170-42.dsl.bell.ca.56476 > comp3134-Winter2023.ssh: Flags [.], ack 894336, win 516, length 0
02:34:45.941707 IP comp3134-Winter2023.ssh > bras-base-toroon63ztr-grc-42-174-91-170-42.dsl.bell.ca.56476: Flags [P.], seq 896972:897176, ack 541, win 501, length 204
02:34:45.941889 IP comp3134-Winter2023.ssh > bras-base-toroon63ztr-grc-42-174-91-170-42.dsl.bell.ca.56476: Flags [P.], seq 897176:897532, ack 541, win 501, length 356
02:34:45.941966 IP comp3134-Winter2023.ssh > bras-base-toroon63ztr-grc-42-174-91-170-42.dsl.bell.ca.56476: Flags [P.], seq 897532:897736, ack 541, win 501, length 204
02:34:45.942287 IP comp3134-Winter2023.ssh > bras-base-toroon63ztr-grc-42-174-91-170-42.dsl.bell.ca.56476: Flags [P.], seq 897736:897940, ack 541, win 501, length 204
02:34:45.942568 IP comp3134-Winter2023.ssh > bras-base-toroon63ztr-grc-42-174-91-170-42.dsl.bell.ca.56476: Flags [P.], seq 897940:898144, ack 541, win 501, length 204
02:34:45.942841 IP comp3134-Winter2023.ssh > bras-base-toroon63ztr-grc-42-174-91-170-42.dsl.bell.ca.56476: Flags [P.], seq 898144:898348, ack 541, win 501, length 204
02:34:45.943089 IP comp3134-Winter2023.ssh > bras-base-toroon63ztr-grc-42-174-91-170-42.dsl.bell.ca.56476: Flags [P.], seq 898348:898552, ack 541, win 501, length 204
02:34:45.943210 IP comp3134-Winter2023.ssh > bras-base-toroon63ztr-grc-42-174-91-170-42.dsl.bell.ca.56476: Flags [P.], seq 898552:898756, ack 541, win 501, length 204
02:34:45.943266 IP comp3134-Winter2023.ssh > bras-base-toroon63ztr-grc-42-174-91-170-42.dsl.bell.ca.56476: Flags [P.], seq 898756:898960, ack 541, win 501, length 204
02:34:45.943303 IP comp3134-Winter2023.ssh > bras-base-toroon63ztr-grc-42-174-91-170-42.dsl.bell.ca.56476: Flags [P.], seq 898960:899164, ack 541, win 501, length 204
02:34:45.943339 IP comp3134-Winter2023.ssh > bras-base-toroon63ztr-grc-42-174-91-170-42.dsl.bell.ca.56476: Flags [P.], seq 899164:899368, ack 541, win 501, length 204
02:34:45.943374 IP comp3134-Winter2023.ssh > bras-base-toroon63ztr-grc-42-174-91-170-42.dsl.bell.ca.56476: Flags [P.], seq 899368:899572, ack 541, win 501, length 204
02:34:45.943411 IP comp3134-Winter2023.ssh > bras-base-toroon63ztr-grc-42-174-91-170-42.dsl.bell.ca.56476: Flags [P.], seq 899572:899776, ack 541, win 501, length 204
02:34:45.943447 IP comp3134-Winter2023.ssh > bras-base-toroon63ztr-grc-42-174-91-170-42.dsl.bell.ca.56476: Flags [P.], seq 899776:899980, ack 541, win 501, length 204
02:34:45.943484 IP comp3134-Winter2023.ssh > bras-base-toroon63ztr-grc-42-174-91-170-42.dsl.bell.ca.56476: Flags [P.], seq 899980:900184, ack 541, win 501, length 204
02:34:45.943518 IP comp3134-Winter2023.ssh > bras-base-toroon63ztr-grc-42-174-91-170-42.dsl.bell.ca.56476: Flags [P.], seq 900184:900388, ack 541, win 501, length 204
02:34:45.943554 IP comp3134-Winter2023.ssh > bras-base-toroon63ztr-grc-42-174-91-170-42.dsl.bell.ca.56476: Flags [P.], seq 900388:900592, ack 541, win 501, length 204
02:34:45.943588 IP comp3134-Winter2023.ssh > bras-base-toroon63ztr-grc-42-174-91-170-42.dsl.bell.ca.56476: Flags [P.], seq 900592:900796, ack 541, win 501, length 204
02:34:45.943625 IP comp3134-Winter2023.ssh > bras-base-toroon63ztr-grc-42-174-91-170-42.dsl.bell.ca.56476: Flags [P.], seq 900796:901000, ack 541, win 501, length 204
02:34:45.943660 IP comp3134-Winter2023.ssh > bras-base-toroon63ztr-grc-42-174-91-170-42.dsl.bell.ca.56476: Flags [P.], seq 901000:901204, ack 541, win 501, length 204
02:34:45.943696 IP comp3134-Winter2023.ssh > bras-base-toroon63ztr-grc-42-174-91-170-42.dsl.bell.ca.56476: Flags [P.], seq 901204:901408, ack 541, win 501, length 204
02:34:45.943737 IP comp3134-Winter2023.ssh > bras-base-toroon63ztr-grc-42-174-91-170-42.dsl.bell.ca.56476: Flags [P.], seq 901408:901612, ack 541, win 501, length 204
02:34:45.943774 IP comp3134-Winter2023.ssh > bras-base-toroon63ztr-grc-42-174-91-170-42.dsl.bell.ca.56476: Flags [P.], seq 901612:901816, ack 541, win 501, length 204
02:34:45.943809 IP comp3134-Winter2023.ssh > bras-base-toroon63ztr-grc-42-174-91-170-42.dsl.bell.ca.56476: Flags [P.], seq 901816:902020, ack 541, win 501, length 204
02:34:45.943978 IP comp3134-Winter2023.ssh > bras-base-toroon63ztr-grc-42-174-91-170-42.dsl.bell.ca.56476: Flags [P.], seq 902020:902224, ack 541, win 501, length 204
02:34:45.944042 IP comp3134-Winter2023.ssh > bras-base-toroon63ztr-grc-42-174-91-170-42.dsl.bell.ca.56476: Flags [P.], seq 902224:902428, ack 541, win 501, length 204
02:34:45.944093 IP comp3134-Winter2023.ssh > bras-base-toroon63ztr-grc-42-174-91-170-42.dsl.bell.ca.56476: Flags [P.], seq 902428:902632, ack 541, win 501, length 204
02:34:45.944141 IP comp3134-Winter2023.ssh > bras-base-toroon63ztr-grc-42-174-91-170-42.dsl.bell.ca.56476: Flags [P.], seq 902632:902836, ack 541, win 501, length 204
02:34:45.944191 IP comp3134-Winter2023.ssh > bras-base-toroon63ztr-grc-42-174-91-170-42.dsl.bell.ca.56476: Flags [P.], seq 902836:903040, ack 541, win 501, length 204
02:34:45.944239 IP comp3134-Winter2023.ssh > bras-base-toroon63ztr-grc-42-174-91-170-42.dsl.bell.ca.56476: Flags [P.], seq 903040:903244, ack 541, win 501, length 204
02:34:45.944287 IP comp3134-Winter2023.ssh > bras-base-toroon63ztr-grc-42-174-91-170-42.dsl.bell.ca.56476: Flags [P.], seq 903244:903448, ack 541, win 501, length 204
02:34:45.944499 IP bras-base-toroon63ztr-grc-42-174-91-170-42.dsl.bell.ca.56476 > comp3134-Winter2023.ssh: Flags [.], ack 896972, win 516, length 0
02:34:45.944527 IP comp3134-Winter2023.ssh > bras-base-toroon63ztr-grc-42-174-91-170-42.dsl.bell.ca.56476: Flags [P.], seq 903448:903652, ack 541, win 501, length 204
02:34:45.944594 IP comp3134-Winter2023.ssh > bras-base-toroon63ztr-grc-42-174-91-170-42.dsl.bell.ca.56476: Flags [P.], seq 903652:904008, ack 541, win 501, length 356
02:34:45.944640 IP comp3134-Winter2023.ssh > bras-base-toroon63ztr-grc-42-174-91-170-42.dsl.bell.ca.56476: Flags [P.], seq 904008:904212, ack 541, win 501, length 204
02:34:45.944724 IP comp3134-Winter2023.ssh > bras-base-toroon63ztr-grc-42-174-91-170-42.dsl.bell.ca.56476: Flags [P.], seq 904212:904416, ack 541, win 501, length 204
02:34:45.944776 IP comp3134-Winter2023.ssh > bras-base-toroon63ztr-grc-42-174-91-170-42.dsl.bell.ca.56476: Flags [P.], seq 904416:904620, ack 541, win 501, length 204
02:34:45.944968 IP comp3134-Winter2023.ssh > bras-base-toroon63ztr-grc-42-174-91-170-42.dsl.bell.ca.56476: Flags [P.], seq 904620:904824, ack 541, win 501, length 204
02:34:45.945060 IP comp3134-Winter2023.ssh > bras-base-toroon63ztr-grc-42-174-91-170-42.dsl.bell.ca.56476: Flags [P.], seq 904824:905028, ack 541, win 501, length 204
02:34:45.945104 IP comp3134-Winter2023.ssh > bras-base-toroon63ztr-grc-42-174-91-170-42.dsl.bell.ca.56476: Flags [P.], seq 905028:905232, ack 541, win 501, length 204
02:34:45.945669 IP comp3134-Winter2023.ssh > bras-base-toroon63ztr-grc-42-174-91-170-42.dsl.bell.ca.56476: Flags [P.], seq 905232:905436, ack 541, win 501, length 204
02:34:45.946100 IP comp3134-Winter2023.ssh > bras-base-toroon63ztr-grc-42-174-91-170-42.dsl.bell.ca.56476: Flags [P.], seq 905436:905640, ack 541, win 501, length 204
02:34:45.946179 IP comp3134-Winter2023.ssh > bras-base-toroon63ztr-grc-42-174-91-170-42.dsl.bell.ca.56476: Flags [P.], seq 905640:905844, ack 541, win 501, length 204
02:34:45.946379 IP comp3134-Winter2023.ssh > bras-base-toroon63ztr-grc-42-174-91-170-42.dsl.bell.ca.56476: Flags [P.], seq 905844:906048, ack 541, win 501, length 204
02:34:45.946501 IP bras-base-toroon63ztr-grc-42-174-91-170-42.dsl.bell.ca.56476 > comp3134-Winter2023.ssh: Flags [.], ack 901204, win 516, length 0
02:34:45.946642 IP comp3134-Winter2023.ssh > bras-base-toroon63ztr-grc-42-174-91-170-42.dsl.bell.ca.56476: Flags [P.], seq 906048:906404, ack 541, win 501, length 356
02:34:45.946741 IP comp3134-Winter2023.ssh > bras-base-toroon63ztr-grc-42-174-91-170-42.dsl.bell.ca.56476: Flags [P.], seq 906404:906608, ack 541, win 501, length 204
02:34:45.946803 IP comp3134-Winter2023.ssh > bras-base-toroon63ztr-grc-42-174-91-170-42.dsl.bell.ca.56476: Flags [P.], seq 906608:906812, ack 541, win 501, length 204
02:34:45.946851 IP comp3134-Winter2023.ssh > bras-base-toroon63ztr-grc-42-174-91-170-42.dsl.bell.ca.56476: Flags [P.], seq 906812:907016, ack 541, win 501, length 204
02:34:45.947041 IP comp3134-Winter2023.ssh > bras-base-toroon63ztr-grc-42-174-91-170-42.dsl.bell.ca.56476: Flags [P.], seq 907016:907220, ack 541, win 501, length 204
02:34:45.947525 IP bras-base-toroon63ztr-grc-42-174-91-170-42.dsl.bell.ca.56476 > comp3134-Winter2023.ssh: Flags [.], ack 901816, win 513, length 0
02:34:45.947599 IP comp3134-Winter2023.ssh > bras-base-toroon63ztr-grc-42-174-91-170-42.dsl.bell.ca.56476: Flags [P.], seq 907220:907424, ack 541, win 501, length 204
02:34:45.947701 IP comp3134-Winter2023.ssh > bras-base-toroon63ztr-grc-42-174-91-170-42.dsl.bell.ca.56476: Flags [P.], seq 907424:907780, ack 541, win 501, length 356
02:34:45.947787 IP bras-base-toroon63ztr-grc-42-174-91-170-42.dsl.bell.ca.56476 > comp3134-Winter2023.ssh: Flags [.], ack 905232, win 516, length 0
02:34:45.947813 IP comp3134-Winter2023.ssh > bras-base-toroon63ztr-grc-42-174-91-170-42.dsl.bell.ca.56476: Flags [P.], seq 907780:907984, ack 541, win 501, length 204
02:34:45.947885 IP comp3134-Winter2023.ssh > bras-base-toroon63ztr-grc-42-174-91-170-42.dsl.bell.ca.56476: Flags [P.], seq 907984:908340, ack 541, win 501, length 356
02:34:45.947941 IP comp3134-Winter2023.ssh > bras-base-toroon63ztr-grc-42-174-91-170-42.dsl.bell.ca.56476: Flags [P.], seq 908340:908544, ack 541, win 501, length 204
02:34:45.947984 IP comp3134-Winter2023.ssh > bras-base-toroon63ztr-grc-42-174-91-170-42.dsl.bell.ca.56476: Flags [P.], seq 908544:908748, ack 541, win 501, length 204
02:34:45.948030 IP comp3134-Winter2023.ssh > bras-base-toroon63ztr-grc-42-174-91-170-42.dsl.bell.ca.56476: Flags [P.], seq 908748:908952, ack 541, win 501, length 204
02:34:45.948084 IP comp3134-Winter2023.ssh > bras-base-toroon63ztr-grc-42-174-91-170-42.dsl.bell.ca.56476: Flags [P.], seq 908952:909156, ack 541, win 501, length 204
02:34:45.948141 IP comp3134-Winter2023.ssh > bras-base-toroon63ztr-grc-42-174-91-170-42.dsl.bell.ca.56476: Flags [P.], seq 909156:909360, ack 541, win 501, length 204
02:34:45.948199 IP comp3134-Winter2023.ssh > bras-base-toroon63ztr-grc-42-174-91-170-42.dsl.bell.ca.56476: Flags [P.], seq 909360:909564, ack 541, win 501, length 204
02:34:45.948244 IP comp3134-Winter2023.ssh > bras-base-toroon63ztr-grc-42-174-91-170-42.dsl.bell.ca.56476: Flags [P.], seq 909564:909768, ack 541, win 501, length 204
02:34:45.948289 IP comp3134-Winter2023.ssh > bras-base-toroon63ztr-grc-42-174-91-170-42.dsl.bell.ca.56476: Flags [P.], seq 909768:909972, ack 541, win 501, length 204
02:34:45.948332 IP comp3134-Winter2023.ssh > bras-base-toroon63ztr-grc-42-174-91-170-42.dsl.bell.ca.56476: Flags [P.], seq 909972:910176, ack 541, win 501, length 204
02:34:45.948372 IP comp3134-Winter2023.ssh > bras-base-toroon63ztr-grc-42-174-91-170-42.dsl.bell.ca.56476: Flags [P.], seq 910176:910380, ack 541, win 501, length 204
02:34:45.948420 IP comp3134-Winter2023.ssh > bras-base-toroon63ztr-grc-42-174-91-170-42.dsl.bell.ca.56476: Flags [P.], seq 910380:910584, ack 541, win 501, length 204
02:34:45.948466 IP comp3134-Winter2023.ssh > bras-base-toroon63ztr-grc-42-174-91-170-42.dsl.bell.ca.56476: Flags [P.], seq 910584:910788, ack 541, win 501, length 204
02:34:45.948515 IP comp3134-Winter2023.ssh > bras-base-toroon63ztr-grc-42-174-91-170-42.dsl.bell.ca.56476: Flags [P.], seq 910788:910992, ack 541, win 501, length 204
02:34:45.948551 IP comp3134-Winter2023.ssh > bras-base-toroon63ztr-grc-42-174-91-170-42.dsl.bell.ca.56476: Flags [P.], seq 910992:911196, ack 541, win 501, length 204
02:34:45.948661 IP comp3134-Winter2023.ssh > bras-base-toroon63ztr-grc-42-174-91-170-42.dsl.bell.ca.56476: Flags [P.], seq 911196:911400, ack 541, win 501, length 204
02:34:45.948733 IP comp3134-Winter2023.ssh > bras-base-toroon63ztr-grc-42-174-91-170-42.dsl.bell.ca.56476: Flags [P.], seq 911400:911604, ack 541, win 501, length 204
02:34:45.948783 IP comp3134-Winter2023.ssh > bras-base-toroon63ztr-grc-42-174-91-170-42.dsl.bell.ca.56476: Flags [P.], seq 911604:911808, ack 541, win 501, length 204
02:34:45.948846 IP comp3134-Winter2023.ssh > bras-base-toroon63ztr-grc-42-174-91-170-42.dsl.bell.ca.56476: Flags [P.], seq 911808:912012, ack 541, win 501, length 204
02:34:45.948898 IP comp3134-Winter2023.ssh > bras-base-toroon63ztr-grc-42-174-91-170-42.dsl.bell.ca.56476: Flags [P.], seq 912012:912216, ack 541, win 501, length 204
02:34:45.948942 IP comp3134-Winter2023.ssh > bras-base-toroon63ztr-grc-42-174-91-170-42.dsl.bell.ca.56476: Flags [P.], seq 912216:912420, ack 541, win 501, length 204
02:34:45.948987 IP comp3134-Winter2023.ssh > bras-base-toroon63ztr-grc-42-174-91-170-42.dsl.bell.ca.56476: Flags [P.], seq 912420:912624, ack 541, win 501, length 204
02:34:45.949089 IP comp3134-Winter2023.ssh > bras-base-toroon63ztr-grc-42-174-91-170-42.dsl.bell.ca.56476: Flags [P.], seq 912624:912828, ack 541, win 501, length 204
02:34:45.949140 IP comp3134-Winter2023.ssh > bras-base-toroon63ztr-grc-42-174-91-170-42.dsl.bell.ca.56476: Flags [P.], seq 912828:913032, ack 541, win 501, length 204
02:34:45.949735 IP comp3134-Winter2023.ssh > bras-base-toroon63ztr-grc-42-174-91-170-42.dsl.bell.ca.56476: Flags [P.], seq 913032:913236, ack 541, win 501, length 204
02:34:45.949903 IP comp3134-Winter2023.ssh > bras-base-toroon63ztr-grc-42-174-91-170-42.dsl.bell.ca.56476: Flags [P.], seq 913236:913440, ack 541, win 501, length 204
02:34:45.950133 IP comp3134-Winter2023.ssh > bras-base-toroon63ztr-grc-42-174-91-170-42.dsl.bell.ca.56476: Flags [P.], seq 913440:913644, ack 541, win 501, length 204
02:34:45.950362 IP comp3134-Winter2023.ssh > bras-base-toroon63ztr-grc-42-174-91-170-42.dsl.bell.ca.56476: Flags [P.], seq 913644:913848, ack 541, win 501, length 204
02:34:45.950477 IP bras-base-toroon63ztr-grc-42-174-91-170-42.dsl.bell.ca.56476 > comp3134-Winter2023.ssh: Flags [.], ack 907780, win 516, length 0
02:34:45.950582 IP comp3134-Winter2023.ssh > bras-base-toroon63ztr-grc-42-174-91-170-42.dsl.bell.ca.56476: Flags [P.], seq 913848:914204, ack 541, win 501, length 356
02:34:45.950735 IP comp3134-Winter2023.ssh > bras-base-toroon63ztr-grc-42-174-91-170-42.dsl.bell.ca.56476: Flags [P.], seq 914204:914408, ack 541, win 501, length 204
02:34:45.950860 IP comp3134-Winter2023.ssh > bras-base-toroon63ztr-grc-42-174-91-170-42.dsl.bell.ca.56476: Flags [P.], seq 914408:914612, ack 541, win 501, length 204
02:34:45.950920 IP comp3134-Winter2023.ssh > bras-base-toroon63ztr-grc-42-174-91-170-42.dsl.bell.ca.56476: Flags [P.], seq 914612:914816, ack 541, win 501, length 204
02:34:45.951039 IP comp3134-Winter2023.ssh > bras-base-toroon63ztr-grc-42-174-91-170-42.dsl.bell.ca.56476: Flags [P.], seq 914816:915020, ack 541, win 501, length 204
02:34:45.951141 IP comp3134-Winter2023.ssh > bras-base-toroon63ztr-grc-42-174-91-170-42.dsl.bell.ca.56476: Flags [P.], seq 915020:915224, ack 541, win 501, length 204
02:34:45.951220 IP comp3134-Winter2023.ssh > bras-base-toroon63ztr-grc-42-174-91-170-42.dsl.bell.ca.56476: Flags [P.], seq 915224:915428, ack 541, win 501, length 204
02:34:45.951323 IP comp3134-Winter2023.ssh > bras-base-toroon63ztr-grc-42-174-91-170-42.dsl.bell.ca.56476: Flags [P.], seq 915428:915632, ack 541, win 501, length 204
02:34:45.951405 IP comp3134-Winter2023.ssh > bras-base-toroon63ztr-grc-42-174-91-170-42.dsl.bell.ca.56476: Flags [P.], seq 915632:915836, ack 541, win 501, length 204
02:34:45.951457 IP comp3134-Winter2023.ssh > bras-base-toroon63ztr-grc-42-174-91-170-42.dsl.bell.ca.56476: Flags [P.], seq 915836:916040, ack 541, win 501, length 204
02:34:45.951508 IP comp3134-Winter2023.ssh > bras-base-toroon63ztr-grc-42-174-91-170-42.dsl.bell.ca.56476: Flags [P.], seq 916040:916244, ack 541, win 501, length 204
02:34:45.951761 IP comp3134-Winter2023.ssh > bras-base-toroon63ztr-grc-42-174-91-170-42.dsl.bell.ca.56476: Flags [P.], seq 916244:916448, ack 541, win 501, length 204
02:34:45.952217 IP comp3134-Winter2023.ssh > bras-base-toroon63ztr-grc-42-174-91-170-42.dsl.bell.ca.56476: Flags [P.], seq 916448:916652, ack 541, win 501, length 204
02:34:45.952468 IP comp3134-Winter2023.ssh > bras-base-toroon63ztr-grc-42-174-91-170-42.dsl.bell.ca.56476: Flags [P.], seq 916652:916856, ack 541, win 501, length 204
02:34:45.952539 IP comp3134-Winter2023.ssh > bras-base-toroon63ztr-grc-42-174-91-170-42.dsl.bell.ca.56476: Flags [P.], seq 916856:917060, ack 541, win 501, length 204
02:34:45.952584 IP comp3134-Winter2023.ssh > bras-base-toroon63ztr-grc-42-174-91-170-42.dsl.bell.ca.56476: Flags [P.], seq 917060:917264, ack 541, win 501, length 204
02:34:45.952625 IP comp3134-Winter2023.ssh > bras-base-toroon63ztr-grc-42-174-91-170-42.dsl.bell.ca.56476: Flags [P.], seq 917264:917468, ack 541, win 501, length 204
02:34:45.952704 IP comp3134-Winter2023.ssh > bras-base-toroon63ztr-grc-42-174-91-170-42.dsl.bell.ca.56476: Flags [P.], seq 917468:917672, ack 541, win 501, length 204
02:34:45.952746 IP comp3134-Winter2023.ssh > bras-base-toroon63ztr-grc-42-174-91-170-42.dsl.bell.ca.56476: Flags [P.], seq 917672:917876, ack 541, win 501, length 204
02:34:45.952788 IP comp3134-Winter2023.ssh > bras-base-toroon63ztr-grc-42-174-91-170-42.dsl.bell.ca.56476: Flags [P.], seq 917876:918080, ack 541, win 501, length 204
02:34:45.952828 IP comp3134-Winter2023.ssh > bras-base-toroon63ztr-grc-42-174-91-170-42.dsl.bell.ca.56476: Flags [P.], seq 918080:918284, ack 541, win 501, length 204
02:34:45.952869 IP comp3134-Winter2023.ssh > bras-base-toroon63ztr-grc-42-174-91-170-42.dsl.bell.ca.56476: Flags [P.], seq 918284:918488, ack 541, win 501, length 204
02:34:45.952909 IP comp3134-Winter2023.ssh > bras-base-toroon63ztr-grc-42-174-91-170-42.dsl.bell.ca.56476: Flags [P.], seq 918488:918692, ack 541, win 501, length 204
02:34:45.952952 IP comp3134-Winter2023.ssh > bras-base-toroon63ztr-grc-42-174-91-170-42.dsl.bell.ca.56476: Flags [P.], seq 918692:918896, ack 541, win 501, length 204
02:34:45.965466 IP bras-base-toroon63ztr-grc-42-174-91-170-42.dsl.bell.ca.56476 > comp3134-Winter2023.ssh: Flags [.], ack 913032, win 516, length 0
02:34:45.965467 IP bras-base-toroon63ztr-grc-42-174-91-170-42.dsl.bell.ca.56476 > comp3134-Winter2023.ssh: Flags [.], ack 916244, win 516, length 0
02:34:45.965467 IP bras-base-toroon63ztr-grc-42-174-91-170-42.dsl.bell.ca.56476 > comp3134-Winter2023.ssh: Flags [.], ack 918896, win 516, length 0
02:34:45.965754 IP comp3134-Winter2023.ssh > bras-base-toroon63ztr-grc-42-174-91-170-42.dsl.bell.ca.56476: Flags [P.], seq 918896:919100, ack 541, win 501, length 204
02:34:45.966150 IP comp3134-Winter2023.ssh > bras-base-toroon63ztr-grc-42-174-91-170-42.dsl.bell.ca.56476: Flags [P.], seq 919100:919752, ack 541, win 501, length 652
02:34:45.966333 IP comp3134-Winter2023.ssh > bras-base-toroon63ztr-grc-42-174-91-170-42.dsl.bell.ca.56476: Flags [P.], seq 919752:919956, ack 541, win 501, length 204
02:34:45.966391 IP comp3134-Winter2023.ssh > bras-base-toroon63ztr-grc-42-174-91-170-42.dsl.bell.ca.56476: Flags [P.], seq 919956:920160, ack 541, win 501, length 204
02:34:45.966438 IP comp3134-Winter2023.ssh > bras-base-toroon63ztr-grc-42-174-91-170-42.dsl.bell.ca.56476: Flags [P.], seq 920160:920364, ack 541, win 501, length 204
02:34:45.966484 IP comp3134-Winter2023.ssh > bras-base-toroon63ztr-grc-42-174-91-170-42.dsl.bell.ca.56476: Flags [P.], seq 920364:920568, ack 541, win 501, length 204
02:34:45.966530 IP comp3134-Winter2023.ssh > bras-base-toroon63ztr-grc-42-174-91-170-42.dsl.bell.ca.56476: Flags [P.], seq 920568:920772, ack 541, win 501, length 204
02:34:45.966580 IP comp3134-Winter2023.ssh > bras-base-toroon63ztr-grc-42-174-91-170-42.dsl.bell.ca.56476: Flags [P.], seq 920772:920976, ack 541, win 501, length 204
02:34:45.966626 IP comp3134-Winter2023.ssh > bras-base-toroon63ztr-grc-42-174-91-170-42.dsl.bell.ca.56476: Flags [P.], seq 920976:921180, ack 541, win 501, length 204
02:34:45.966670 IP comp3134-Winter2023.ssh > bras-base-toroon63ztr-grc-42-174-91-170-42.dsl.bell.ca.56476: Flags [P.], seq 921180:921384, ack 541, win 501, length 204
02:34:45.966715 IP comp3134-Winter2023.ssh > bras-base-toroon63ztr-grc-42-174-91-170-42.dsl.bell.ca.56476: Flags [P.], seq 921384:921588, ack 541, win 501, length 204
02:34:45.966760 IP comp3134-Winter2023.ssh > bras-base-toroon63ztr-grc-42-174-91-170-42.dsl.bell.ca.56476: Flags [P.], seq 921588:921792, ack 541, win 501, length 204
02:34:45.966805 IP comp3134-Winter2023.ssh > bras-base-toroon63ztr-grc-42-174-91-170-42.dsl.bell.ca.56476: Flags [P.], seq 921792:921996, ack 541, win 501, length 204
02:34:45.966850 IP comp3134-Winter2023.ssh > bras-base-toroon63ztr-grc-42-174-91-170-42.dsl.bell.ca.56476: Flags [P.], seq 921996:922200, ack 541, win 501, length 204
02:34:45.966895 IP comp3134-Winter2023.ssh > bras-base-toroon63ztr-grc-42-174-91-170-42.dsl.bell.ca.56476: Flags [P.], seq 922200:922404, ack 541, win 501, length 204
02:34:45.966962 IP comp3134-Winter2023.ssh > bras-base-toroon63ztr-grc-42-174-91-170-42.dsl.bell.ca.56476: Flags [P.], seq 922404:922608, ack 541, win 501, length 204
02:34:45.967015 IP comp3134-Winter2023.ssh > bras-base-toroon63ztr-grc-42-174-91-170-42.dsl.bell.ca.56476: Flags [P.], seq 922608:922812, ack 541, win 501, length 204
02:34:45.967061 IP comp3134-Winter2023.ssh > bras-base-toroon63ztr-grc-42-174-91-170-42.dsl.bell.ca.56476: Flags [P.], seq 922812:923016, ack 541, win 501, length 204
02:34:45.967153 IP comp3134-Winter2023.ssh > bras-base-toroon63ztr-grc-42-174-91-170-42.dsl.bell.ca.56476: Flags [P.], seq 923016:923220, ack 541, win 501, length 204
02:34:45.967200 IP comp3134-Winter2023.ssh > bras-base-toroon63ztr-grc-42-174-91-170-42.dsl.bell.ca.56476: Flags [P.], seq 923220:923424, ack 541, win 501, length 204
02:34:45.967247 IP comp3134-Winter2023.ssh > bras-base-toroon63ztr-grc-42-174-91-170-42.dsl.bell.ca.56476: Flags [P.], seq 923424:923628, ack 541, win 501, length 204
02:34:45.967291 IP comp3134-Winter2023.ssh > bras-base-toroon63ztr-grc-42-174-91-170-42.dsl.bell.ca.56476: Flags [P.], seq 923628:923832, ack 541, win 501, length 204
02:34:45.967423 IP comp3134-Winter2023.ssh > bras-base-toroon63ztr-grc-42-174-91-170-42.dsl.bell.ca.56476: Flags [P.], seq 923832:924036, ack 541, win 501, length 204
02:34:45.967475 IP comp3134-Winter2023.ssh > bras-base-toroon63ztr-grc-42-174-91-170-42.dsl.bell.ca.56476: Flags [P.], seq 924036:924240, ack 541, win 501, length 204
02:34:45.967695 IP comp3134-Winter2023.ssh > bras-base-toroon63ztr-grc-42-174-91-170-42.dsl.bell.ca.56476: Flags [P.], seq 924240:924444, ack 541, win 501, length 204
02:34:45.967925 IP comp3134-Winter2023.ssh > bras-base-toroon63ztr-grc-42-174-91-170-42.dsl.bell.ca.56476: Flags [P.], seq 924444:924648, ack 541, win 501, length 204
02:34:45.968133 IP comp3134-Winter2023.ssh > bras-base-toroon63ztr-grc-42-174-91-170-42.dsl.bell.ca.56476: Flags [P.], seq 924648:924852, ack 541, win 501, length 204
02:34:45.968185 IP comp3134-Winter2023.ssh > bras-base-toroon63ztr-grc-42-174-91-170-42.dsl.bell.ca.56476: Flags [P.], seq 924852:925056, ack 541, win 501, length 204
02:34:45.968236 IP comp3134-Winter2023.ssh > bras-base-toroon63ztr-grc-42-174-91-170-42.dsl.bell.ca.56476: Flags [P.], seq 925056:925260, ack 541, win 501, length 204
02:34:45.968279 IP comp3134-Winter2023.ssh > bras-base-toroon63ztr-grc-42-174-91-170-42.dsl.bell.ca.56476: Flags [P.], seq 925260:925464, ack 541, win 501, length 204
02:34:45.968330 IP comp3134-Winter2023.ssh > bras-base-toroon63ztr-grc-42-174-91-170-42.dsl.bell.ca.56476: Flags [P.], seq 925464:925668, ack 541, win 501, length 204
02:34:45.968605 IP comp3134-Winter2023.ssh > bras-base-toroon63ztr-grc-42-174-91-170-42.dsl.bell.ca.56476: Flags [P.], seq 925668:925872, ack 541, win 501, length 204
02:34:45.968791 IP comp3134-Winter2023.ssh > bras-base-toroon63ztr-grc-42-174-91-170-42.dsl.bell.ca.56476: Flags [P.], seq 925872:926076, ack 541, win 501, length 204
02:34:45.968863 IP comp3134-Winter2023.ssh > bras-base-toroon63ztr-grc-42-174-91-170-42.dsl.bell.ca.56476: Flags [P.], seq 926076:926280, ack 541, win 501, length 204
02:34:45.968941 IP comp3134-Winter2023.ssh > bras-base-toroon63ztr-grc-42-174-91-170-42.dsl.bell.ca.56476: Flags [P.], seq 926280:926484, ack 541, win 501, length 204
02:34:45.968979 IP comp3134-Winter2023.ssh > bras-base-toroon63ztr-grc-42-174-91-170-42.dsl.bell.ca.56476: Flags [P.], seq 926484:926688, ack 541, win 501, length 204
02:34:45.969027 IP comp3134-Winter2023.ssh > bras-base-toroon63ztr-grc-42-174-91-170-42.dsl.bell.ca.56476: Flags [P.], seq 926688:926892, ack 541, win 501, length 204
02:34:45.969076 IP comp3134-Winter2023.ssh > bras-base-toroon63ztr-grc-42-174-91-170-42.dsl.bell.ca.56476: Flags [P.], seq 926892:927096, ack 541, win 501, length 204
02:34:45.969139 IP comp3134-Winter2023.ssh > bras-base-toroon63ztr-grc-42-174-91-170-42.dsl.bell.ca.56476: Flags [P.], seq 927096:927300, ack 541, win 501, length 204
02:34:45.969778 IP comp3134-Winter2023.ssh > bras-base-toroon63ztr-grc-42-174-91-170-42.dsl.bell.ca.56476: Flags [P.], seq 927300:927504, ack 541, win 501, length 204
02:34:45.969964 IP comp3134-Winter2023.ssh > bras-base-toroon63ztr-grc-42-174-91-170-42.dsl.bell.ca.56476: Flags [P.], seq 927504:927708, ack 541, win 501, length 204
02:34:45.970025 IP comp3134-Winter2023.ssh > bras-base-toroon63ztr-grc-42-174-91-170-42.dsl.bell.ca.56476: Flags [P.], seq 927708:927912, ack 541, win 501, length 204
02:34:45.970069 IP comp3134-Winter2023.ssh > bras-base-toroon63ztr-grc-42-174-91-170-42.dsl.bell.ca.56476: Flags [P.], seq 927912:928116, ack 541, win 501, length 204
02:34:45.970120 IP comp3134-Winter2023.ssh > bras-base-toroon63ztr-grc-42-174-91-170-42.dsl.bell.ca.56476: Flags [P.], seq 928116:928320, ack 541, win 501, length 204
02:34:45.970162 IP comp3134-Winter2023.ssh > bras-base-toroon63ztr-grc-42-174-91-170-42.dsl.bell.ca.56476: Flags [P.], seq 928320:928524, ack 541, win 501, length 204
02:34:45.970204 IP comp3134-Winter2023.ssh > bras-base-toroon63ztr-grc-42-174-91-170-42.dsl.bell.ca.56476: Flags [P.], seq 928524:928728, ack 541, win 501, length 204
02:34:45.970246 IP comp3134-Winter2023.ssh > bras-base-toroon63ztr-grc-42-174-91-170-42.dsl.bell.ca.56476: Flags [P.], seq 928728:928932, ack 541, win 501, length 204
02:34:45.970288 IP comp3134-Winter2023.ssh > bras-base-toroon63ztr-grc-42-174-91-170-42.dsl.bell.ca.56476: Flags [P.], seq 928932:929136, ack 541, win 501, length 204
02:34:45.970440 IP comp3134-Winter2023.ssh > bras-base-toroon63ztr-grc-42-174-91-170-42.dsl.bell.ca.56476: Flags [P.], seq 929136:929340, ack 541, win 501, length 204
02:34:45.970498 IP bras-base-toroon63ztr-grc-42-174-91-170-42.dsl.bell.ca.56476 > comp3134-Winter2023.ssh: Flags [.], ack 924240, win 516, length 0
02:34:45.970551 IP comp3134-Winter2023.ssh > bras-base-toroon63ztr-grc-42-174-91-170-42.dsl.bell.ca.56476: Flags [P.], seq 929340:929544, ack 541, win 501, length 204
