02:51:18.561478 IP comp3134-Winter2023.ssh > bras-base-toroon63ztr-grc-42-174-91-170-42.dsl.bell.ca.56476: Flags [P.], seq 2720500:2720712, ack 1549, win 501, length 212
02:51:18.561514 IP comp3134-Winter2023.ssh > bras-base-toroon63ztr-grc-42-174-91-170-42.dsl.bell.ca.56476: Flags [P.], seq 2720712:2720924, ack 1549, win 501, length 212
02:51:18.561547 IP comp3134-Winter2023.ssh > bras-base-toroon63ztr-grc-42-174-91-170-42.dsl.bell.ca.56476: Flags [P.], seq 2720924:2721136, ack 1549, win 501, length 212
02:51:18.561582 IP comp3134-Winter2023.ssh > bras-base-toroon63ztr-grc-42-174-91-170-42.dsl.bell.ca.56476: Flags [P.], seq 2721136:2721348, ack 1549, win 501, length 212
02:51:18.561617 IP comp3134-Winter2023.ssh > bras-base-toroon63ztr-grc-42-174-91-170-42.dsl.bell.ca.56476: Flags [P.], seq 2721348:2721560, ack 1549, win 501, length 212
02:51:18.561651 IP comp3134-Winter2023.ssh > bras-base-toroon63ztr-grc-42-174-91-170-42.dsl.bell.ca.56476: Flags [P.], seq 2721560:2721772, ack 1549, win 501, length 212
02:51:18.561686 IP comp3134-Winter2023.ssh > bras-base-toroon63ztr-grc-42-174-91-170-42.dsl.bell.ca.56476: Flags [P.], seq 2721772:2721984, ack 1549, win 501, length 212
02:51:18.561720 IP comp3134-Winter2023.ssh > bras-base-toroon63ztr-grc-42-174-91-170-42.dsl.bell.ca.56476: Flags [P.], seq 2721984:2722196, ack 1549, win 501, length 212
02:51:18.561755 IP comp3134-Winter2023.ssh > bras-base-toroon63ztr-grc-42-174-91-170-42.dsl.bell.ca.56476: Flags [P.], seq 2722196:2722408, ack 1549, win 501, length 212
02:51:18.561792 IP comp3134-Winter2023.ssh > bras-base-toroon63ztr-grc-42-174-91-170-42.dsl.bell.ca.56476: Flags [P.], seq 2722408:2722620, ack 1549, win 501, length 212
02:51:18.561838 IP comp3134-Winter2023.ssh > bras-base-toroon63ztr-grc-42-174-91-170-42.dsl.bell.ca.56476: Flags [P.], seq 2722620:2722832, ack 1549, win 501, length 212
02:51:18.561877 IP comp3134-Winter2023.ssh > bras-base-toroon63ztr-grc-42-174-91-170-42.dsl.bell.ca.56476: Flags [P.], seq 2722832:2723044, ack 1549, win 501, length 212
02:51:18.561912 IP comp3134-Winter2023.ssh > bras-base-toroon63ztr-grc-42-174-91-170-42.dsl.bell.ca.56476: Flags [P.], seq 2723044:2723256, ack 1549, win 501, length 212
02:51:18.561947 IP comp3134-Winter2023.ssh > bras-base-toroon63ztr-grc-42-174-91-170-42.dsl.bell.ca.56476: Flags [P.], seq 2723256:2723468, ack 1549, win 501, length 212
02:51:18.561989 IP comp3134-Winter2023.ssh > bras-base-toroon63ztr-grc-42-174-91-170-42.dsl.bell.ca.56476: Flags [P.], seq 2723468:2723680, ack 1549, win 501, length 212
02:51:18.562024 IP comp3134-Winter2023.ssh > bras-base-toroon63ztr-grc-42-174-91-170-42.dsl.bell.ca.56476: Flags [P.], seq 2723680:2723892, ack 1549, win 501, length 212
02:51:18.562057 IP comp3134-Winter2023.ssh > bras-base-toroon63ztr-grc-42-174-91-170-42.dsl.bell.ca.56476: Flags [P.], seq 2723892:2724104, ack 1549, win 501, length 212
02:51:18.562090 IP comp3134-Winter2023.ssh > bras-base-toroon63ztr-grc-42-174-91-170-42.dsl.bell.ca.56476: Flags [P.], seq 2724104:2724316, ack 1549, win 501, length 212
02:51:18.562125 IP comp3134-Winter2023.ssh > bras-base-toroon63ztr-grc-42-174-91-170-42.dsl.bell.ca.56476: Flags [P.], seq 2724316:2724528, ack 1549, win 501, length 212
02:51:18.562158 IP comp3134-Winter2023.ssh > bras-base-toroon63ztr-grc-42-174-91-170-42.dsl.bell.ca.56476: Flags [P.], seq 2724528:2724740, ack 1549, win 501, length 212
02:51:18.562190 IP comp3134-Winter2023.ssh > bras-base-toroon63ztr-grc-42-174-91-170-42.dsl.bell.ca.56476: Flags [P.], seq 2724740:2724952, ack 1549, win 501, length 212
02:51:18.562241 IP comp3134-Winter2023.ssh > bras-base-toroon63ztr-grc-42-174-91-170-42.dsl.bell.ca.56476: Flags [P.], seq 2724952:2725164, ack 1549, win 501, length 212
02:51:18.562289 IP comp3134-Winter2023.ssh > bras-base-toroon63ztr-grc-42-174-91-170-42.dsl.bell.ca.56476: Flags [P.], seq 2725164:2725376, ack 1549, win 501, length 212
02:51:18.562331 IP comp3134-Winter2023.ssh > bras-base-toroon63ztr-grc-42-174-91-170-42.dsl.bell.ca.56476: Flags [P.], seq 2725376:2725588, ack 1549, win 501, length 212
02:51:18.562364 IP comp3134-Winter2023.ssh > bras-base-toroon63ztr-grc-42-174-91-170-42.dsl.bell.ca.56476: Flags [P.], seq 2725588:2725800, ack 1549, win 501, length 212
02:51:18.562396 IP comp3134-Winter2023.ssh > bras-base-toroon63ztr-grc-42-174-91-170-42.dsl.bell.ca.56476: Flags [P.], seq 2725800:2726012, ack 1549, win 501, length 212
02:51:18.562429 IP comp3134-Winter2023.ssh > bras-base-toroon63ztr-grc-42-174-91-170-42.dsl.bell.ca.56476: Flags [P.], seq 2726012:2726224, ack 1549, win 501, length 212
02:51:18.562610 IP comp3134-Winter2023.ssh > bras-base-toroon63ztr-grc-42-174-91-170-42.dsl.bell.ca.56476: Flags [P.], seq 2726224:2726436, ack 1549, win 501, length 212
02:51:18.562656 IP comp3134-Winter2023.ssh > bras-base-toroon63ztr-grc-42-174-91-170-42.dsl.bell.ca.56476: Flags [P.], seq 2726436:2726648, ack 1549, win 501, length 212
02:51:18.562690 IP comp3134-Winter2023.ssh > bras-base-toroon63ztr-grc-42-174-91-170-42.dsl.bell.ca.56476: Flags [P.], seq 2726648:2726860, ack 1549, win 501, length 212
02:51:18.562723 IP comp3134-Winter2023.ssh > bras-base-toroon63ztr-grc-42-174-91-170-42.dsl.bell.ca.56476: Flags [P.], seq 2726860:2727072, ack 1549, win 501, length 212
02:51:18.562756 IP comp3134-Winter2023.ssh > bras-base-toroon63ztr-grc-42-174-91-170-42.dsl.bell.ca.56476: Flags [P.], seq 2727072:2727284, ack 1549, win 501, length 212
02:51:18.562830 IP comp3134-Winter2023.ssh > bras-base-toroon63ztr-grc-42-174-91-170-42.dsl.bell.ca.56476: Flags [P.], seq 2727284:2727496, ack 1549, win 501, length 212
02:51:18.562864 IP comp3134-Winter2023.ssh > bras-base-toroon63ztr-grc-42-174-91-170-42.dsl.bell.ca.56476: Flags [P.], seq 2727496:2727708, ack 1549, win 501, length 212
02:51:18.562896 IP comp3134-Winter2023.ssh > bras-base-toroon63ztr-grc-42-174-91-170-42.dsl.bell.ca.56476: Flags [P.], seq 2727708:2727920, ack 1549, win 501, length 212
02:51:18.562928 IP comp3134-Winter2023.ssh > bras-base-toroon63ztr-grc-42-174-91-170-42.dsl.bell.ca.56476: Flags [P.], seq 2727920:2728132, ack 1549, win 501, length 212
02:51:18.562972 IP comp3134-Winter2023.ssh > bras-base-toroon63ztr-grc-42-174-91-170-42.dsl.bell.ca.56476: Flags [P.], seq 2728132:2728344, ack 1549, win 501, length 212
02:51:18.563008 IP comp3134-Winter2023.ssh > bras-base-toroon63ztr-grc-42-174-91-170-42.dsl.bell.ca.56476: Flags [P.], seq 2728344:2728556, ack 1549, win 501, length 212
02:51:18.563040 IP comp3134-Winter2023.ssh > bras-base-toroon63ztr-grc-42-174-91-170-42.dsl.bell.ca.56476: Flags [P.], seq 2728556:2728768, ack 1549, win 501, length 212
02:51:18.563076 IP comp3134-Winter2023.ssh > bras-base-toroon63ztr-grc-42-174-91-170-42.dsl.bell.ca.56476: Flags [P.], seq 2728768:2728980, ack 1549, win 501, length 212
02:51:18.563127 IP comp3134-Winter2023.ssh > bras-base-toroon63ztr-grc-42-174-91-170-42.dsl.bell.ca.56476: Flags [P.], seq 2728980:2729192, ack 1549, win 501, length 212
02:51:18.563161 IP comp3134-Winter2023.ssh > bras-base-toroon63ztr-grc-42-174-91-170-42.dsl.bell.ca.56476: Flags [P.], seq 2729192:2729404, ack 1549, win 501, length 212
02:51:18.563194 IP comp3134-Winter2023.ssh > bras-base-toroon63ztr-grc-42-174-91-170-42.dsl.bell.ca.56476: Flags [P.], seq 2729404:2729616, ack 1549, win 501, length 212
02:51:18.563227 IP comp3134-Winter2023.ssh > bras-base-toroon63ztr-grc-42-174-91-170-42.dsl.bell.ca.56476: Flags [P.], seq 2729616:2729828, ack 1549, win 501, length 212
02:51:18.563258 IP comp3134-Winter2023.ssh > bras-base-toroon63ztr-grc-42-174-91-170-42.dsl.bell.ca.56476: Flags [P.], seq 2729828:2730040, ack 1549, win 501, length 212
02:51:18.563292 IP comp3134-Winter2023.ssh > bras-base-toroon63ztr-grc-42-174-91-170-42.dsl.bell.ca.56476: Flags [P.], seq 2730040:2730252, ack 1549, win 501, length 212
02:51:18.563324 IP comp3134-Winter2023.ssh > bras-base-toroon63ztr-grc-42-174-91-170-42.dsl.bell.ca.56476: Flags [P.], seq 2730252:2730464, ack 1549, win 501, length 212
02:51:18.563357 IP comp3134-Winter2023.ssh > bras-base-toroon63ztr-grc-42-174-91-170-42.dsl.bell.ca.56476: Flags [P.], seq 2730464:2730676, ack 1549, win 501, length 212
02:51:18.563396 IP comp3134-Winter2023.ssh > bras-base-toroon63ztr-grc-42-174-91-170-42.dsl.bell.ca.56476: Flags [P.], seq 2730676:2730888, ack 1549, win 501, length 212
02:51:18.563804 IP comp3134-Winter2023.ssh > bras-base-toroon63ztr-grc-42-174-91-170-42.dsl.bell.ca.56476: Flags [P.], seq 2730888:2731100, ack 1549, win 501, length 212
02:51:18.563885 IP comp3134-Winter2023.ssh > bras-base-toroon63ztr-grc-42-174-91-170-42.dsl.bell.ca.56476: Flags [P.], seq 2731100:2731312, ack 1549, win 501, length 212
02:51:18.563928 IP comp3134-Winter2023.ssh > bras-base-toroon63ztr-grc-42-174-91-170-42.dsl.bell.ca.56476: Flags [P.], seq 2731312:2731524, ack 1549, win 501, length 212
02:51:18.564139 IP comp3134-Winter2023.ssh > bras-base-toroon63ztr-grc-42-174-91-170-42.dsl.bell.ca.56476: Flags [P.], seq 2731524:2731736, ack 1549, win 501, length 212
02:51:18.564513 IP comp3134-Winter2023.ssh > bras-base-toroon63ztr-grc-42-174-91-170-42.dsl.bell.ca.56476: Flags [P.], seq 2731736:2731948, ack 1549, win 501, length 212
02:51:18.564663 IP comp3134-Winter2023.ssh > bras-base-toroon63ztr-grc-42-174-91-170-42.dsl.bell.ca.56476: Flags [P.], seq 2731948:2732160, ack 1549, win 501, length 212
02:51:18.564718 IP comp3134-Winter2023.ssh > bras-base-toroon63ztr-grc-42-174-91-170-42.dsl.bell.ca.56476: Flags [P.], seq 2732160:2732372, ack 1549, win 501, length 212
02:51:18.564764 IP comp3134-Winter2023.ssh > bras-base-toroon63ztr-grc-42-174-91-170-42.dsl.bell.ca.56476: Flags [P.], seq 2732372:2732584, ack 1549, win 501, length 212
02:51:18.564857 IP comp3134-Winter2023.ssh > bras-base-toroon63ztr-grc-42-174-91-170-42.dsl.bell.ca.56476: Flags [P.], seq 2732584:2732796, ack 1549, win 501, length 212
02:51:18.564908 IP comp3134-Winter2023.ssh > bras-base-toroon63ztr-grc-42-174-91-170-42.dsl.bell.ca.56476: Flags [P.], seq 2732796:2733008, ack 1549, win 501, length 212
02:51:18.564952 IP comp3134-Winter2023.ssh > bras-base-toroon63ztr-grc-42-174-91-170-42.dsl.bell.ca.56476: Flags [P.], seq 2733008:2733220, ack 1549, win 501, length 212
02:51:18.565168 IP comp3134-Winter2023.ssh > bras-base-toroon63ztr-grc-42-174-91-170-42.dsl.bell.ca.56476: Flags [P.], seq 2733220:2733432, ack 1549, win 501, length 212
02:51:18.565362 IP comp3134-Winter2023.ssh > bras-base-toroon63ztr-grc-42-174-91-170-42.dsl.bell.ca.56476: Flags [P.], seq 2733432:2733644, ack 1549, win 501, length 212
02:51:18.565424 IP comp3134-Winter2023.ssh > bras-base-toroon63ztr-grc-42-174-91-170-42.dsl.bell.ca.56476: Flags [P.], seq 2733644:2733856, ack 1549, win 501, length 212
02:51:18.565474 IP comp3134-Winter2023.ssh > bras-base-toroon63ztr-grc-42-174-91-170-42.dsl.bell.ca.56476: Flags [P.], seq 2733856:2734068, ack 1549, win 501, length 212
02:51:18.565546 IP comp3134-Winter2023.ssh > bras-base-toroon63ztr-grc-42-174-91-170-42.dsl.bell.ca.56476: Flags [P.], seq 2734068:2734280, ack 1549, win 501, length 212
02:51:18.565603 IP comp3134-Winter2023.ssh > bras-base-toroon63ztr-grc-42-174-91-170-42.dsl.bell.ca.56476: Flags [P.], seq 2734280:2734492, ack 1549, win 501, length 212
02:51:18.565651 IP comp3134-Winter2023.ssh > bras-base-toroon63ztr-grc-42-174-91-170-42.dsl.bell.ca.56476: Flags [P.], seq 2734492:2734704, ack 1549, win 501, length 212
02:51:18.565798 IP comp3134-Winter2023.ssh > bras-base-toroon63ztr-grc-42-174-91-170-42.dsl.bell.ca.56476: Flags [P.], seq 2734704:2734916, ack 1549, win 501, length 212
02:51:18.565867 IP comp3134-Winter2023.ssh > bras-base-toroon63ztr-grc-42-174-91-170-42.dsl.bell.ca.56476: Flags [P.], seq 2734916:2735128, ack 1549, win 501, length 212
02:51:18.565919 IP comp3134-Winter2023.ssh > bras-base-toroon63ztr-grc-42-174-91-170-42.dsl.bell.ca.56476: Flags [P.], seq 2735128:2735340, ack 1549, win 501, length 212
02:51:18.565971 IP comp3134-Winter2023.ssh > bras-base-toroon63ztr-grc-42-174-91-170-42.dsl.bell.ca.56476: Flags [P.], seq 2735340:2735552, ack 1549, win 501, length 212
02:51:18.566019 IP comp3134-Winter2023.ssh > bras-base-toroon63ztr-grc-42-174-91-170-42.dsl.bell.ca.56476: Flags [P.], seq 2735552:2735764, ack 1549, win 501, length 212
02:51:18.566064 IP comp3134-Winter2023.ssh > bras-base-toroon63ztr-grc-42-174-91-170-42.dsl.bell.ca.56476: Flags [P.], seq 2735764:2735976, ack 1549, win 501, length 212
02:51:18.566113 IP comp3134-Winter2023.ssh > bras-base-toroon63ztr-grc-42-174-91-170-42.dsl.bell.ca.56476: Flags [P.], seq 2735976:2736188, ack 1549, win 501, length 212
02:51:18.566202 IP comp3134-Winter2023.ssh > bras-base-toroon63ztr-grc-42-174-91-170-42.dsl.bell.ca.56476: Flags [P.], seq 2736188:2736400, ack 1549, win 501, length 212
02:51:18.566260 IP comp3134-Winter2023.ssh > bras-base-toroon63ztr-grc-42-174-91-170-42.dsl.bell.ca.56476: Flags [P.], seq 2736400:2736612, ack 1549, win 501, length 212
02:51:18.566313 IP comp3134-Winter2023.ssh > bras-base-toroon63ztr-grc-42-174-91-170-42.dsl.bell.ca.56476: Flags [P.], seq 2736612:2736824, ack 1549, win 501, length 212
02:51:18.566361 IP comp3134-Winter2023.ssh > bras-base-toroon63ztr-grc-42-174-91-170-42.dsl.bell.ca.56476: Flags [P.], seq 2736824:2737036, ack 1549, win 501, length 212
02:51:18.566409 IP comp3134-Winter2023.ssh > bras-base-toroon63ztr-grc-42-174-91-170-42.dsl.bell.ca.56476: Flags [P.], seq 2737036:2737248, ack 1549, win 501, length 212
02:51:18.566887 IP comp3134-Winter2023.ssh > bras-base-toroon63ztr-grc-42-174-91-170-42.dsl.bell.ca.56476: Flags [P.], seq 2737248:2737460, ack 1549, win 501, length 212
02:51:18.567034 IP comp3134-Winter2023.ssh > bras-base-toroon63ztr-grc-42-174-91-170-42.dsl.bell.ca.56476: Flags [P.], seq 2737460:2737672, ack 1549, win 501, length 212
02:51:18.567097 IP comp3134-Winter2023.ssh > bras-base-toroon63ztr-grc-42-174-91-170-42.dsl.bell.ca.56476: Flags [P.], seq 2737672:2737884, ack 1549, win 501, length 212
02:51:18.567186 IP comp3134-Winter2023.ssh > bras-base-toroon63ztr-grc-42-174-91-170-42.dsl.bell.ca.56476: Flags [P.], seq 2737884:2738096, ack 1549, win 501, length 212
02:51:18.567239 IP comp3134-Winter2023.ssh > bras-base-toroon63ztr-grc-42-174-91-170-42.dsl.bell.ca.56476: Flags [P.], seq 2738096:2738308, ack 1549, win 501, length 212
02:51:18.567333 IP comp3134-Winter2023.ssh > bras-base-toroon63ztr-grc-42-174-91-170-42.dsl.bell.ca.56476: Flags [P.], seq 2738308:2738520, ack 1549, win 501, length 212
02:51:18.567399 IP comp3134-Winter2023.ssh > bras-base-toroon63ztr-grc-42-174-91-170-42.dsl.bell.ca.56476: Flags [P.], seq 2738520:2738732, ack 1549, win 501, length 212
02:51:18.567591 IP comp3134-Winter2023.ssh > bras-base-toroon63ztr-grc-42-174-91-170-42.dsl.bell.ca.56476: Flags [P.], seq 2738732:2738944, ack 1549, win 501, length 212
02:51:18.567660 IP comp3134-Winter2023.ssh > bras-base-toroon63ztr-grc-42-174-91-170-42.dsl.bell.ca.56476: Flags [P.], seq 2738944:2739156, ack 1549, win 501, length 212
02:51:18.567723 IP comp3134-Winter2023.ssh > bras-base-toroon63ztr-grc-42-174-91-170-42.dsl.bell.ca.56476: Flags [P.], seq 2739156:2739368, ack 1549, win 501, length 212
02:51:18.567770 IP comp3134-Winter2023.ssh > bras-base-toroon63ztr-grc-42-174-91-170-42.dsl.bell.ca.56476: Flags [P.], seq 2739368:2739580, ack 1549, win 501, length 212
02:51:18.567816 IP comp3134-Winter2023.ssh > bras-base-toroon63ztr-grc-42-174-91-170-42.dsl.bell.ca.56476: Flags [P.], seq 2739580:2739792, ack 1549, win 501, length 212
02:51:18.567899 IP comp3134-Winter2023.ssh > bras-base-toroon63ztr-grc-42-174-91-170-42.dsl.bell.ca.56476: Flags [P.], seq 2739792:2740004, ack 1549, win 501, length 212
02:51:18.567955 IP comp3134-Winter2023.ssh > bras-base-toroon63ztr-grc-42-174-91-170-42.dsl.bell.ca.56476: Flags [P.], seq 2740004:2740216, ack 1549, win 501, length 212
02:51:18.568154 IP comp3134-Winter2023.ssh > bras-base-toroon63ztr-grc-42-174-91-170-42.dsl.bell.ca.56476: Flags [P.], seq 2740216:2740428, ack 1549, win 501, length 212
02:51:18.568215 IP comp3134-Winter2023.ssh > bras-base-toroon63ztr-grc-42-174-91-170-42.dsl.bell.ca.56476: Flags [P.], seq 2740428:2740640, ack 1549, win 501, length 212
02:51:18.568266 IP comp3134-Winter2023.ssh > bras-base-toroon63ztr-grc-42-174-91-170-42.dsl.bell.ca.56476: Flags [P.], seq 2740640:2740852, ack 1549, win 501, length 212
02:51:18.568314 IP comp3134-Winter2023.ssh > bras-base-toroon63ztr-grc-42-174-91-170-42.dsl.bell.ca.56476: Flags [P.], seq 2740852:2741064, ack 1549, win 501, length 212
02:51:18.568383 IP comp3134-Winter2023.ssh > bras-base-toroon63ztr-grc-42-174-91-170-42.dsl.bell.ca.56476: Flags [P.], seq 2741064:2741276, ack 1549, win 501, length 212
02:51:18.568435 IP comp3134-Winter2023.ssh > bras-base-toroon63ztr-grc-42-174-91-170-42.dsl.bell.ca.56476: Flags [P.], seq 2741276:2741488, ack 1549, win 501, length 212
02:51:18.568483 IP comp3134-Winter2023.ssh > bras-base-toroon63ztr-grc-42-174-91-170-42.dsl.bell.ca.56476: Flags [P.], seq 2741488:2741700, ack 1549, win 501, length 212
02:51:18.568532 IP comp3134-Winter2023.ssh > bras-base-toroon63ztr-grc-42-174-91-170-42.dsl.bell.ca.56476: Flags [P.], seq 2741700:2741912, ack 1549, win 501, length 212
02:51:18.568580 IP comp3134-Winter2023.ssh > bras-base-toroon63ztr-grc-42-174-91-170-42.dsl.bell.ca.56476: Flags [P.], seq 2741912:2742124, ack 1549, win 501, length 212
02:51:18.568662 IP comp3134-Winter2023.ssh > bras-base-toroon63ztr-grc-42-174-91-170-42.dsl.bell.ca.56476: Flags [P.], seq 2742124:2742336, ack 1549, win 501, length 212
02:51:18.568718 IP comp3134-Winter2023.ssh > bras-base-toroon63ztr-grc-42-174-91-170-42.dsl.bell.ca.56476: Flags [P.], seq 2742336:2742548, ack 1549, win 501, length 212
02:51:18.569256 IP comp3134-Winter2023.ssh > bras-base-toroon63ztr-grc-42-174-91-170-42.dsl.bell.ca.56476: Flags [P.], seq 2742548:2742760, ack 1549, win 501, length 212
02:51:18.569393 IP comp3134-Winter2023.ssh > bras-base-toroon63ztr-grc-42-174-91-170-42.dsl.bell.ca.56476: Flags [P.], seq 2742760:2742972, ack 1549, win 501, length 212
02:51:18.569472 IP comp3134-Winter2023.ssh > bras-base-toroon63ztr-grc-42-174-91-170-42.dsl.bell.ca.56476: Flags [P.], seq 2742972:2743184, ack 1549, win 501, length 212
02:51:18.569528 IP comp3134-Winter2023.ssh > bras-base-toroon63ztr-grc-42-174-91-170-42.dsl.bell.ca.56476: Flags [P.], seq 2743184:2743396, ack 1549, win 501, length 212
02:51:18.569843 IP comp3134-Winter2023.ssh > bras-base-toroon63ztr-grc-42-174-91-170-42.dsl.bell.ca.56476: Flags [P.], seq 2743396:2743608, ack 1549, win 501, length 212
02:51:18.569914 IP comp3134-Winter2023.ssh > bras-base-toroon63ztr-grc-42-174-91-170-42.dsl.bell.ca.56476: Flags [P.], seq 2743608:2743820, ack 1549, win 501, length 212
02:51:18.570022 IP comp3134-Winter2023.ssh > bras-base-toroon63ztr-grc-42-174-91-170-42.dsl.bell.ca.56476: Flags [P.], seq 2743820:2744032, ack 1549, win 501, length 212
02:51:18.570101 IP comp3134-Winter2023.ssh > bras-base-toroon63ztr-grc-42-174-91-170-42.dsl.bell.ca.56476: Flags [P.], seq 2744032:2744244, ack 1549, win 501, length 212
02:51:18.570889 IP comp3134-Winter2023.ssh > bras-base-toroon63ztr-grc-42-174-91-170-42.dsl.bell.ca.56476: Flags [P.], seq 2744244:2744456, ack 1549, win 501, length 212
02:51:18.571004 IP comp3134-Winter2023.ssh > bras-base-toroon63ztr-grc-42-174-91-170-42.dsl.bell.ca.56476: Flags [P.], seq 2744456:2744668, ack 1549, win 501, length 212
02:51:18.571351 IP comp3134-Winter2023.ssh > bras-base-toroon63ztr-grc-42-174-91-170-42.dsl.bell.ca.56476: Flags [P.], seq 2744668:2744880, ack 1549, win 501, length 212
02:51:18.571439 IP comp3134-Winter2023.ssh > bras-base-toroon63ztr-grc-42-174-91-170-42.dsl.bell.ca.56476: Flags [P.], seq 2744880:2745092, ack 1549, win 501, length 212
02:51:18.571493 IP comp3134-Winter2023.ssh > bras-base-toroon63ztr-grc-42-174-91-170-42.dsl.bell.ca.56476: Flags [P.], seq 2745092:2745304, ack 1549, win 501, length 212
02:51:18.571541 IP comp3134-Winter2023.ssh > bras-base-toroon63ztr-grc-42-174-91-170-42.dsl.bell.ca.56476: Flags [P.], seq 2745304:2745516, ack 1549, win 501, length 212
02:51:18.571589 IP comp3134-Winter2023.ssh > bras-base-toroon63ztr-grc-42-174-91-170-42.dsl.bell.ca.56476: Flags [P.], seq 2745516:2745728, ack 1549, win 501, length 212
02:51:18.571637 IP comp3134-Winter2023.ssh > bras-base-toroon63ztr-grc-42-174-91-170-42.dsl.bell.ca.56476: Flags [P.], seq 2745728:2745940, ack 1549, win 501, length 212
02:51:18.571683 IP comp3134-Winter2023.ssh > bras-base-toroon63ztr-grc-42-174-91-170-42.dsl.bell.ca.56476: Flags [P.], seq 2745940:2746152, ack 1549, win 501, length 212
02:51:18.571729 IP comp3134-Winter2023.ssh > bras-base-toroon63ztr-grc-42-174-91-170-42.dsl.bell.ca.56476: Flags [P.], seq 2746152:2746364, ack 1549, win 501, length 212
02:51:18.571802 IP comp3134-Winter2023.ssh > bras-base-toroon63ztr-grc-42-174-91-170-42.dsl.bell.ca.56476: Flags [P.], seq 2746364:2746576, ack 1585, win 501, length 212
02:51:18.572156 IP comp3134-Winter2023.ssh > bras-base-toroon63ztr-grc-42-174-91-170-42.dsl.bell.ca.56476: Flags [P.], seq 2746576:2746788, ack 1585, win 501, length 212
02:51:18.572236 IP comp3134-Winter2023.ssh > bras-base-toroon63ztr-grc-42-174-91-170-42.dsl.bell.ca.56476: Flags [P.], seq 2746788:2747000, ack 1585, win 501, length 212
02:51:18.572293 IP comp3134-Winter2023.ssh > bras-base-toroon63ztr-grc-42-174-91-170-42.dsl.bell.ca.56476: Flags [P.], seq 2747000:2747212, ack 1585, win 501, length 212
02:51:18.572340 IP comp3134-Winter2023.ssh > bras-base-toroon63ztr-grc-42-174-91-170-42.dsl.bell.ca.56476: Flags [P.], seq 2747212:2747424, ack 1585, win 501, length 212
02:51:18.572394 IP comp3134-Winter2023.ssh > bras-base-toroon63ztr-grc-42-174-91-170-42.dsl.bell.ca.56476: Flags [P.], seq 2747424:2747636, ack 1585, win 501, length 212
02:51:18.572463 IP comp3134-Winter2023.ssh > bras-base-toroon63ztr-grc-42-174-91-170-42.dsl.bell.ca.56476: Flags [P.], seq 2747636:2747848, ack 1585, win 501, length 212
02:51:18.572516 IP comp3134-Winter2023.ssh > bras-base-toroon63ztr-grc-42-174-91-170-42.dsl.bell.ca.56476: Flags [P.], seq 2747848:2748060, ack 1585, win 501, length 212
02:51:18.572565 IP comp3134-Winter2023.ssh > bras-base-toroon63ztr-grc-42-174-91-170-42.dsl.bell.ca.56476: Flags [P.], seq 2748060:2748272, ack 1585, win 501, length 212
02:51:18.572614 IP comp3134-Winter2023.ssh > bras-base-toroon63ztr-grc-42-174-91-170-42.dsl.bell.ca.56476: Flags [P.], seq 2748272:2748484, ack 1585, win 501, length 212
02:51:18.572663 IP comp3134-Winter2023.ssh > bras-base-toroon63ztr-grc-42-174-91-170-42.dsl.bell.ca.56476: Flags [P.], seq 2748484:2748696, ack 1585, win 501, length 212
02:51:18.572710 IP comp3134-Winter2023.ssh > bras-base-toroon63ztr-grc-42-174-91-170-42.dsl.bell.ca.56476: Flags [P.], seq 2748696:2748908, ack 1585, win 501, length 212
02:51:18.572758 IP comp3134-Winter2023.ssh > bras-base-toroon63ztr-grc-42-174-91-170-42.dsl.bell.ca.56476: Flags [P.], seq 2748908:2749120, ack 1585, win 501, length 212
02:51:18.572804 IP comp3134-Winter2023.ssh > bras-base-toroon63ztr-grc-42-174-91-170-42.dsl.bell.ca.56476: Flags [P.], seq 2749120:2749332, ack 1585, win 501, length 212
02:51:18.572848 IP comp3134-Winter2023.ssh > bras-base-toroon63ztr-grc-42-174-91-170-42.dsl.bell.ca.56476: Flags [P.], seq 2749332:2749544, ack 1585, win 501, length 212
02:51:18.572917 IP comp3134-Winter2023.ssh > bras-base-toroon63ztr-grc-42-174-91-170-42.dsl.bell.ca.56476: Flags [P.], seq 2749544:2749756, ack 1585, win 501, length 212
02:51:18.572964 IP comp3134-Winter2023.ssh > bras-base-toroon63ztr-grc-42-174-91-170-42.dsl.bell.ca.56476: Flags [P.], seq 2749756:2749968, ack 1585, win 501, length 212
02:51:18.573016 IP comp3134-Winter2023.ssh > bras-base-toroon63ztr-grc-42-174-91-170-42.dsl.bell.ca.56476: Flags [P.], seq 2749968:2750180, ack 1585, win 501, length 212
02:51:18.573063 IP comp3134-Winter2023.ssh > bras-base-toroon63ztr-grc-42-174-91-170-42.dsl.bell.ca.56476: Flags [P.], seq 2750180:2750392, ack 1585, win 501, length 212
02:51:18.573109 IP comp3134-Winter2023.ssh > bras-base-toroon63ztr-grc-42-174-91-170-42.dsl.bell.ca.56476: Flags [P.], seq 2750392:2750604, ack 1585, win 501, length 212
02:51:18.573156 IP comp3134-Winter2023.ssh > bras-base-toroon63ztr-grc-42-174-91-170-42.dsl.bell.ca.56476: Flags [P.], seq 2750604:2750816, ack 1585, win 501, length 212
02:51:18.573205 IP comp3134-Winter2023.ssh > bras-base-toroon63ztr-grc-42-174-91-170-42.dsl.bell.ca.56476: Flags [P.], seq 2750816:2751028, ack 1585, win 501, length 212
02:51:18.573257 IP comp3134-Winter2023.ssh > bras-base-toroon63ztr-grc-42-174-91-170-42.dsl.bell.ca.56476: Flags [P.], seq 2751028:2751240, ack 1585, win 501, length 212
02:51:18.573303 IP comp3134-Winter2023.ssh > bras-base-toroon63ztr-grc-42-174-91-170-42.dsl.bell.ca.56476: Flags [P.], seq 2751240:2751452, ack 1585, win 501, length 212
02:51:18.573347 IP comp3134-Winter2023.ssh > bras-base-toroon63ztr-grc-42-174-91-170-42.dsl.bell.ca.56476: Flags [P.], seq 2751452:2751664, ack 1585, win 501, length 212
02:51:18.573395 IP comp3134-Winter2023.ssh > bras-base-toroon63ztr-grc-42-174-91-170-42.dsl.bell.ca.56476: Flags [P.], seq 2751664:2751876, ack 1585, win 501, length 212
02:51:18.573539 IP comp3134-Winter2023.ssh > bras-base-toroon63ztr-grc-42-174-91-170-42.dsl.bell.ca.56476: Flags [P.], seq 2751876:2752088, ack 1585, win 501, length 212
02:51:18.573594 IP comp3134-Winter2023.ssh > bras-base-toroon63ztr-grc-42-174-91-170-42.dsl.bell.ca.56476: Flags [P.], seq 2752088:2752300, ack 1585, win 501, length 212
02:51:18.573643 IP comp3134-Winter2023.ssh > bras-base-toroon63ztr-grc-42-174-91-170-42.dsl.bell.ca.56476: Flags [P.], seq 2752300:2752512, ack 1585, win 501, length 212
02:51:18.573692 IP comp3134-Winter2023.ssh > bras-base-toroon63ztr-grc-42-174-91-170-42.dsl.bell.ca.56476: Flags [P.], seq 2752512:2752724, ack 1585, win 501, length 212
02:51:18.573801 IP comp3134-Winter2023.ssh > bras-base-toroon63ztr-grc-42-174-91-170-42.dsl.bell.ca.56476: Flags [P.], seq 2752724:2752936, ack 1585, win 501, length 212
02:51:18.573853 IP comp3134-Winter2023.ssh > bras-base-toroon63ztr-grc-42-174-91-170-42.dsl.bell.ca.56476: Flags [P.], seq 2752936:2753148, ack 1585, win 501, length 212
02:51:18.573902 IP comp3134-Winter2023.ssh > bras-base-toroon63ztr-grc-42-174-91-170-42.dsl.bell.ca.56476: Flags [P.], seq 2753148:2753360, ack 1585, win 501, length 212
02:51:18.573949 IP comp3134-Winter2023.ssh > bras-base-toroon63ztr-grc-42-174-91-170-42.dsl.bell.ca.56476: Flags [P.], seq 2753360:2753572, ack 1585, win 501, length 212
02:51:18.574018 IP comp3134-Winter2023.ssh > bras-base-toroon63ztr-grc-42-174-91-170-42.dsl.bell.ca.56476: Flags [P.], seq 2753572:2753784, ack 1585, win 501, length 212
02:51:18.574066 IP comp3134-Winter2023.ssh > bras-base-toroon63ztr-grc-42-174-91-170-42.dsl.bell.ca.56476: Flags [P.], seq 2753784:2753996, ack 1585, win 501, length 212
02:51:18.574112 IP comp3134-Winter2023.ssh > bras-base-toroon63ztr-grc-42-174-91-170-42.dsl.bell.ca.56476: Flags [P.], seq 2753996:2754208, ack 1585, win 501, length 212
02:51:18.574158 IP comp3134-Winter2023.ssh > bras-base-toroon63ztr-grc-42-174-91-170-42.dsl.bell.ca.56476: Flags [P.], seq 2754208:2754420, ack 1585, win 501, length 212
02:51:18.574206 IP comp3134-Winter2023.ssh > bras-base-toroon63ztr-grc-42-174-91-170-42.dsl.bell.ca.56476: Flags [P.], seq 2754420:2754632, ack 1585, win 501, length 212
02:51:18.574256 IP comp3134-Winter2023.ssh > bras-base-toroon63ztr-grc-42-174-91-170-42.dsl.bell.ca.56476: Flags [P.], seq 2754632:2754844, ack 1585, win 501, length 212
02:51:18.574302 IP comp3134-Winter2023.ssh > bras-base-toroon63ztr-grc-42-174-91-170-42.dsl.bell.ca.56476: Flags [P.], seq 2754844:2755056, ack 1585, win 501, length 212
02:51:18.574835 IP comp3134-Winter2023.ssh > bras-base-toroon63ztr-grc-42-174-91-170-42.dsl.bell.ca.56476: Flags [P.], seq 2755056:2755268, ack 1585, win 501, length 212
02:51:18.574967 IP comp3134-Winter2023.ssh > bras-base-toroon63ztr-grc-42-174-91-170-42.dsl.bell.ca.56476: Flags [P.], seq 2755268:2755480, ack 1585, win 501, length 212
02:51:18.575070 IP comp3134-Winter2023.ssh > bras-base-toroon63ztr-grc-42-174-91-170-42.dsl.bell.ca.56476: Flags [P.], seq 2755480:2755692, ack 1585, win 501, length 212
02:51:18.575143 IP comp3134-Winter2023.ssh > bras-base-toroon63ztr-grc-42-174-91-170-42.dsl.bell.ca.56476: Flags [P.], seq 2755692:2755904, ack 1585, win 501, length 212
02:51:18.575250 IP comp3134-Winter2023.ssh > bras-base-toroon63ztr-grc-42-174-91-170-42.dsl.bell.ca.56476: Flags [P.], seq 2755904:2756116, ack 1585, win 501, length 212
02:51:18.575303 IP comp3134-Winter2023.ssh > bras-base-toroon63ztr-grc-42-174-91-170-42.dsl.bell.ca.56476: Flags [P.], seq 2756116:2756328, ack 1585, win 501, length 212
02:51:18.575350 IP comp3134-Winter2023.ssh > bras-base-toroon63ztr-grc-42-174-91-170-42.dsl.bell.ca.56476: Flags [P.], seq 2756328:2756540, ack 1585, win 501, length 212
02:51:18.575395 IP comp3134-Winter2023.ssh > bras-base-toroon63ztr-grc-42-174-91-170-42.dsl.bell.ca.56476: Flags [P.], seq 2756540:2756752, ack 1585, win 501, length 212
02:51:18.575443 IP comp3134-Winter2023.ssh > bras-base-toroon63ztr-grc-42-174-91-170-42.dsl.bell.ca.56476: Flags [P.], seq 2756752:2756964, ack 1585, win 501, length 212
02:51:18.575591 IP comp3134-Winter2023.ssh > bras-base-toroon63ztr-grc-42-174-91-170-42.dsl.bell.ca.56476: Flags [P.], seq 2756964:2757176, ack 1585, win 501, length 212
02:51:18.575647 IP comp3134-Winter2023.ssh > bras-base-toroon63ztr-grc-42-174-91-170-42.dsl.bell.ca.56476: Flags [P.], seq 2757176:2757388, ack 1585, win 501, length 212
02:51:18.575695 IP comp3134-Winter2023.ssh > bras-base-toroon63ztr-grc-42-174-91-170-42.dsl.bell.ca.56476: Flags [P.], seq 2757388:2757600, ack 1585, win 501, length 212
02:51:18.575896 IP comp3134-Winter2023.ssh > bras-base-toroon63ztr-grc-42-174-91-170-42.dsl.bell.ca.56476: Flags [P.], seq 2757600:2757812, ack 1585, win 501, length 212
02:51:18.575966 IP comp3134-Winter2023.ssh > bras-base-toroon63ztr-grc-42-174-91-170-42.dsl.bell.ca.56476: Flags [P.], seq 2757812:2758024, ack 1585, win 501, length 212
02:51:18.576016 IP comp3134-Winter2023.ssh > bras-base-toroon63ztr-grc-42-174-91-170-42.dsl.bell.ca.56476: Flags [P.], seq 2758024:2758236, ack 1585, win 501, length 212
02:51:18.576064 IP comp3134-Winter2023.ssh > bras-base-toroon63ztr-grc-42-174-91-170-42.dsl.bell.ca.56476: Flags [P.], seq 2758236:2758448, ack 1585, win 501, length 212
02:51:18.576136 IP comp3134-Winter2023.ssh > bras-base-toroon63ztr-grc-42-174-91-170-42.dsl.bell.ca.56476: Flags [P.], seq 2758448:2758660, ack 1585, win 501, length 212
02:51:18.576187 IP comp3134-Winter2023.ssh > bras-base-toroon63ztr-grc-42-174-91-170-42.dsl.bell.ca.56476: Flags [P.], seq 2758660:2758872, ack 1585, win 501, length 212
02:51:18.576234 IP comp3134-Winter2023.ssh > bras-base-toroon63ztr-grc-42-174-91-170-42.dsl.bell.ca.56476: Flags [P.], seq 2758872:2759084, ack 1585, win 501, length 212
02:51:18.576280 IP comp3134-Winter2023.ssh > bras-base-toroon63ztr-grc-42-174-91-170-42.dsl.bell.ca.56476: Flags [P.], seq 2759084:2759296, ack 1585, win 501, length 212
02:51:18.576325 IP comp3134-Winter2023.ssh > bras-base-toroon63ztr-grc-42-174-91-170-42.dsl.bell.ca.56476: Flags [P.], seq 2759296:2759508, ack 1585, win 501, length 212
02:51:18.576371 IP comp3134-Winter2023.ssh > bras-base-toroon63ztr-grc-42-174-91-170-42.dsl.bell.ca.56476: Flags [P.], seq 2759508:2759720, ack 1585, win 501, length 212
02:51:18.576419 IP comp3134-Winter2023.ssh > bras-base-toroon63ztr-grc-42-174-91-170-42.dsl.bell.ca.56476: Flags [P.], seq 2759720:2759932, ack 1585, win 501, length 212
02:51:18.576466 IP comp3134-Winter2023.ssh > bras-base-toroon63ztr-grc-42-174-91-170-42.dsl.bell.ca.56476: Flags [P.], seq 2759932:2760144, ack 1585, win 501, length 212
02:51:18.576511 IP comp3134-Winter2023.ssh > bras-base-toroon63ztr-grc-42-174-91-170-42.dsl.bell.ca.56476: Flags [P.], seq 2760144:2760356, ack 1585, win 501, length 212
02:51:18.576635 IP comp3134-Winter2023.ssh > bras-base-toroon63ztr-grc-42-174-91-170-42.dsl.bell.ca.56476: Flags [P.], seq 2760356:2760568, ack 1585, win 501, length 212
02:51:18.576689 IP comp3134-Winter2023.ssh > bras-base-toroon63ztr-grc-42-174-91-170-42.dsl.bell.ca.56476: Flags [P.], seq 2760568:2760780, ack 1585, win 501, length 212
02:51:18.576762 IP comp3134-Winter2023.ssh > bras-base-toroon63ztr-grc-42-174-91-170-42.dsl.bell.ca.56476: Flags [P.], seq 2760780:2760992, ack 1585, win 501, length 212
02:51:18.576864 IP comp3134-Winter2023.ssh > bras-base-toroon63ztr-grc-42-174-91-170-42.dsl.bell.ca.56476: Flags [P.], seq 2760992:2761204, ack 1585, win 501, length 212
02:51:18.576913 IP comp3134-Winter2023.ssh > bras-base-toroon63ztr-grc-42-174-91-170-42.dsl.bell.ca.56476: Flags [P.], seq 2761204:2761416, ack 1585, win 501, length 212
02:51:18.576959 IP comp3134-Winter2023.ssh > bras-base-toroon63ztr-grc-42-174-91-170-42.dsl.bell.ca.56476: Flags [P.], seq 2761416:2761628, ack 1585, win 501, length 212
02:51:18.577003 IP comp3134-Winter2023.ssh > bras-base-toroon63ztr-grc-42-174-91-170-42.dsl.bell.ca.56476: Flags [P.], seq 2761628:2761840, ack 1585, win 501, length 212
02:51:18.577232 IP comp3134-Winter2023.ssh > bras-base-toroon63ztr-grc-42-174-91-170-42.dsl.bell.ca.56476: Flags [P.], seq 2761840:2762052, ack 1585, win 501, length 212
02:51:18.577303 IP comp3134-Winter2023.ssh > bras-base-toroon63ztr-grc-42-174-91-170-42.dsl.bell.ca.56476: Flags [P.], seq 2762052:2762264, ack 1585, win 501, length 212
02:51:18.577384 IP comp3134-Winter2023.ssh > bras-base-toroon63ztr-grc-42-174-91-170-42.dsl.bell.ca.56476: Flags [P.], seq 2762264:2762476, ack 1585, win 501, length 212
02:51:18.577538 IP comp3134-Winter2023.ssh > bras-base-toroon63ztr-grc-42-174-91-170-42.dsl.bell.ca.56476: Flags [P.], seq 2762476:2762688, ack 1585, win 501, length 212
02:51:18.577604 IP comp3134-Winter2023.ssh > bras-base-toroon63ztr-grc-42-174-91-170-42.dsl.bell.ca.56476: Flags [P.], seq 2762688:2762900, ack 1585, win 501, length 212
02:51:18.577656 IP comp3134-Winter2023.ssh > bras-base-toroon63ztr-grc-42-174-91-170-42.dsl.bell.ca.56476: Flags [P.], seq 2762900:2763112, ack 1585, win 501, length 212
02:51:18.577750 IP comp3134-Winter2023.ssh > bras-base-toroon63ztr-grc-42-174-91-170-42.dsl.bell.ca.56476: Flags [P.], seq 2763112:2763324, ack 1585, win 501, length 212
02:51:18.577853 IP comp3134-Winter2023.ssh > bras-base-toroon63ztr-grc-42-174-91-170-42.dsl.bell.ca.56476: Flags [P.], seq 2763324:2763536, ack 1585, win 501, length 212
02:51:18.577906 IP comp3134-Winter2023.ssh > bras-base-toroon63ztr-grc-42-174-91-170-42.dsl.bell.ca.56476: Flags [P.], seq 2763536:2763748, ack 1585, win 501, length 212
02:51:18.577955 IP comp3134-Winter2023.ssh > bras-base-toroon63ztr-grc-42-174-91-170-42.dsl.bell.ca.56476: Flags [P.], seq 2763748:2763960, ack 1585, win 501, length 212
02:51:18.578001 IP comp3134-Winter2023.ssh > bras-base-toroon63ztr-grc-42-174-91-170-42.dsl.bell.ca.56476: Flags [P.], seq 2763960:2764172, ack 1585, win 501, length 212
02:51:18.578049 IP comp3134-Winter2023.ssh > bras-base-toroon63ztr-grc-42-174-91-170-42.dsl.bell.ca.56476: Flags [P.], seq 2764172:2764384, ack 1585, win 501, length 212
02:51:18.578095 IP comp3134-Winter2023.ssh > bras-base-toroon63ztr-grc-42-174-91-170-42.dsl.bell.ca.56476: Flags [P.], seq 2764384:2764596, ack 1585, win 501, length 212
02:51:18.578141 IP comp3134-Winter2023.ssh > bras-base-toroon63ztr-grc-42-174-91-170-42.dsl.bell.ca.56476: Flags [P.], seq 2764596:2764808, ack 1585, win 501, length 212
02:51:18.578186 IP comp3134-Winter2023.ssh > bras-base-toroon63ztr-grc-42-174-91-170-42.dsl.bell.ca.56476: Flags [P.], seq 2764808:2765020, ack 1585, win 501, length 212
02:51:18.578232 IP comp3134-Winter2023.ssh > bras-base-toroon63ztr-grc-42-174-91-170-42.dsl.bell.ca.56476: Flags [P.], seq 2765020:2765232, ack 1585, win 501, length 212
02:51:18.578279 IP comp3134-Winter2023.ssh > bras-base-toroon63ztr-grc-42-174-91-170-42.dsl.bell.ca.56476: Flags [P.], seq 2765232:2765444, ack 1585, win 501, length 212
02:51:18.578324 IP comp3134-Winter2023.ssh > bras-base-toroon63ztr-grc-42-174-91-170-42.dsl.bell.ca.56476: Flags [P.], seq 2765444:2765656, ack 1585, win 501, length 212
02:51:18.578880 IP comp3134-Winter2023.ssh > bras-base-toroon63ztr-grc-42-174-91-170-42.dsl.bell.ca.56476: Flags [P.], seq 2765656:2765868, ack 1585, win 501, length 212
02:51:18.579010 IP comp3134-Winter2023.ssh > bras-base-toroon63ztr-grc-42-174-91-170-42.dsl.bell.ca.56476: Flags [P.], seq 2765868:2766080, ack 1585, win 501, length 212
02:51:18.579066 IP comp3134-Winter2023.ssh > bras-base-toroon63ztr-grc-42-174-91-170-42.dsl.bell.ca.56476: Flags [P.], seq 2766080:2766292, ack 1585, win 501, length 212
02:51:18.579135 IP comp3134-Winter2023.ssh > bras-base-toroon63ztr-grc-42-174-91-170-42.dsl.bell.ca.56476: Flags [P.], seq 2766292:2766504, ack 1585, win 501, length 212
02:51:18.579537 IP comp3134-Winter2023.ssh > bras-base-toroon63ztr-grc-42-174-91-170-42.dsl.bell.ca.56476: Flags [P.], seq 2766504:2766716, ack 1585, win 501, length 212
02:51:18.579659 IP comp3134-Winter2023.ssh > bras-base-toroon63ztr-grc-42-174-91-170-42.dsl.bell.ca.56476: Flags [P.], seq 2766716:2766928, ack 1585, win 501, length 212
02:51:18.579828 IP comp3134-Winter2023.ssh > bras-base-toroon63ztr-grc-42-174-91-170-42.dsl.bell.ca.56476: Flags [P.], seq 2766928:2767140, ack 1585, win 501, length 212
02:51:18.579887 IP comp3134-Winter2023.ssh > bras-base-toroon63ztr-grc-42-174-91-170-42.dsl.bell.ca.56476: Flags [P.], seq 2767140:2767352, ack 1585, win 501, length 212
02:51:18.579935 IP comp3134-Winter2023.ssh > bras-base-toroon63ztr-grc-42-174-91-170-42.dsl.bell.ca.56476: Flags [P.], seq 2767352:2767564, ack 1585, win 501, length 212
02:51:18.580155 IP comp3134-Winter2023.ssh > bras-base-toroon63ztr-grc-42-174-91-170-42.dsl.bell.ca.56476: Flags [P.], seq 2767564:2767776, ack 1585, win 501, length 212
02:51:18.580731 IP comp3134-Winter2023.ssh > bras-base-toroon63ztr-grc-42-174-91-170-42.dsl.bell.ca.56476: Flags [P.], seq 2767776:2767988, ack 1585, win 501, length 212
02:51:18.580992 IP comp3134-Winter2023.ssh > bras-base-toroon63ztr-grc-42-174-91-170-42.dsl.bell.ca.56476: Flags [P.], seq 2767988:2768200, ack 1585, win 501, length 212
02:51:18.581380 IP comp3134-Winter2023.ssh > bras-base-toroon63ztr-grc-42-174-91-170-42.dsl.bell.ca.56476: Flags [P.], seq 2768200:2768412, ack 1585, win 501, length 212
02:51:18.581458 IP comp3134-Winter2023.ssh > bras-base-toroon63ztr-grc-42-174-91-170-42.dsl.bell.ca.56476: Flags [P.], seq 2768412:2768624, ack 1585, win 501, length 212
02:51:18.581532 IP comp3134-Winter2023.ssh > bras-base-toroon63ztr-grc-42-174-91-170-42.dsl.bell.ca.56476: Flags [P.], seq 2768624:2768836, ack 1585, win 501, length 212
02:51:18.581588 IP comp3134-Winter2023.ssh > bras-base-toroon63ztr-grc-42-174-91-170-42.dsl.bell.ca.56476: Flags [P.], seq 2768836:2769048, ack 1585, win 501, length 212
02:51:18.581640 IP comp3134-Winter2023.ssh > bras-base-toroon63ztr-grc-42-174-91-170-42.dsl.bell.ca.56476: Flags [P.], seq 2769048:2769260, ack 1585, win 501, length 212
02:51:18.581688 IP comp3134-Winter2023.ssh > bras-base-toroon63ztr-grc-42-174-91-170-42.dsl.bell.ca.56476: Flags [P.], seq 2769260:2769472, ack 1585, win 501, length 212
02:51:18.581734 IP comp3134-Winter2023.ssh > bras-base-toroon63ztr-grc-42-174-91-170-42.dsl.bell.ca.56476: Flags [P.], seq 2769472:2769684, ack 1585, win 501, length 212
02:51:18.581871 IP comp3134-Winter2023.ssh > bras-base-toroon63ztr-grc-42-174-91-170-42.dsl.bell.ca.56476: Flags [P.], seq 2769684:2769896, ack 1585, win 501, length 212
02:51:18.581965 IP comp3134-Winter2023.ssh > bras-base-toroon63ztr-grc-42-174-91-170-42.dsl.bell.ca.56476: Flags [P.], seq 2769896:2770108, ack 1585, win 501, length 212
02:51:18.582021 IP comp3134-Winter2023.ssh > bras-base-toroon63ztr-grc-42-174-91-170-42.dsl.bell.ca.56476: Flags [P.], seq 2770108:2770320, ack 1585, win 501, length 212
