02:46:04.004386 IP comp3134-Winter2023.ssh > bras-base-toroon63ztr-grc-42-174-91-170-42.dsl.bell.ca.56476: Flags [P.], seq 4586888:4587100, ack 2665, win 501, length 212
02:46:04.004443 IP comp3134-Winter2023.ssh > bras-base-toroon63ztr-grc-42-174-91-170-42.dsl.bell.ca.56476: Flags [P.], seq 4587100:4587312, ack 2665, win 501, length 212
02:46:04.005298 IP comp3134-Winter2023.ssh > bras-base-toroon63ztr-grc-42-174-91-170-42.dsl.bell.ca.56476: Flags [P.], seq 4587312:4587524, ack 2665, win 501, length 212
02:46:04.005907 IP bras-base-toroon63ztr-grc-42-174-91-170-42.dsl.bell.ca.56476 > comp3134-Winter2023.ssh: Flags [.], ack 4583988, win 8337, length 0
02:46:04.005970 IP comp3134-Winter2023.ssh > bras-base-toroon63ztr-grc-42-174-91-170-42.dsl.bell.ca.56476: Flags [P.], seq 4587524:4587736, ack 2665, win 501, length 212
02:46:04.006111 IP comp3134-Winter2023.ssh > bras-base-toroon63ztr-grc-42-174-91-170-42.dsl.bell.ca.56476: Flags [P.], seq 4587736:4588092, ack 2665, win 501, length 356
02:46:04.006200 IP comp3134-Winter2023.ssh > bras-base-toroon63ztr-grc-42-174-91-170-42.dsl.bell.ca.56476: Flags [P.], seq 4588092:4588304, ack 2665, win 501, length 212
02:46:04.006696 IP comp3134-Winter2023.ssh > bras-base-toroon63ztr-grc-42-174-91-170-42.dsl.bell.ca.56476: Flags [P.], seq 4588304:4588516, ack 2665, win 501, length 212
02:46:04.006794 IP comp3134-Winter2023.ssh > bras-base-toroon63ztr-grc-42-174-91-170-42.dsl.bell.ca.56476: Flags [P.], seq 4588516:4588728, ack 2665, win 501, length 212
02:46:04.007546 IP comp3134-Winter2023.ssh > bras-base-toroon63ztr-grc-42-174-91-170-42.dsl.bell.ca.56476: Flags [P.], seq 4588728:4588940, ack 2665, win 501, length 212
02:46:04.007676 IP bras-base-toroon63ztr-grc-42-174-91-170-42.dsl.bell.ca.56476 > comp3134-Winter2023.ssh: Flags [.], ack 4587100, win 8337, length 0
02:46:04.007738 IP comp3134-Winter2023.ssh > bras-base-toroon63ztr-grc-42-174-91-170-42.dsl.bell.ca.56476: Flags [P.], seq 4588940:4589152, ack 2665, win 501, length 212
02:46:04.007812 IP comp3134-Winter2023.ssh > bras-base-toroon63ztr-grc-42-174-91-170-42.dsl.bell.ca.56476: Flags [P.], seq 4589152:4589508, ack 2665, win 501, length 356
02:46:04.007861 IP comp3134-Winter2023.ssh > bras-base-toroon63ztr-grc-42-174-91-170-42.dsl.bell.ca.56476: Flags [P.], seq 4589508:4589720, ack 2665, win 501, length 212
02:46:04.007909 IP comp3134-Winter2023.ssh > bras-base-toroon63ztr-grc-42-174-91-170-42.dsl.bell.ca.56476: Flags [P.], seq 4589720:4589932, ack 2665, win 501, length 212
02:46:04.008048 IP comp3134-Winter2023.ssh > bras-base-toroon63ztr-grc-42-174-91-170-42.dsl.bell.ca.56476: Flags [P.], seq 4589932:4590144, ack 2665, win 501, length 212
02:46:04.008125 IP comp3134-Winter2023.ssh > bras-base-toroon63ztr-grc-42-174-91-170-42.dsl.bell.ca.56476: Flags [P.], seq 4590144:4590356, ack 2665, win 501, length 212
02:46:04.008178 IP comp3134-Winter2023.ssh > bras-base-toroon63ztr-grc-42-174-91-170-42.dsl.bell.ca.56476: Flags [P.], seq 4590356:4590568, ack 2665, win 501, length 212
02:46:04.008299 IP bras-base-toroon63ztr-grc-42-174-91-170-42.dsl.bell.ca.56476 > comp3134-Winter2023.ssh: Flags [.], ack 4588304, win 8332, length 0
02:46:04.008324 IP comp3134-Winter2023.ssh > bras-base-toroon63ztr-grc-42-174-91-170-42.dsl.bell.ca.56476: Flags [P.], seq 4590568:4590780, ack 2665, win 501, length 212
02:46:04.008401 IP comp3134-Winter2023.ssh > bras-base-toroon63ztr-grc-42-174-91-170-42.dsl.bell.ca.56476: Flags [P.], seq 4590780:4591136, ack 2665, win 501, length 356
02:46:04.008557 IP comp3134-Winter2023.ssh > bras-base-toroon63ztr-grc-42-174-91-170-42.dsl.bell.ca.56476: Flags [P.], seq 4591136:4591348, ack 2665, win 501, length 212
02:46:04.008714 IP comp3134-Winter2023.ssh > bras-base-toroon63ztr-grc-42-174-91-170-42.dsl.bell.ca.56476: Flags [P.], seq 4591348:4591560, ack 2665, win 501, length 212
02:46:04.008904 IP comp3134-Winter2023.ssh > bras-base-toroon63ztr-grc-42-174-91-170-42.dsl.bell.ca.56476: Flags [P.], seq 4591560:4591772, ack 2665, win 501, length 212
02:46:04.009068 IP comp3134-Winter2023.ssh > bras-base-toroon63ztr-grc-42-174-91-170-42.dsl.bell.ca.56476: Flags [P.], seq 4591772:4591984, ack 2665, win 501, length 212
02:46:04.009127 IP comp3134-Winter2023.ssh > bras-base-toroon63ztr-grc-42-174-91-170-42.dsl.bell.ca.56476: Flags [P.], seq 4591984:4592196, ack 2665, win 501, length 212
02:46:04.009177 IP comp3134-Winter2023.ssh > bras-base-toroon63ztr-grc-42-174-91-170-42.dsl.bell.ca.56476: Flags [P.], seq 4592196:4592408, ack 2665, win 501, length 212
02:46:04.009214 IP comp3134-Winter2023.ssh > bras-base-toroon63ztr-grc-42-174-91-170-42.dsl.bell.ca.56476: Flags [P.], seq 4592408:4592620, ack 2665, win 501, length 212
02:46:04.009256 IP comp3134-Winter2023.ssh > bras-base-toroon63ztr-grc-42-174-91-170-42.dsl.bell.ca.56476: Flags [P.], seq 4592620:4592832, ack 2665, win 501, length 212
02:46:04.009377 IP comp3134-Winter2023.ssh > bras-base-toroon63ztr-grc-42-174-91-170-42.dsl.bell.ca.56476: Flags [P.], seq 4592832:4593044, ack 2665, win 501, length 212
02:46:04.009435 IP comp3134-Winter2023.ssh > bras-base-toroon63ztr-grc-42-174-91-170-42.dsl.bell.ca.56476: Flags [P.], seq 4593044:4593256, ack 2665, win 501, length 212
02:46:04.009486 IP comp3134-Winter2023.ssh > bras-base-toroon63ztr-grc-42-174-91-170-42.dsl.bell.ca.56476: Flags [P.], seq 4593256:4593468, ack 2665, win 501, length 212
02:46:04.009533 IP comp3134-Winter2023.ssh > bras-base-toroon63ztr-grc-42-174-91-170-42.dsl.bell.ca.56476: Flags [P.], seq 4593468:4593680, ack 2665, win 501, length 212
02:46:04.009577 IP comp3134-Winter2023.ssh > bras-base-toroon63ztr-grc-42-174-91-170-42.dsl.bell.ca.56476: Flags [P.], seq 4593680:4593892, ack 2665, win 501, length 212
02:46:04.009670 IP comp3134-Winter2023.ssh > bras-base-toroon63ztr-grc-42-174-91-170-42.dsl.bell.ca.56476: Flags [P.], seq 4593892:4594104, ack 2665, win 501, length 212
02:46:04.009854 IP comp3134-Winter2023.ssh > bras-base-toroon63ztr-grc-42-174-91-170-42.dsl.bell.ca.56476: Flags [P.], seq 4594104:4594316, ack 2665, win 501, length 212
02:46:04.009927 IP comp3134-Winter2023.ssh > bras-base-toroon63ztr-grc-42-174-91-170-42.dsl.bell.ca.56476: Flags [P.], seq 4594316:4594528, ack 2665, win 501, length 212
02:46:04.010224 IP comp3134-Winter2023.ssh > bras-base-toroon63ztr-grc-42-174-91-170-42.dsl.bell.ca.56476: Flags [P.], seq 4594528:4594740, ack 2665, win 501, length 212
02:46:04.010306 IP comp3134-Winter2023.ssh > bras-base-toroon63ztr-grc-42-174-91-170-42.dsl.bell.ca.56476: Flags [P.], seq 4594740:4594952, ack 2665, win 501, length 212
02:46:04.010356 IP comp3134-Winter2023.ssh > bras-base-toroon63ztr-grc-42-174-91-170-42.dsl.bell.ca.56476: Flags [P.], seq 4594952:4595164, ack 2665, win 501, length 212
02:46:04.010398 IP comp3134-Winter2023.ssh > bras-base-toroon63ztr-grc-42-174-91-170-42.dsl.bell.ca.56476: Flags [P.], seq 4595164:4595376, ack 2665, win 501, length 212
02:46:04.010437 IP comp3134-Winter2023.ssh > bras-base-toroon63ztr-grc-42-174-91-170-42.dsl.bell.ca.56476: Flags [P.], seq 4595376:4595588, ack 2665, win 501, length 212
02:46:04.010488 IP comp3134-Winter2023.ssh > bras-base-toroon63ztr-grc-42-174-91-170-42.dsl.bell.ca.56476: Flags [P.], seq 4595588:4595800, ack 2665, win 501, length 212
02:46:04.010529 IP comp3134-Winter2023.ssh > bras-base-toroon63ztr-grc-42-174-91-170-42.dsl.bell.ca.56476: Flags [P.], seq 4595800:4596012, ack 2665, win 501, length 212
02:46:04.010567 IP comp3134-Winter2023.ssh > bras-base-toroon63ztr-grc-42-174-91-170-42.dsl.bell.ca.56476: Flags [P.], seq 4596012:4596224, ack 2665, win 501, length 212
02:46:04.010613 IP comp3134-Winter2023.ssh > bras-base-toroon63ztr-grc-42-174-91-170-42.dsl.bell.ca.56476: Flags [P.], seq 4596224:4596436, ack 2665, win 501, length 212
02:46:04.010664 IP comp3134-Winter2023.ssh > bras-base-toroon63ztr-grc-42-174-91-170-42.dsl.bell.ca.56476: Flags [P.], seq 4596436:4596648, ack 2665, win 501, length 212
02:46:04.010714 IP comp3134-Winter2023.ssh > bras-base-toroon63ztr-grc-42-174-91-170-42.dsl.bell.ca.56476: Flags [P.], seq 4596648:4596860, ack 2665, win 501, length 212
02:46:04.010759 IP comp3134-Winter2023.ssh > bras-base-toroon63ztr-grc-42-174-91-170-42.dsl.bell.ca.56476: Flags [P.], seq 4596860:4597072, ack 2665, win 501, length 212
02:46:04.010796 IP comp3134-Winter2023.ssh > bras-base-toroon63ztr-grc-42-174-91-170-42.dsl.bell.ca.56476: Flags [P.], seq 4597072:4597284, ack 2665, win 501, length 212
02:46:04.010844 IP comp3134-Winter2023.ssh > bras-base-toroon63ztr-grc-42-174-91-170-42.dsl.bell.ca.56476: Flags [P.], seq 4597284:4597496, ack 2665, win 501, length 212
02:46:04.010894 IP comp3134-Winter2023.ssh > bras-base-toroon63ztr-grc-42-174-91-170-42.dsl.bell.ca.56476: Flags [P.], seq 4597496:4597708, ack 2665, win 501, length 212
02:46:04.010947 IP comp3134-Winter2023.ssh > bras-base-toroon63ztr-grc-42-174-91-170-42.dsl.bell.ca.56476: Flags [P.], seq 4597708:4597920, ack 2665, win 501, length 212
02:46:04.011265 IP comp3134-Winter2023.ssh > bras-base-toroon63ztr-grc-42-174-91-170-42.dsl.bell.ca.56476: Flags [P.], seq 4597920:4598132, ack 2665, win 501, length 212
02:46:04.011347 IP comp3134-Winter2023.ssh > bras-base-toroon63ztr-grc-42-174-91-170-42.dsl.bell.ca.56476: Flags [P.], seq 4598132:4598344, ack 2665, win 501, length 212
02:46:04.011391 IP comp3134-Winter2023.ssh > bras-base-toroon63ztr-grc-42-174-91-170-42.dsl.bell.ca.56476: Flags [P.], seq 4598344:4598556, ack 2665, win 501, length 212
02:46:04.011436 IP comp3134-Winter2023.ssh > bras-base-toroon63ztr-grc-42-174-91-170-42.dsl.bell.ca.56476: Flags [P.], seq 4598556:4598768, ack 2665, win 501, length 212
02:46:04.011487 IP comp3134-Winter2023.ssh > bras-base-toroon63ztr-grc-42-174-91-170-42.dsl.bell.ca.56476: Flags [P.], seq 4598768:4598980, ack 2665, win 501, length 212
02:46:04.011553 IP comp3134-Winter2023.ssh > bras-base-toroon63ztr-grc-42-174-91-170-42.dsl.bell.ca.56476: Flags [P.], seq 4598980:4599192, ack 2665, win 501, length 212
02:46:04.011608 IP comp3134-Winter2023.ssh > bras-base-toroon63ztr-grc-42-174-91-170-42.dsl.bell.ca.56476: Flags [P.], seq 4599192:4599404, ack 2665, win 501, length 212
02:46:04.011647 IP comp3134-Winter2023.ssh > bras-base-toroon63ztr-grc-42-174-91-170-42.dsl.bell.ca.56476: Flags [P.], seq 4599404:4599616, ack 2665, win 501, length 212
02:46:04.011976 IP comp3134-Winter2023.ssh > bras-base-toroon63ztr-grc-42-174-91-170-42.dsl.bell.ca.56476: Flags [P.], seq 4599616:4599828, ack 2665, win 501, length 212
02:46:04.012080 IP comp3134-Winter2023.ssh > bras-base-toroon63ztr-grc-42-174-91-170-42.dsl.bell.ca.56476: Flags [P.], seq 4599828:4600040, ack 2665, win 501, length 212
02:46:04.012130 IP comp3134-Winter2023.ssh > bras-base-toroon63ztr-grc-42-174-91-170-42.dsl.bell.ca.56476: Flags [P.], seq 4600040:4600252, ack 2665, win 501, length 212
02:46:04.012182 IP comp3134-Winter2023.ssh > bras-base-toroon63ztr-grc-42-174-91-170-42.dsl.bell.ca.56476: Flags [P.], seq 4600252:4600464, ack 2665, win 501, length 212
02:46:04.012234 IP comp3134-Winter2023.ssh > bras-base-toroon63ztr-grc-42-174-91-170-42.dsl.bell.ca.56476: Flags [P.], seq 4600464:4600676, ack 2665, win 501, length 212
02:46:04.012288 IP comp3134-Winter2023.ssh > bras-base-toroon63ztr-grc-42-174-91-170-42.dsl.bell.ca.56476: Flags [P.], seq 4600676:4600888, ack 2665, win 501, length 212
02:46:04.012349 IP bras-base-toroon63ztr-grc-42-174-91-170-42.dsl.bell.ca.56476 > comp3134-Winter2023.ssh: Flags [.], ack 4590568, win 8337, length 0
02:46:04.012373 IP comp3134-Winter2023.ssh > bras-base-toroon63ztr-grc-42-174-91-170-42.dsl.bell.ca.56476: Flags [P.], seq 4600888:4601100, ack 2665, win 501, length 212
02:46:04.012442 IP comp3134-Winter2023.ssh > bras-base-toroon63ztr-grc-42-174-91-170-42.dsl.bell.ca.56476: Flags [P.], seq 4601100:4601456, ack 2665, win 501, length 356
02:46:04.012638 IP comp3134-Winter2023.ssh > bras-base-toroon63ztr-grc-42-174-91-170-42.dsl.bell.ca.56476: Flags [P.], seq 4601456:4601668, ack 2665, win 501, length 212
02:46:04.012724 IP comp3134-Winter2023.ssh > bras-base-toroon63ztr-grc-42-174-91-170-42.dsl.bell.ca.56476: Flags [P.], seq 4601668:4601880, ack 2665, win 501, length 212
02:46:04.012950 IP comp3134-Winter2023.ssh > bras-base-toroon63ztr-grc-42-174-91-170-42.dsl.bell.ca.56476: Flags [P.], seq 4601880:4602092, ack 2665, win 501, length 212
02:46:04.013105 IP comp3134-Winter2023.ssh > bras-base-toroon63ztr-grc-42-174-91-170-42.dsl.bell.ca.56476: Flags [P.], seq 4602092:4602304, ack 2665, win 501, length 212
02:46:04.013172 IP comp3134-Winter2023.ssh > bras-base-toroon63ztr-grc-42-174-91-170-42.dsl.bell.ca.56476: Flags [P.], seq 4602304:4602516, ack 2665, win 501, length 212
02:46:04.013221 IP comp3134-Winter2023.ssh > bras-base-toroon63ztr-grc-42-174-91-170-42.dsl.bell.ca.56476: Flags [P.], seq 4602516:4602728, ack 2665, win 501, length 212
02:46:04.013287 IP comp3134-Winter2023.ssh > bras-base-toroon63ztr-grc-42-174-91-170-42.dsl.bell.ca.56476: Flags [P.], seq 4602728:4602940, ack 2665, win 501, length 212
02:46:04.013331 IP bras-base-toroon63ztr-grc-42-174-91-170-42.dsl.bell.ca.56476 > comp3134-Winter2023.ssh: Flags [.], ack 4595164, win 8337, length 0
02:46:04.013389 IP comp3134-Winter2023.ssh > bras-base-toroon63ztr-grc-42-174-91-170-42.dsl.bell.ca.56476: Flags [P.], seq 4602940:4603296, ack 2665, win 501, length 356
02:46:04.013434 IP comp3134-Winter2023.ssh > bras-base-toroon63ztr-grc-42-174-91-170-42.dsl.bell.ca.56476: Flags [P.], seq 4603296:4603508, ack 2665, win 501, length 212
02:46:04.013475 IP comp3134-Winter2023.ssh > bras-base-toroon63ztr-grc-42-174-91-170-42.dsl.bell.ca.56476: Flags [P.], seq 4603508:4603720, ack 2665, win 501, length 212
02:46:04.013516 IP comp3134-Winter2023.ssh > bras-base-toroon63ztr-grc-42-174-91-170-42.dsl.bell.ca.56476: Flags [P.], seq 4603720:4603932, ack 2665, win 501, length 212
02:46:04.013570 IP comp3134-Winter2023.ssh > bras-base-toroon63ztr-grc-42-174-91-170-42.dsl.bell.ca.56476: Flags [P.], seq 4603932:4604144, ack 2665, win 501, length 212
02:46:04.013612 IP comp3134-Winter2023.ssh > bras-base-toroon63ztr-grc-42-174-91-170-42.dsl.bell.ca.56476: Flags [P.], seq 4604144:4604356, ack 2665, win 501, length 212
02:46:04.013654 IP comp3134-Winter2023.ssh > bras-base-toroon63ztr-grc-42-174-91-170-42.dsl.bell.ca.56476: Flags [P.], seq 4604356:4604568, ack 2665, win 501, length 212
02:46:04.013697 IP comp3134-Winter2023.ssh > bras-base-toroon63ztr-grc-42-174-91-170-42.dsl.bell.ca.56476: Flags [P.], seq 4604568:4604780, ack 2665, win 501, length 212
02:46:04.013738 IP comp3134-Winter2023.ssh > bras-base-toroon63ztr-grc-42-174-91-170-42.dsl.bell.ca.56476: Flags [P.], seq 4604780:4604992, ack 2665, win 501, length 212
02:46:04.013779 IP comp3134-Winter2023.ssh > bras-base-toroon63ztr-grc-42-174-91-170-42.dsl.bell.ca.56476: Flags [P.], seq 4604992:4605204, ack 2665, win 501, length 212
02:46:04.013820 IP comp3134-Winter2023.ssh > bras-base-toroon63ztr-grc-42-174-91-170-42.dsl.bell.ca.56476: Flags [P.], seq 4605204:4605416, ack 2665, win 501, length 212
02:46:04.013860 IP comp3134-Winter2023.ssh > bras-base-toroon63ztr-grc-42-174-91-170-42.dsl.bell.ca.56476: Flags [P.], seq 4605416:4605628, ack 2665, win 501, length 212
02:46:04.014079 IP comp3134-Winter2023.ssh > bras-base-toroon63ztr-grc-42-174-91-170-42.dsl.bell.ca.56476: Flags [P.], seq 4605628:4605840, ack 2665, win 501, length 212
02:46:04.014138 IP comp3134-Winter2023.ssh > bras-base-toroon63ztr-grc-42-174-91-170-42.dsl.bell.ca.56476: Flags [P.], seq 4605840:4606052, ack 2665, win 501, length 212
02:46:04.014180 IP comp3134-Winter2023.ssh > bras-base-toroon63ztr-grc-42-174-91-170-42.dsl.bell.ca.56476: Flags [P.], seq 4606052:4606264, ack 2665, win 501, length 212
02:46:04.014239 IP comp3134-Winter2023.ssh > bras-base-toroon63ztr-grc-42-174-91-170-42.dsl.bell.ca.56476: Flags [P.], seq 4606264:4606476, ack 2665, win 501, length 212
02:46:04.014280 IP comp3134-Winter2023.ssh > bras-base-toroon63ztr-grc-42-174-91-170-42.dsl.bell.ca.56476: Flags [P.], seq 4606476:4606688, ack 2665, win 501, length 212
02:46:04.014411 IP comp3134-Winter2023.ssh > bras-base-toroon63ztr-grc-42-174-91-170-42.dsl.bell.ca.56476: Flags [P.], seq 4606688:4606900, ack 2665, win 501, length 212
02:46:04.014471 IP comp3134-Winter2023.ssh > bras-base-toroon63ztr-grc-42-174-91-170-42.dsl.bell.ca.56476: Flags [P.], seq 4606900:4607112, ack 2665, win 501, length 212
02:46:04.014521 IP comp3134-Winter2023.ssh > bras-base-toroon63ztr-grc-42-174-91-170-42.dsl.bell.ca.56476: Flags [P.], seq 4607112:4607324, ack 2665, win 501, length 212
02:46:04.014572 IP comp3134-Winter2023.ssh > bras-base-toroon63ztr-grc-42-174-91-170-42.dsl.bell.ca.56476: Flags [P.], seq 4607324:4607536, ack 2665, win 501, length 212
02:46:04.014633 IP comp3134-Winter2023.ssh > bras-base-toroon63ztr-grc-42-174-91-170-42.dsl.bell.ca.56476: Flags [P.], seq 4607536:4607748, ack 2665, win 501, length 212
02:46:04.014683 IP comp3134-Winter2023.ssh > bras-base-toroon63ztr-grc-42-174-91-170-42.dsl.bell.ca.56476: Flags [P.], seq 4607748:4607960, ack 2665, win 501, length 212
02:46:04.014731 IP comp3134-Winter2023.ssh > bras-base-toroon63ztr-grc-42-174-91-170-42.dsl.bell.ca.56476: Flags [P.], seq 4607960:4608172, ack 2665, win 501, length 212
02:46:04.014777 IP comp3134-Winter2023.ssh > bras-base-toroon63ztr-grc-42-174-91-170-42.dsl.bell.ca.56476: Flags [P.], seq 4608172:4608384, ack 2665, win 501, length 212
02:46:04.014813 IP comp3134-Winter2023.ssh > bras-base-toroon63ztr-grc-42-174-91-170-42.dsl.bell.ca.56476: Flags [P.], seq 4608384:4608596, ack 2665, win 501, length 212
02:46:04.014860 IP comp3134-Winter2023.ssh > bras-base-toroon63ztr-grc-42-174-91-170-42.dsl.bell.ca.56476: Flags [P.], seq 4608596:4608808, ack 2665, win 501, length 212
02:46:04.014895 IP comp3134-Winter2023.ssh > bras-base-toroon63ztr-grc-42-174-91-170-42.dsl.bell.ca.56476: Flags [P.], seq 4608808:4609020, ack 2665, win 501, length 212
02:46:04.014931 IP comp3134-Winter2023.ssh > bras-base-toroon63ztr-grc-42-174-91-170-42.dsl.bell.ca.56476: Flags [P.], seq 4609020:4609232, ack 2665, win 501, length 212
02:46:04.015363 IP comp3134-Winter2023.ssh > bras-base-toroon63ztr-grc-42-174-91-170-42.dsl.bell.ca.56476: Flags [P.], seq 4609232:4609444, ack 2665, win 501, length 212
02:46:04.015640 IP bras-base-toroon63ztr-grc-42-174-91-170-42.dsl.bell.ca.56476 > comp3134-Winter2023.ssh: Flags [.], ack 4600252, win 8337, length 0
02:46:04.015640 IP bras-base-toroon63ztr-grc-42-174-91-170-42.dsl.bell.ca.56476 > comp3134-Winter2023.ssh: Flags [.], ack 4600888, win 8335, length 0
02:46:04.015724 IP comp3134-Winter2023.ssh > bras-base-toroon63ztr-grc-42-174-91-170-42.dsl.bell.ca.56476: Flags [P.], seq 4609444:4609656, ack 2665, win 501, length 212
02:46:04.015932 IP comp3134-Winter2023.ssh > bras-base-toroon63ztr-grc-42-174-91-170-42.dsl.bell.ca.56476: Flags [P.], seq 4609656:4610164, ack 2665, win 501, length 508
02:46:04.016134 IP comp3134-Winter2023.ssh > bras-base-toroon63ztr-grc-42-174-91-170-42.dsl.bell.ca.56476: Flags [P.], seq 4610164:4610376, ack 2665, win 501, length 212
02:46:04.016205 IP comp3134-Winter2023.ssh > bras-base-toroon63ztr-grc-42-174-91-170-42.dsl.bell.ca.56476: Flags [P.], seq 4610376:4610588, ack 2665, win 501, length 212
02:46:04.016254 IP comp3134-Winter2023.ssh > bras-base-toroon63ztr-grc-42-174-91-170-42.dsl.bell.ca.56476: Flags [P.], seq 4610588:4610800, ack 2665, win 501, length 212
02:46:04.016303 IP comp3134-Winter2023.ssh > bras-base-toroon63ztr-grc-42-174-91-170-42.dsl.bell.ca.56476: Flags [P.], seq 4610800:4611012, ack 2665, win 501, length 212
02:46:04.016348 IP comp3134-Winter2023.ssh > bras-base-toroon63ztr-grc-42-174-91-170-42.dsl.bell.ca.56476: Flags [P.], seq 4611012:4611224, ack 2665, win 501, length 212
02:46:04.016396 IP comp3134-Winter2023.ssh > bras-base-toroon63ztr-grc-42-174-91-170-42.dsl.bell.ca.56476: Flags [P.], seq 4611224:4611436, ack 2665, win 501, length 212
02:46:04.016447 IP comp3134-Winter2023.ssh > bras-base-toroon63ztr-grc-42-174-91-170-42.dsl.bell.ca.56476: Flags [P.], seq 4611436:4611648, ack 2665, win 501, length 212
02:46:04.016495 IP comp3134-Winter2023.ssh > bras-base-toroon63ztr-grc-42-174-91-170-42.dsl.bell.ca.56476: Flags [P.], seq 4611648:4611860, ack 2665, win 501, length 212
02:46:04.016543 IP comp3134-Winter2023.ssh > bras-base-toroon63ztr-grc-42-174-91-170-42.dsl.bell.ca.56476: Flags [P.], seq 4611860:4612072, ack 2665, win 501, length 212
02:46:04.016592 IP comp3134-Winter2023.ssh > bras-base-toroon63ztr-grc-42-174-91-170-42.dsl.bell.ca.56476: Flags [P.], seq 4612072:4612284, ack 2665, win 501, length 212
02:46:04.016639 IP comp3134-Winter2023.ssh > bras-base-toroon63ztr-grc-42-174-91-170-42.dsl.bell.ca.56476: Flags [P.], seq 4612284:4612496, ack 2665, win 501, length 212
02:46:04.016686 IP comp3134-Winter2023.ssh > bras-base-toroon63ztr-grc-42-174-91-170-42.dsl.bell.ca.56476: Flags [P.], seq 4612496:4612708, ack 2665, win 501, length 212
02:46:04.016735 IP comp3134-Winter2023.ssh > bras-base-toroon63ztr-grc-42-174-91-170-42.dsl.bell.ca.56476: Flags [P.], seq 4612708:4612920, ack 2665, win 501, length 212
02:46:04.016783 IP comp3134-Winter2023.ssh > bras-base-toroon63ztr-grc-42-174-91-170-42.dsl.bell.ca.56476: Flags [P.], seq 4612920:4613132, ack 2665, win 501, length 212
02:46:04.016832 IP comp3134-Winter2023.ssh > bras-base-toroon63ztr-grc-42-174-91-170-42.dsl.bell.ca.56476: Flags [P.], seq 4613132:4613344, ack 2665, win 501, length 212
02:46:04.016878 IP comp3134-Winter2023.ssh > bras-base-toroon63ztr-grc-42-174-91-170-42.dsl.bell.ca.56476: Flags [P.], seq 4613344:4613556, ack 2665, win 501, length 212
02:46:04.016924 IP comp3134-Winter2023.ssh > bras-base-toroon63ztr-grc-42-174-91-170-42.dsl.bell.ca.56476: Flags [P.], seq 4613556:4613768, ack 2665, win 501, length 212
02:46:04.016969 IP comp3134-Winter2023.ssh > bras-base-toroon63ztr-grc-42-174-91-170-42.dsl.bell.ca.56476: Flags [P.], seq 4613768:4613980, ack 2665, win 501, length 212
02:46:04.017016 IP comp3134-Winter2023.ssh > bras-base-toroon63ztr-grc-42-174-91-170-42.dsl.bell.ca.56476: Flags [P.], seq 4613980:4614192, ack 2665, win 501, length 212
02:46:04.017062 IP comp3134-Winter2023.ssh > bras-base-toroon63ztr-grc-42-174-91-170-42.dsl.bell.ca.56476: Flags [P.], seq 4614192:4614404, ack 2665, win 501, length 212
02:46:04.017134 IP comp3134-Winter2023.ssh > bras-base-toroon63ztr-grc-42-174-91-170-42.dsl.bell.ca.56476: Flags [P.], seq 4614404:4614616, ack 2665, win 501, length 212
02:46:04.017186 IP comp3134-Winter2023.ssh > bras-base-toroon63ztr-grc-42-174-91-170-42.dsl.bell.ca.56476: Flags [P.], seq 4614616:4614828, ack 2665, win 501, length 212
02:46:04.017246 IP comp3134-Winter2023.ssh > bras-base-toroon63ztr-grc-42-174-91-170-42.dsl.bell.ca.56476: Flags [P.], seq 4614828:4615040, ack 2665, win 501, length 212
02:46:04.017299 IP comp3134-Winter2023.ssh > bras-base-toroon63ztr-grc-42-174-91-170-42.dsl.bell.ca.56476: Flags [P.], seq 4615040:4615252, ack 2665, win 501, length 212
02:46:04.017438 IP bras-base-toroon63ztr-grc-42-174-91-170-42.dsl.bell.ca.56476 > comp3134-Winter2023.ssh: Flags [.], ack 4606476, win 8337, length 0
02:46:04.017478 IP comp3134-Winter2023.ssh > bras-base-toroon63ztr-grc-42-174-91-170-42.dsl.bell.ca.56476: Flags [P.], seq 4615252:4615464, ack 2665, win 501, length 212
02:46:04.017585 IP comp3134-Winter2023.ssh > bras-base-toroon63ztr-grc-42-174-91-170-42.dsl.bell.ca.56476: Flags [P.], seq 4615464:4615820, ack 2665, win 501, length 356
02:46:04.017673 IP comp3134-Winter2023.ssh > bras-base-toroon63ztr-grc-42-174-91-170-42.dsl.bell.ca.56476: Flags [P.], seq 4615820:4616032, ack 2665, win 501, length 212
02:46:04.017979 IP comp3134-Winter2023.ssh > bras-base-toroon63ztr-grc-42-174-91-170-42.dsl.bell.ca.56476: Flags [P.], seq 4616032:4616244, ack 2665, win 501, length 212
02:46:04.018289 IP comp3134-Winter2023.ssh > bras-base-toroon63ztr-grc-42-174-91-170-42.dsl.bell.ca.56476: Flags [P.], seq 4616244:4616456, ack 2665, win 501, length 212
02:46:04.018378 IP comp3134-Winter2023.ssh > bras-base-toroon63ztr-grc-42-174-91-170-42.dsl.bell.ca.56476: Flags [P.], seq 4616456:4616668, ack 2665, win 501, length 212
02:46:04.018434 IP comp3134-Winter2023.ssh > bras-base-toroon63ztr-grc-42-174-91-170-42.dsl.bell.ca.56476: Flags [P.], seq 4616668:4616880, ack 2665, win 501, length 212
02:46:04.018483 IP comp3134-Winter2023.ssh > bras-base-toroon63ztr-grc-42-174-91-170-42.dsl.bell.ca.56476: Flags [P.], seq 4616880:4617092, ack 2665, win 501, length 212
02:46:04.019502 IP bras-base-toroon63ztr-grc-42-174-91-170-42.dsl.bell.ca.56476 > comp3134-Winter2023.ssh: Flags [.], ack 4611436, win 8337, length 0
02:46:04.019576 IP comp3134-Winter2023.ssh > bras-base-toroon63ztr-grc-42-174-91-170-42.dsl.bell.ca.56476: Flags [P.], seq 4617092:4617304, ack 2665, win 501, length 212
02:46:04.019767 IP comp3134-Winter2023.ssh > bras-base-toroon63ztr-grc-42-174-91-170-42.dsl.bell.ca.56476: Flags [P.], seq 4617304:4617660, ack 2665, win 501, length 356
02:46:04.019825 IP comp3134-Winter2023.ssh > bras-base-toroon63ztr-grc-42-174-91-170-42.dsl.bell.ca.56476: Flags [P.], seq 4617660:4617872, ack 2665, win 501, length 212
02:46:04.019900 IP comp3134-Winter2023.ssh > bras-base-toroon63ztr-grc-42-174-91-170-42.dsl.bell.ca.56476: Flags [P.], seq 4617872:4618084, ack 2665, win 501, length 212
02:46:04.020056 IP comp3134-Winter2023.ssh > bras-base-toroon63ztr-grc-42-174-91-170-42.dsl.bell.ca.56476: Flags [P.], seq 4618084:4618296, ack 2665, win 501, length 212
02:46:04.020224 IP comp3134-Winter2023.ssh > bras-base-toroon63ztr-grc-42-174-91-170-42.dsl.bell.ca.56476: Flags [P.], seq 4618296:4618508, ack 2665, win 501, length 212
02:46:04.020302 IP comp3134-Winter2023.ssh > bras-base-toroon63ztr-grc-42-174-91-170-42.dsl.bell.ca.56476: Flags [P.], seq 4618508:4618720, ack 2665, win 501, length 212
02:46:04.020349 IP comp3134-Winter2023.ssh > bras-base-toroon63ztr-grc-42-174-91-170-42.dsl.bell.ca.56476: Flags [P.], seq 4618720:4618932, ack 2665, win 501, length 212
02:46:04.020396 IP comp3134-Winter2023.ssh > bras-base-toroon63ztr-grc-42-174-91-170-42.dsl.bell.ca.56476: Flags [P.], seq 4618932:4619144, ack 2665, win 501, length 212
02:46:04.020445 IP comp3134-Winter2023.ssh > bras-base-toroon63ztr-grc-42-174-91-170-42.dsl.bell.ca.56476: Flags [P.], seq 4619144:4619356, ack 2665, win 501, length 212
02:46:04.020493 IP comp3134-Winter2023.ssh > bras-base-toroon63ztr-grc-42-174-91-170-42.dsl.bell.ca.56476: Flags [P.], seq 4619356:4619568, ack 2665, win 501, length 212
02:46:04.020809 IP comp3134-Winter2023.ssh > bras-base-toroon63ztr-grc-42-174-91-170-42.dsl.bell.ca.56476: Flags [P.], seq 4619568:4619780, ack 2665, win 501, length 212
02:46:04.020878 IP comp3134-Winter2023.ssh > bras-base-toroon63ztr-grc-42-174-91-170-42.dsl.bell.ca.56476: Flags [P.], seq 4619780:4619992, ack 2665, win 501, length 212
02:46:04.020932 IP comp3134-Winter2023.ssh > bras-base-toroon63ztr-grc-42-174-91-170-42.dsl.bell.ca.56476: Flags [P.], seq 4619992:4620204, ack 2665, win 501, length 212
02:46:04.021055 IP comp3134-Winter2023.ssh > bras-base-toroon63ztr-grc-42-174-91-170-42.dsl.bell.ca.56476: Flags [P.], seq 4620204:4620416, ack 2665, win 501, length 212
02:46:04.021116 IP comp3134-Winter2023.ssh > bras-base-toroon63ztr-grc-42-174-91-170-42.dsl.bell.ca.56476: Flags [P.], seq 4620416:4620628, ack 2665, win 501, length 212
02:46:04.021166 IP comp3134-Winter2023.ssh > bras-base-toroon63ztr-grc-42-174-91-170-42.dsl.bell.ca.56476: Flags [P.], seq 4620628:4620840, ack 2665, win 501, length 212
02:46:04.021226 IP comp3134-Winter2023.ssh > bras-base-toroon63ztr-grc-42-174-91-170-42.dsl.bell.ca.56476: Flags [P.], seq 4620840:4621052, ack 2665, win 501, length 212
02:46:04.021277 IP comp3134-Winter2023.ssh > bras-base-toroon63ztr-grc-42-174-91-170-42.dsl.bell.ca.56476: Flags [P.], seq 4621052:4621264, ack 2665, win 501, length 212
02:46:04.021384 IP comp3134-Winter2023.ssh > bras-base-toroon63ztr-grc-42-174-91-170-42.dsl.bell.ca.56476: Flags [P.], seq 4621264:4621476, ack 2665, win 501, length 212
02:46:04.021436 IP comp3134-Winter2023.ssh > bras-base-toroon63ztr-grc-42-174-91-170-42.dsl.bell.ca.56476: Flags [P.], seq 4621476:4621688, ack 2665, win 501, length 212
02:46:04.021484 IP comp3134-Winter2023.ssh > bras-base-toroon63ztr-grc-42-174-91-170-42.dsl.bell.ca.56476: Flags [P.], seq 4621688:4621900, ack 2665, win 501, length 212
02:46:04.021528 IP comp3134-Winter2023.ssh > bras-base-toroon63ztr-grc-42-174-91-170-42.dsl.bell.ca.56476: Flags [P.], seq 4621900:4622112, ack 2665, win 501, length 212
02:46:04.021581 IP comp3134-Winter2023.ssh > bras-base-toroon63ztr-grc-42-174-91-170-42.dsl.bell.ca.56476: Flags [P.], seq 4622112:4622324, ack 2665, win 501, length 212
02:46:04.021630 IP comp3134-Winter2023.ssh > bras-base-toroon63ztr-grc-42-174-91-170-42.dsl.bell.ca.56476: Flags [P.], seq 4622324:4622536, ack 2665, win 501, length 212
02:46:04.021696 IP comp3134-Winter2023.ssh > bras-base-toroon63ztr-grc-42-174-91-170-42.dsl.bell.ca.56476: Flags [P.], seq 4622536:4622748, ack 2665, win 501, length 212
02:46:04.021743 IP comp3134-Winter2023.ssh > bras-base-toroon63ztr-grc-42-174-91-170-42.dsl.bell.ca.56476: Flags [P.], seq 4622748:4622960, ack 2665, win 501, length 212
02:46:04.021790 IP comp3134-Winter2023.ssh > bras-base-toroon63ztr-grc-42-174-91-170-42.dsl.bell.ca.56476: Flags [P.], seq 4622960:4623172, ack 2665, win 501, length 212
02:46:04.021882 IP comp3134-Winter2023.ssh > bras-base-toroon63ztr-grc-42-174-91-170-42.dsl.bell.ca.56476: Flags [P.], seq 4623172:4623384, ack 2665, win 501, length 212
02:46:04.022076 IP comp3134-Winter2023.ssh > bras-base-toroon63ztr-grc-42-174-91-170-42.dsl.bell.ca.56476: Flags [P.], seq 4623384:4623596, ack 2665, win 501, length 212
02:46:04.022136 IP comp3134-Winter2023.ssh > bras-base-toroon63ztr-grc-42-174-91-170-42.dsl.bell.ca.56476: Flags [P.], seq 4623596:4623808, ack 2665, win 501, length 212
02:46:04.022187 IP comp3134-Winter2023.ssh > bras-base-toroon63ztr-grc-42-174-91-170-42.dsl.bell.ca.56476: Flags [P.], seq 4623808:4624020, ack 2665, win 501, length 212
02:46:04.022237 IP comp3134-Winter2023.ssh > bras-base-toroon63ztr-grc-42-174-91-170-42.dsl.bell.ca.56476: Flags [P.], seq 4624020:4624232, ack 2665, win 501, length 212
02:46:04.022264 IP bras-base-toroon63ztr-grc-42-174-91-170-42.dsl.bell.ca.56476 > comp3134-Winter2023.ssh: Flags [.], ack 4616880, win 8337, length 0
02:46:04.022374 IP comp3134-Winter2023.ssh > bras-base-toroon63ztr-grc-42-174-91-170-42.dsl.bell.ca.56476: Flags [P.], seq 4624232:4624588, ack 2665, win 501, length 356
02:46:04.022427 IP comp3134-Winter2023.ssh > bras-base-toroon63ztr-grc-42-174-91-170-42.dsl.bell.ca.56476: Flags [P.], seq 4624588:4624800, ack 2665, win 501, length 212
02:46:04.022474 IP comp3134-Winter2023.ssh > bras-base-toroon63ztr-grc-42-174-91-170-42.dsl.bell.ca.56476: Flags [P.], seq 4624800:4625012, ack 2665, win 501, length 212
02:46:04.022520 IP comp3134-Winter2023.ssh > bras-base-toroon63ztr-grc-42-174-91-170-42.dsl.bell.ca.56476: Flags [P.], seq 4625012:4625224, ack 2665, win 501, length 212
02:46:04.022570 IP comp3134-Winter2023.ssh > bras-base-toroon63ztr-grc-42-174-91-170-42.dsl.bell.ca.56476: Flags [P.], seq 4625224:4625436, ack 2665, win 501, length 212
02:46:04.022615 IP comp3134-Winter2023.ssh > bras-base-toroon63ztr-grc-42-174-91-170-42.dsl.bell.ca.56476: Flags [P.], seq 4625436:4625648, ack 2665, win 501, length 212
02:46:04.022662 IP comp3134-Winter2023.ssh > bras-base-toroon63ztr-grc-42-174-91-170-42.dsl.bell.ca.56476: Flags [P.], seq 4625648:4625860, ack 2665, win 501, length 212
02:46:04.022710 IP comp3134-Winter2023.ssh > bras-base-toroon63ztr-grc-42-174-91-170-42.dsl.bell.ca.56476: Flags [P.], seq 4625860:4626072, ack 2665, win 501, length 212
02:46:04.022758 IP comp3134-Winter2023.ssh > bras-base-toroon63ztr-grc-42-174-91-170-42.dsl.bell.ca.56476: Flags [P.], seq 4626072:4626284, ack 2665, win 501, length 212
02:46:04.022804 IP comp3134-Winter2023.ssh > bras-base-toroon63ztr-grc-42-174-91-170-42.dsl.bell.ca.56476: Flags [P.], seq 4626284:4626496, ack 2665, win 501, length 212
02:46:04.022850 IP comp3134-Winter2023.ssh > bras-base-toroon63ztr-grc-42-174-91-170-42.dsl.bell.ca.56476: Flags [P.], seq 4626496:4626708, ack 2665, win 501, length 212
02:46:04.023308 IP comp3134-Winter2023.ssh > bras-base-toroon63ztr-grc-42-174-91-170-42.dsl.bell.ca.56476: Flags [P.], seq 4626708:4626920, ack 2665, win 501, length 212
02:46:04.023405 IP bras-base-toroon63ztr-grc-42-174-91-170-42.dsl.bell.ca.56476 > comp3134-Winter2023.ssh: Flags [.], ack 4619356, win 8337, length 0
02:46:04.023432 IP comp3134-Winter2023.ssh > bras-base-toroon63ztr-grc-42-174-91-170-42.dsl.bell.ca.56476: Flags [P.], seq 4626920:4627132, ack 2665, win 501, length 212
02:46:04.023514 IP comp3134-Winter2023.ssh > bras-base-toroon63ztr-grc-42-174-91-170-42.dsl.bell.ca.56476: Flags [P.], seq 4627132:4627488, ack 2665, win 501, length 356
02:46:04.023564 IP comp3134-Winter2023.ssh > bras-base-toroon63ztr-grc-42-174-91-170-42.dsl.bell.ca.56476: Flags [P.], seq 4627488:4627700, ack 2665, win 501, length 212
02:46:04.023610 IP comp3134-Winter2023.ssh > bras-base-toroon63ztr-grc-42-174-91-170-42.dsl.bell.ca.56476: Flags [P.], seq 4627700:4627912, ack 2665, win 501, length 212
02:46:04.023661 IP comp3134-Winter2023.ssh > bras-base-toroon63ztr-grc-42-174-91-170-42.dsl.bell.ca.56476: Flags [P.], seq 4627912:4628124, ack 2665, win 501, length 212
02:46:04.023706 IP comp3134-Winter2023.ssh > bras-base-toroon63ztr-grc-42-174-91-170-42.dsl.bell.ca.56476: Flags [P.], seq 4628124:4628336, ack 2665, win 501, length 212
02:46:04.023751 IP comp3134-Winter2023.ssh > bras-base-toroon63ztr-grc-42-174-91-170-42.dsl.bell.ca.56476: Flags [P.], seq 4628336:4628548, ack 2665, win 501, length 212
02:46:04.023799 IP comp3134-Winter2023.ssh > bras-base-toroon63ztr-grc-42-174-91-170-42.dsl.bell.ca.56476: Flags [P.], seq 4628548:4628760, ack 2665, win 501, length 212
02:46:04.023846 IP comp3134-Winter2023.ssh > bras-base-toroon63ztr-grc-42-174-91-170-42.dsl.bell.ca.56476: Flags [P.], seq 4628760:4628972, ack 2665, win 501, length 212
02:46:04.023914 IP comp3134-Winter2023.ssh > bras-base-toroon63ztr-grc-42-174-91-170-42.dsl.bell.ca.56476: Flags [P.], seq 4628972:4629184, ack 2665, win 501, length 212
02:46:04.024042 IP comp3134-Winter2023.ssh > bras-base-toroon63ztr-grc-42-174-91-170-42.dsl.bell.ca.56476: Flags [P.], seq 4629184:4629396, ack 2665, win 501, length 212
02:46:04.024212 IP comp3134-Winter2023.ssh > bras-base-toroon63ztr-grc-42-174-91-170-42.dsl.bell.ca.56476: Flags [P.], seq 4629396:4629608, ack 2665, win 501, length 212
02:46:04.024281 IP comp3134-Winter2023.ssh > bras-base-toroon63ztr-grc-42-174-91-170-42.dsl.bell.ca.56476: Flags [P.], seq 4629608:4629820, ack 2665, win 501, length 212
02:46:04.024329 IP comp3134-Winter2023.ssh > bras-base-toroon63ztr-grc-42-174-91-170-42.dsl.bell.ca.56476: Flags [P.], seq 4629820:4630032, ack 2665, win 501, length 212
02:46:04.024376 IP comp3134-Winter2023.ssh > bras-base-toroon63ztr-grc-42-174-91-170-42.dsl.bell.ca.56476: Flags [P.], seq 4630032:4630244, ack 2665, win 501, length 212
02:46:04.024831 IP comp3134-Winter2023.ssh > bras-base-toroon63ztr-grc-42-174-91-170-42.dsl.bell.ca.56476: Flags [P.], seq 4630244:4630456, ack 2665, win 501, length 212
02:46:04.024893 IP comp3134-Winter2023.ssh > bras-base-toroon63ztr-grc-42-174-91-170-42.dsl.bell.ca.56476: Flags [P.], seq 4630456:4630668, ack 2665, win 501, length 212
02:46:04.024938 IP comp3134-Winter2023.ssh > bras-base-toroon63ztr-grc-42-174-91-170-42.dsl.bell.ca.56476: Flags [P.], seq 4630668:4630880, ack 2665, win 501, length 212
02:46:04.024986 IP comp3134-Winter2023.ssh > bras-base-toroon63ztr-grc-42-174-91-170-42.dsl.bell.ca.56476: Flags [P.], seq 4630880:4631092, ack 2665, win 501, length 212
02:46:04.025032 IP comp3134-Winter2023.ssh > bras-base-toroon63ztr-grc-42-174-91-170-42.dsl.bell.ca.56476: Flags [P.], seq 4631092:4631304, ack 2665, win 501, length 212
02:46:04.025077 IP comp3134-Winter2023.ssh > bras-base-toroon63ztr-grc-42-174-91-170-42.dsl.bell.ca.56476: Flags [P.], seq 4631304:4631516, ack 2665, win 501, length 212
02:46:04.025123 IP comp3134-Winter2023.ssh > bras-base-toroon63ztr-grc-42-174-91-170-42.dsl.bell.ca.56476: Flags [P.], seq 4631516:4631728, ack 2665, win 501, length 212
02:46:04.025166 IP comp3134-Winter2023.ssh > bras-base-toroon63ztr-grc-42-174-91-170-42.dsl.bell.ca.56476: Flags [P.], seq 4631728:4631940, ack 2665, win 501, length 212
02:46:04.025229 IP comp3134-Winter2023.ssh > bras-base-toroon63ztr-grc-42-174-91-170-42.dsl.bell.ca.56476: Flags [P.], seq 4631940:4632152, ack 2665, win 501, length 212
02:46:04.025272 IP comp3134-Winter2023.ssh > bras-base-toroon63ztr-grc-42-174-91-170-42.dsl.bell.ca.56476: Flags [P.], seq 4632152:4632364, ack 2665, win 501, length 212
02:46:04.025680 IP bras-base-toroon63ztr-grc-42-174-91-170-42.dsl.bell.ca.56476 > comp3134-Winter2023.ssh: Flags [.], ack 4624800, win 8337, length 0
02:46:04.025831 IP comp3134-Winter2023.ssh > bras-base-toroon63ztr-grc-42-174-91-170-42.dsl.bell.ca.56476: Flags [P.], seq 4632364:4632576, ack 2665, win 501, length 212
02:46:04.025943 IP comp3134-Winter2023.ssh > bras-base-toroon63ztr-grc-42-174-91-170-42.dsl.bell.ca.56476: Flags [P.], seq 4632576:4632932, ack 2665, win 501, length 356
02:46:04.026045 IP comp3134-Winter2023.ssh > bras-base-toroon63ztr-grc-42-174-91-170-42.dsl.bell.ca.56476: Flags [P.], seq 4632932:4633144, ack 2665, win 501, length 212
02:46:04.026150 IP comp3134-Winter2023.ssh > bras-base-toroon63ztr-grc-42-174-91-170-42.dsl.bell.ca.56476: Flags [P.], seq 4633144:4633356, ack 2665, win 501, length 212
02:46:04.026207 IP comp3134-Winter2023.ssh > bras-base-toroon63ztr-grc-42-174-91-170-42.dsl.bell.ca.56476: Flags [P.], seq 4633356:4633568, ack 2665, win 501, length 212
02:46:04.026257 IP bras-base-toroon63ztr-grc-42-174-91-170-42.dsl.bell.ca.56476 > comp3134-Winter2023.ssh: Flags [.], ack 4630032, win 8337, length 0
02:46:04.026286 IP comp3134-Winter2023.ssh > bras-base-toroon63ztr-grc-42-174-91-170-42.dsl.bell.ca.56476: Flags [P.], seq 4633568:4633780, ack 2665, win 501, length 212
02:46:04.026343 IP comp3134-Winter2023.ssh > bras-base-toroon63ztr-grc-42-174-91-170-42.dsl.bell.ca.56476: Flags [P.], seq 4633780:4634136, ack 2665, win 501, length 356
02:46:04.026385 IP comp3134-Winter2023.ssh > bras-base-toroon63ztr-grc-42-174-91-170-42.dsl.bell.ca.56476: Flags [P.], seq 4634136:4634348, ack 2665, win 501, length 212
02:46:04.026428 IP comp3134-Winter2023.ssh > bras-base-toroon63ztr-grc-42-174-91-170-42.dsl.bell.ca.56476: Flags [P.], seq 4634348:4634560, ack 2665, win 501, length 212
02:46:04.026570 IP comp3134-Winter2023.ssh > bras-base-toroon63ztr-grc-42-174-91-170-42.dsl.bell.ca.56476: Flags [P.], seq 4634560:4634772, ack 2665, win 501, length 212
02:46:04.026620 IP comp3134-Winter2023.ssh > bras-base-toroon63ztr-grc-42-174-91-170-42.dsl.bell.ca.56476: Flags [P.], seq 4634772:4634984, ack 2665, win 501, length 212
02:46:04.026662 IP comp3134-Winter2023.ssh > bras-base-toroon63ztr-grc-42-174-91-170-42.dsl.bell.ca.56476: Flags [P.], seq 4634984:4635196, ack 2665, win 501, length 212
02:46:04.026702 IP comp3134-Winter2023.ssh > bras-base-toroon63ztr-grc-42-174-91-170-42.dsl.bell.ca.56476: Flags [P.], seq 4635196:4635408, ack 2665, win 501, length 212
02:46:04.026746 IP comp3134-Winter2023.ssh > bras-base-toroon63ztr-grc-42-174-91-170-42.dsl.bell.ca.56476: Flags [P.], seq 4635408:4635620, ack 2665, win 501, length 212
02:46:04.026791 IP comp3134-Winter2023.ssh > bras-base-toroon63ztr-grc-42-174-91-170-42.dsl.bell.ca.56476: Flags [P.], seq 4635620:4635832, ack 2665, win 501, length 212
02:46:04.026834 IP comp3134-Winter2023.ssh > bras-base-toroon63ztr-grc-42-174-91-170-42.dsl.bell.ca.56476: Flags [P.], seq 4635832:4636044, ack 2665, win 501, length 212
