32:1293988, ack 721, win 501, length 156
02:45:23.744861 IP 137.184.172.1.22 > 174.91.170.42.56476: Flags [P.], seq 1293988:1294144, ack 721, win 501, length 156
02:45:23.744911 IP 137.184.172.1.22 > 174.91.170.42.56476: Flags [P.], seq 1294144:1294300, ack 721, win 501, length 156
02:45:23.744970 IP 137.184.172.1.22 > 174.91.170.42.56476: Flags [P.], seq 1294300:1294612, ack 721, win 501, length 312
02:45:23.745023 IP 137.184.172.1.22 > 174.91.170.42.56476: Flags [P.], seq 1294612:1294768, ack 721, win 501, length 156
02:45:23.745524 IP 137.184.172.1.22 > 174.91.170.42.56476: Flags [P.], seq 1294768:1294924, ack 721, win 501, length 156
02:45:23.745643 IP 137.184.172.1.22 > 174.91.170.42.56476: Flags [P.], seq 1294924:1295080, ack 721, win 501, length 156
02:45:23.745853 IP 137.184.172.1.22 > 174.91.170.42.56476: Flags [P.], seq 1295080:1295236, ack 721, win 501, length 156
02:45:23.746018 IP 137.184.172.1.22 > 174.91.170.42.56476: Flags [P.], seq 1295236:1295392, ack 721, win 501, length 156
02:45:23.748645 IP 174.91.170.42.56476 > 137.184.172.1.22: Flags [.], ack 1292132, win 8334, length 0
02:45:23.748646 IP 174.91.170.42.56476 > 137.184.172.1.22: Flags [.], ack 1295080, win 8337, length 0
02:45:23.748716 IP 137.184.172.1.22 > 174.91.170.42.56476: Flags [P.], seq 1295392:1295548, ack 721, win 501, length 156
02:45:23.748944 IP 137.184.172.1.22 > 174.91.170.42.56476: Flags [P.], seq 1295548:1295912, ack 721, win 501, length 364
02:45:23.749261 IP 137.184.172.1.22 > 174.91.170.42.56476: Flags [P.], seq 1295912:1296068, ack 721, win 501, length 156
02:45:23.749374 IP 137.184.172.1.22 > 174.91.170.42.56476: Flags [P.], seq 1296068:1296224, ack 721, win 501, length 156
02:45:23.749429 IP 137.184.172.1.22 > 174.91.170.42.56476: Flags [P.], seq 1296224:1296380, ack 721, win 501, length 156
02:45:23.749602 IP 137.184.172.1.22 > 174.91.170.42.56476: Flags [P.], seq 1296380:1296536, ack 721, win 501, length 156
02:45:23.749777 IP 137.184.172.1.22 > 174.91.170.42.56476: Flags [P.], seq 1296536:1296692, ack 721, win 501, length 156
02:45:23.750204 IP 137.184.172.1.22 > 174.91.170.42.56476: Flags [P.], seq 1296692:1296848, ack 721, win 501, length 156
02:45:23.750280 IP 137.184.172.1.22 > 174.91.170.42.56476: Flags [P.], seq 1296848:1297004, ack 721, win 501, length 156
02:45:23.750364 IP 137.184.172.1.22 > 174.91.170.42.56476: Flags [P.], seq 1297004:1297160, ack 721, win 501, length 156
02:45:23.750424 IP 137.184.172.1.22 > 174.91.170.42.56476: Flags [P.], seq 1297160:1297316, ack 721, win 501, length 156
02:45:23.750475 IP 137.184.172.1.22 > 174.91.170.42.56476: Flags [P.], seq 1297316:1297472, ack 721, win 501, length 156
02:45:23.750687 IP 137.184.172.1.22 > 174.91.170.42.56476: Flags [P.], seq 1297472:1297628, ack 721, win 501, length 156
02:45:23.750768 IP 137.184.172.1.22 > 174.91.170.42.56476: Flags [P.], seq 1297628:1297784, ack 721, win 501, length 156
02:45:23.750830 IP 137.184.172.1.22 > 174.91.170.42.56476: Flags [P.], seq 1297784:1297940, ack 721, win 501, length 156
02:45:23.750885 IP 137.184.172.1.22 > 174.91.170.42.56476: Flags [P.], seq 1297940:1298096, ack 721, win 501, length 156
02:45:23.750941 IP 137.184.172.1.22 > 174.91.170.42.56476: Flags [P.], seq 1298096:1298252, ack 721, win 501, length 156
02:45:23.750993 IP 137.184.172.1.22 > 174.91.170.42.56476: Flags [P.], seq 1298252:1298408, ack 721, win 501, length 156
02:45:23.751082 IP 137.184.172.1.22 > 174.91.170.42.56476: Flags [P.], seq 1298408:1298564, ack 721, win 501, length 156
02:45:23.751484 IP 137.184.172.1.22 > 174.91.170.42.56476: Flags [P.], seq 1298564:1298720, ack 721, win 501, length 156
02:45:23.751983 IP 174.91.170.42.56476 > 137.184.172.1.22: Flags [.], ack 1295236, win 8337, length 0
02:45:23.752035 IP 137.184.172.1.22 > 174.91.170.42.56476: Flags [P.], seq 1298720:1298876, ack 721, win 501, length 156
02:45:23.752217 IP 137.184.172.1.22 > 174.91.170.42.56476: Flags [P.], seq 1298876:1299136, ack 721, win 501, length 260
02:45:23.752326 IP 137.184.172.1.22 > 174.91.170.42.56476: Flags [P.], seq 1299136:1299292, ack 721, win 501, length 156
02:45:23.752387 IP 174.91.170.42.56476 > 137.184.172.1.22: Flags [.], ack 1296692, win 8337, length 0
02:45:23.752457 IP 137.184.172.1.22 > 174.91.170.42.56476: Flags [P.], seq 1299292:1299552, ack 721, win 501, length 260
02:45:23.752514 IP 137.184.172.1.22 > 174.91.170.42.56476: Flags [P.], seq 1299552:1299708, ack 721, win 501, length 156
02:45:23.752887 IP 137.184.172.1.22 > 174.91.170.42.56476: Flags [P.], seq 1299708:1299864, ack 721, win 501, length 156
02:45:23.753019 IP 137.184.172.1.22 > 174.91.170.42.56476: Flags [P.], seq 1299864:1300020, ack 721, win 501, length 156
02:45:23.753079 IP 137.184.172.1.22 > 174.91.170.42.56476: Flags [P.], seq 1300020:1300176, ack 721, win 501, length 156
02:45:23.753230 IP 137.184.172.1.22 > 174.91.170.42.56476: Flags [P.], seq 1300176:1300332, ack 721, win 501, length 156
02:45:23.753868 IP 137.184.172.1.22 > 174.91.170.42.56476: Flags [P.], seq 1300332:1300488, ack 721, win 501, length 156
02:45:23.753990 IP 137.184.172.1.22 > 174.91.170.42.56476: Flags [P.], seq 1300488:1300644, ack 721, win 501, length 156
02:45:23.754061 IP 137.184.172.1.22 > 174.91.170.42.56476: Flags [P.], seq 1300644:1300800, ack 721, win 501, length 156
02:45:23.754546 IP 174.91.170.42.56476 > 137.184.172.1.22: Flags [.], ack 1298564, win 8337, length 0
02:45:23.754578 IP 137.184.172.1.22 > 174.91.170.42.56476: Flags [P.], seq 1300800:1300956, ack 721, win 501, length 156
02:45:23.754695 IP 137.184.172.1.22 > 174.91.170.42.56476: Flags [P.], seq 1300956:1301216, ack 721, win 501, length 260
02:45:23.754746 IP 137.184.172.1.22 > 174.91.170.42.56476: Flags [P.], seq 1301216:1301372, ack 721, win 501, length 156
02:45:23.754796 IP 137.184.172.1.22 > 174.91.170.42.56476: Flags [P.], seq 1301372:1301528, ack 721, win 501, length 156
02:45:23.754843 IP 137.184.172.1.22 > 174.91.170.42.56476: Flags [P.], seq 1301528:1301684, ack 721, win 501, length 156
02:45:23.754890 IP 137.184.172.1.22 > 174.91.170.42.56476: Flags [P.], seq 1301684:1301840, ack 721, win 501, length 156
02:45:23.754957 IP 137.184.172.1.22 > 174.91.170.42.56476: Flags [P.], seq 1301840:1301996, ack 721, win 501, length 156
02:45:23.755031 IP 137.184.172.1.22 > 174.91.170.42.56476: Flags [P.], seq 1301996:1302152, ack 721, win 501, length 156
02:45:23.755985 IP 137.184.172.1.22 > 174.91.170.42.56476: Flags [P.], seq 1302152:1302308, ack 721, win 501, length 156
02:45:23.756148 IP 137.184.172.1.22 > 174.91.170.42.56476: Flags [P.], seq 1302308:1302464, ack 721, win 501, length 156
02:45:23.756232 IP 137.184.172.1.22 > 174.91.170.42.56476: Flags [P.], seq 1302464:1302620, ack 721, win 501, length 156
02:45:23.756293 IP 137.184.172.1.22 > 174.91.170.42.56476: Flags [P.], seq 1302620:1302776, ack 721, win 501, length 156
02:45:23.756341 IP 137.184.172.1.22 > 174.91.170.42.56476: Flags [P.], seq 1302776:1302932, ack 721, win 501, length 156
02:45:23.756407 IP 174.91.170.42.56476 > 137.184.172.1.22: Flags [.], ack 1300488, win 8337, length 0
02:45:23.756469 IP 137.184.172.1.22 > 174.91.170.42.56476: Flags [P.], seq 1302932:1303088, ack 721, win 501, length 156
02:45:23.756514 IP 137.184.172.1.22 > 174.91.170.42.56476: Flags [P.], seq 1303088:1303228, ack 721, win 501, length 140
02:45:23.756556 IP 137.184.172.1.22 > 174.91.170.42.56476: Flags [P.], seq 1303228:1303384, ack 721, win 501, length 156
02:45:23.756600 IP 137.184.172.1.22 > 174.91.170.42.56476: Flags [P.], seq 1303384:1303540, ack 721, win 501, length 156
02:45:23.756641 IP 137.184.172.1.22 > 174.91.170.42.56476: Flags [P.], seq 1303540:1303696, ack 721, win 501, length 156
02:45:23.756687 IP 137.184.172.1.22 > 174.91.170.42.56476: Flags [P.], seq 1303696:1303852, ack 721, win 501, length 156
02:45:23.756730 IP 137.184.172.1.22 > 174.91.170.42.56476: Flags [P.], seq 1303852:1304008, ack 721, win 501, length 156
02:45:23.756772 IP 137.184.172.1.22 > 174.91.170.42.56476: Flags [P.], seq 1304008:1304164, ack 721, win 501, length 156
02:45:23.756825 IP 137.184.172.1.22 > 174.91.170.42.56476: Flags [P.], seq 1304164:1304476, ack 721, win 501, length 312
02:45:23.758362 IP 137.184.172.1.22 > 174.91.170.42.56476: Flags [P.], seq 1304476:1304632, ack 721, win 501, length 156
02:45:23.758504 IP 174.91.170.42.56476 > 137.184.172.1.22: Flags [.], ack 1302152, win 8337, length 0
02:45:23.758534 IP 137.184.172.1.22 > 174.91.170.42.56476: Flags [P.], seq 1304632:1304788, ack 721, win 501, length 156
02:45:23.758609 IP 137.184.172.1.22 > 174.91.170.42.56476: Flags [P.], seq 1304788:1305048, ack 721, win 501, length 260
02:45:23.758778 IP 137.184.172.1.22 > 174.91.170.42.56476: Flags [P.], seq 1305048:1305204, ack 721, win 501, length 156
02:45:23.758967 IP 137.184.172.1.22 > 174.91.170.42.56476: Flags [P.], seq 1305204:1305360, ack 721, win 501, length 156
02:45:23.759796 IP 137.184.172.1.22 > 174.91.170.42.56476: Flags [P.], seq 1305360:1305516, ack 721, win 501, length 156
02:45:23.759928 IP 137.184.172.1.22 > 174.91.170.42.56476: Flags [P.], seq 1305516:1305672, ack 721, win 501, length 156
02:45:23.759994 IP 137.184.172.1.22 > 174.91.170.42.56476: Flags [P.], seq 1305672:1305828, ack 721, win 501, length 156
02:45:23.760071 IP 137.184.172.1.22 > 174.91.170.42.56476: Flags [P.], seq 1305828:1305984, ack 721, win 501, length 156
02:45:23.760121 IP 137.184.172.1.22 > 174.91.170.42.56476: Flags [P.], seq 1305984:1306140, ack 721, win 501, length 156
02:45:23.760171 IP 137.184.172.1.22 > 174.91.170.42.56476: Flags [P.], seq 1306140:1306296, ack 721, win 501, length 156
02:45:23.760226 IP 137.184.172.1.22 > 174.91.170.42.56476: Flags [P.], seq 1306296:1306452, ack 721, win 501, length 156
02:45:23.760275 IP 137.184.172.1.22 > 174.91.170.42.56476: Flags [P.], seq 1306452:1306608, ack 721, win 501, length 156
02:45:23.760326 IP 137.184.172.1.22 > 174.91.170.42.56476: Flags [P.], seq 1306608:1306764, ack 721, win 501, length 156
02:45:23.760383 IP 174.91.170.42.56476 > 137.184.172.1.22: Flags [.], ack 1304476, win 8337, length 0
02:45:23.760445 IP 137.184.172.1.22 > 174.91.170.42.56476: Flags [P.], seq 1306764:1306920, ack 721, win 501, length 156
02:45:23.760501 IP 137.184.172.1.22 > 174.91.170.42.56476: Flags [P.], seq 1306920:1307180, ack 721, win 501, length 260
02:45:23.760553 IP 137.184.172.1.22 > 174.91.170.42.56476: Flags [P.], seq 1307180:1307336, ack 721, win 501, length 156
02:45:23.760658 IP 137.184.172.1.22 > 174.91.170.42.56476: Flags [P.], seq 1307336:1307492, ack 721, win 501, length 156
02:45:23.760812 IP 137.184.172.1.22 > 174.91.170.42.56476: Flags [P.], seq 1307492:1307648, ack 721, win 501, length 156
02:45:23.760876 IP 137.184.172.1.22 > 174.91.170.42.56476: Flags [P.], seq 1307648:1307804, ack 721, win 501, length 156
02:45:23.760928 IP 137.184.172.1.22 > 174.91.170.42.56476: Flags [P.], seq 1307804:1307960, ack 721, win 501, length 156
02:45:23.760994 IP 137.184.172.1.22 > 174.91.170.42.56476: Flags [P.], seq 1307960:1308116, ack 721, win 501, length 156
02:45:23.761068 IP 137.184.172.1.22 > 174.91.170.42.56476: Flags [P.], seq 1308116:1308272, ack 721, win 501, length 156
02:45:23.761198 IP 137.184.172.1.22 > 174.91.170.42.56476: Flags [P.], seq 1308272:1308428, ack 721, win 501, length 156
02:45:23.761255 IP 137.184.172.1.22 > 174.91.170.42.56476: Flags [P.], seq 1308428:1308584, ack 721, win 501, length 156
02:45:23.761324 IP 137.184.172.1.22 > 174.91.170.42.56476: Flags [P.], seq 1308584:1308740, ack 721, win 501, length 156
02:45:23.761393 IP 137.184.172.1.22 > 174.91.170.42.56476: Flags [P.], seq 1308740:1308896, ack 721, win 501, length 156
02:45:23.761453 IP 137.184.172.1.22 > 174.91.170.42.56476: Flags [P.], seq 1308896:1309052, ack 721, win 501, length 156
02:45:23.761494 IP 137.184.172.1.22 > 174.91.170.42.56476: Flags [P.], seq 1309052:1309208, ack 721, win 501, length 156
02:45:23.761551 IP 137.184.172.1.22 > 174.91.170.42.56476: Flags [P.], seq 1309208:1309364, ack 721, win 501, length 156
02:45:23.761610 IP 137.184.172.1.22 > 174.91.170.42.56476: Flags [P.], seq 1309364:1309520, ack 721, win 501, length 156
02:45:23.761665 IP 137.184.172.1.22 > 174.91.170.42.56476: Flags [P.], seq 1309520:1309676, ack 721, win 501, length 156
02:45:23.761707 IP 137.184.172.1.22 > 174.91.170.42.56476: Flags [P.], seq 1309676:1309832, ack 721, win 501, length 156
02:45:23.761751 IP 137.184.172.1.22 > 174.91.170.42.56476: Flags [P.], seq 1309832:1309988, ack 721, win 501, length 156
02:45:23.762211 IP 137.184.172.1.22 > 174.91.170.42.56476: Flags [P.], seq 1309988:1310144, ack 721, win 501, length 156
02:45:23.762609 IP 174.91.170.42.56476 > 137.184.172.1.22: Flags [.], ack 1305516, win 8333, length 0
02:45:23.762775 IP 137.184.172.1.22 > 174.91.170.42.56476: Flags [P.], seq 1310144:1310404, ack 721, win 501, length 260
02:45:23.762855 IP 137.184.172.1.22 > 174.91.170.42.56476: Flags [P.], seq 1310404:1310560, ack 721, win 501, length 156
02:45:23.762959 IP 137.184.172.1.22 > 174.91.170.42.56476: Flags [P.], seq 1310560:1310716, ack 721, win 501, length 156
02:45:23.763002 IP 137.184.172.1.22 > 174.91.170.42.56476: Flags [P.], seq 1310716:1310872, ack 721, win 501, length 156
02:45:23.763055 IP 137.184.172.1.22 > 174.91.170.42.56476: Flags [P.], seq 1310872:1311028, ack 721, win 501, length 156
02:45:23.763346 IP 137.184.172.1.22 > 174.91.170.42.56476: Flags [P.], seq 1311028:1311184, ack 721, win 501, length 156
02:45:23.763427 IP 137.184.172.1.22 > 174.91.170.42.56476: Flags [P.], seq 1311184:1311340, ack 721, win 501, length 156
02:45:23.763561 IP 137.184.172.1.22 > 174.91.170.42.56476: Flags [P.], seq 1311340:1311496, ack 721, win 501, length 156
02:45:23.763617 IP 137.184.172.1.22 > 174.91.170.42.56476: Flags [P.], seq 1311496:1311652, ack 721, win 501, length 156
02:45:23.765176 IP 174.91.170.42.56476 > 137.184.172.1.22: Flags [.], ack 1309832, win 8337, length 0
02:45:23.765246 IP 137.184.172.1.22 > 174.91.170.42.56476: Flags [P.], seq 1311652:1311808, ack 721, win 501, length 156
02:45:23.765389 IP 174.91.170.42.56476 > 137.184.172.1.22: Flags [P.], seq 721:757, ack 1309832, win 8337, length 36
02:45:23.765446 IP 137.184.172.1.22 > 174.91.170.42.56476: Flags [P.], seq 1311808:1312068, ack 757, win 501, length 260
02:45:23.765515 IP 137.184.172.1.22 > 174.91.170.42.56476: Flags [P.], seq 1312068:1312380, ack 757, win 501, length 312
02:45:23.765622 IP 137.184.172.1.22 > 174.91.170.42.56476: Flags [P.], seq 1312380:1312536, ack 757, win 501, length 156
02:45:23.765745 IP 137.184.172.1.22 > 174.91.170.42.56476: Flags [P.], seq 1312536:1312692, ack 757, win 501, length 156
02:45:23.765819 IP 137.184.172.1.22 > 174.91.170.42.56476: Flags [P.], seq 1312692:1312848, ack 757, win 501, length 156
02:45:23.765867 IP 137.184.172.1.22 > 174.91.170.42.56476: Flags [P.], seq 1312848:1313004, ack 757, win 501, length 156
02:45:23.765935 IP 137.184.172.1.22 > 174.91.170.42.56476: Flags [P.], seq 1313004:1313160, ack 757, win 501, length 156
02:45:23.765982 IP 137.184.172.1.22 > 174.91.170.42.56476: Flags [P.], seq 1313160:1313316, ack 757, win 501, length 156
02:45:23.766042 IP 137.184.172.1.22 > 174.91.170.42.56476: Flags [P.], seq 1313316:1313472, ack 757, win 501, length 156
02:45:23.766093 IP 137.184.172.1.22 > 174.91.170.42.56476: Flags [P.], seq 1313472:1313628, ack 757, win 501, length 156
02:45:23.766138 IP 137.184.172.1.22 > 174.91.170.42.56476: Flags [P.], seq 1313628:1313784, ack 757, win 501, length 156
02:45:23.766187 IP 137.184.172.1.22 > 174.91.170.42.56476: Flags [P.], seq 1313784:1313940, ack 757, win 501, length 156
02:45:23.766234 IP 137.184.172.1.22 > 174.91.170.42.56476: Flags [P.], seq 1313940:1314096, ack 757, win 501, length 156
02:45:23.766281 IP 137.184.172.1.22 > 174.91.170.42.56476: Flags [P.], seq 1314096:1314252, ack 757, win 501, length 156
02:45:23.766374 IP 137.184.172.1.22 > 174.91.170.42.56476: Flags [P.], seq 1314252:1314408, ack 757, win 501, length 156
02:45:23.766424 IP 137.184.172.1.22 > 174.91.170.42.56476: Flags [P.], seq 1314408:1314564, ack 757, win 501, length 156
02:45:23.766440 IP 174.91.170.42.56476 > 137.184.172.1.22: Flags [.], ack 1311496, win 8337, length 0
02:45:23.766509 IP 137.184.172.1.22 > 174.91.170.42.56476: Flags [P.], seq 1314564:1314824, ack 757, win 501, length 260
02:45:23.766686 IP 137.184.172.1.22 > 174.91.170.42.56476: Flags [P.], seq 1314824:1314980, ack 757, win 501, length 156
02:45:23.766761 IP 137.184.172.1.22 > 174.91.170.42.56476: Flags [P.], seq 1314980:1315136, ack 757, win 501, length 156
02:45:23.766806 IP 137.184.172.1.22 > 174.91.170.42.56476: Flags [P.], seq 1315136:1315292, ack 757, win 501, length 156
02:45:23.766870 IP 137.184.172.1.22 > 174.91.170.42.56476: Flags [P.], seq 1315292:1315448, ack 757, win 501, length 156
02:45:23.766916 IP 137.184.172.1.22 > 174.91.170.42.56476: Flags [P.], seq 1315448:1315604, ack 757, win 501, length 156
02:45:23.766959 IP 137.184.172.1.22 > 174.91.170.42.56476: Flags [P.], seq 1315604:1315760, ack 757, win 501, length 156
02:45:23.767002 IP 137.184.172.1.22 > 174.91.170.42.56476: Flags [P.], seq 1315760:1315916, ack 757, win 501, length 156
02:45:23.767735 IP 137.184.172.1.22 > 174.91.170.42.56476: Flags [P.], seq 1315916:1316072, ack 757, win 501, length 156
02:45:23.767930 IP 137.184.172.1.22 > 174.91.170.42.56476: Flags [P.], seq 1316072:1316228, ack 757, win 501, length 156
02:45:23.768085 IP 137.184.172.1.22 > 174.91.170.42.56476: Flags [P.], seq 1316228:1316384, ack 757, win 501, length 156
02:45:23.768316 IP 137.184.172.1.22 > 174.91.170.42.56476: Flags [P.], seq 1316384:1316540, ack 757, win 501, length 156
02:45:23.770642 IP 174.91.170.42.56476 > 137.184.172.1.22: Flags [.], ack 1313316, win 8337, length 0
02:45:23.770643 IP 174.91.170.42.56476 > 137.184.172.1.22: Flags [.], ack 1316228, win 8337, length 0
02:45:23.770719 IP 137.184.172.1.22 > 174.91.170.42.56476: Flags [P.], seq 1316540:1316696, ack 757, win 501, length 156
02:45:23.770934 IP 137.184.172.1.22 > 174.91.170.42.56476: Flags [P.], seq 1316696:1317060, ack 757, win 501, length 364
02:45:23.771003 IP 137.184.172.1.22 > 174.91.170.42.56476: Flags [P.], seq 1317060:1317216, ack 757, win 501, length 156
02:45:23.771532 IP 137.184.172.1.22 > 174.91.170.42.56476: Flags [P.], seq 1317216:1317372, ack 757, win 501, length 156
02:45:23.771715 IP 137.184.172.1.22 > 174.91.170.42.56476: Flags [P.], seq 1317372:1317528, ack 757, win 501, length 156
02:45:23.771778 IP 137.184.172.1.22 > 174.91.170.42.56476: Flags [P.], seq 1317528:1317684, ack 757, win 501, length 156
02:45:23.771827 IP 137.184.172.1.22 > 174.91.170.42.56476: Flags [P.], seq 1317684:1317840, ack 757, win 501, length 156
02:45:23.771864 IP 137.184.172.1.22 > 174.91.170.42.56476: Flags [P.], seq 1317840:1317996, ack 757, win 501, length 156
02:45:23.771905 IP 137.184.172.1.22 > 174.91.170.42.56476: Flags [P.], seq 1317996:1318152, ack 757, win 501, length 156
02:45:23.771951 IP 137.184.172.1.22 > 174.91.170.42.56476: Flags [P.], seq 1318152:1318308, ack 757, win 501, length 156
02:45:23.771996 IP 137.184.172.1.22 > 174.91.170.42.56476: Flags [P.], seq 1318308:1318464, ack 757, win 501, length 156
02:45:23.772040 IP 137.184.172.1.22 > 174.91.170.42.56476: Flags [P.], seq 1318464:1318620, ack 757, win 501, length 156
02:45:23.772086 IP 137.184.172.1.22 > 174.91.170.42.56476: Flags [P.], seq 1318620:1318776, ack 757, win 501, length 156
02:45:23.772133 IP 137.184.172.1.22 > 174.91.170.42.56476: Flags [P.], seq 1318776:1318932, ack 757, win 501, length 156
02:45:23.772182 IP 137.184.172.1.22 > 174.91.170.42.56476: Flags [P.], seq 1318932:1319088, ack 757, win 501, length 156
02:45:23.772222 IP 137.184.172.1.22 > 174.91.170.42.56476: Flags [P.], seq 1319088:1319244, ack 757, win 501, length 156
02:45:23.772258 IP 137.184.172.1.22 > 174.91.170.42.56476: Flags [P.], seq 1319244:1319400, ack 757, win 501, length 156
02:45:23.772309 IP 137.184.172.1.22 > 174.91.170.42.56476: Flags [P.], seq 1319400:1319556, ack 757, win 501, length 156
02:45:23.772350 IP 137.184.172.1.22 > 174.91.170.42.56476: Flags [P.], seq 1319556:1319712, ack 757, win 501, length 156
02:45:23.772384 IP 137.184.172.1.22 > 174.91.170.42.56476: Flags [P.], seq 1319712:1319868, ack 757, win 501, length 156
02:45:23.772499 IP 137.184.172.1.22 > 174.91.170.42.56476: Flags [P.], seq 1319868:1320024, ack 757, win 501, length 156
02:45:23.772545 IP 137.184.172.1.22 > 174.91.170.42.56476: Flags [P.], seq 1320024:1320180, ack 757, win 501, length 156
02:45:23.772589 IP 137.184.172.1.22 > 174.91.170.42.56476: Flags [P.], seq 1320180:1320336, ack 757, win 501, length 156
02:45:23.772634 IP 137.184.172.1.22 > 174.91.170.42.56476: Flags [P.], seq 1320336:1320492, ack 757, win 501, length 156
02:45:23.772681 IP 137.184.172.1.22 > 174.91.170.42.56476: Flags [P.], seq 1320492:1320648, ack 757, win 501, length 156
02:45:23.772795 IP 137.184.172.1.22 > 174.91.170.42.56476: Flags [P.], seq 1320648:1320804, ack 757, win 501, length 156
02:45:23.772844 IP 137.184.172.1.22 > 174.91.170.42.56476: Flags [P.], seq 1320804:1320960, ack 757, win 501, length 156
02:45:23.772885 IP 137.184.172.1.22 > 174.91.170.42.56476: Flags [P.], seq 1320960:1321116, ack 757, win 501, length 156
02:45:23.772927 IP 137.184.172.1.22 > 174.91.170.42.56476: Flags [P.], seq 1321116:1321272, ack 757, win 501, length 156
02:45:23.772968 IP 137.184.172.1.22 > 174.91.170.42.56476: Flags [P.], seq 1321272:1321428, ack 757, win 501, length 156
02:45:23.773009 IP 137.184.172.1.22 > 174.91.170.42.56476: Flags [P.], seq 1321428:1321584, ack 757, win 501, length 156
02:45:23.773578 IP 137.184.172.1.22 > 174.91.170.42.56476: Flags [P.], seq 1321584:1321740, ack 757, win 501, length 156
02:45:23.773733 IP 137.184.172.1.22 > 174.91.170.42.56476: Flags [P.], seq 1321740:1321896, ack 757, win 501, length 156
02:45:23.774702 IP 174.91.170.42.56476 > 137.184.172.1.22: Flags [.], ack 1318152, win 8337, length 0
02:45:23.774780 IP 137.184.172.1.22 > 174.91.170.42.56476: Flags [P.], seq 1321896:1322052, ack 757, win 501, length 156
02:45:23.774939 IP 137.184.172.1.22 > 174.91.170.42.56476: Flags [P.], seq 1322052:1322312, ack 757, win 501, length 260
02:45:23.775001 IP 137.184.172.1.22 > 174.91.170.42.56476: Flags [P.], seq 1322312:1322468, ack 757, win 501, length 156
02:45:23.775433 IP 137.184.172.1.22 > 174.91.170.42.56476: Flags [P.], seq 1322468:1322624, ack 757, win 501, length 156
02:45:23.775567 IP 137.184.172.1.22 > 174.91.170.42.56476: Flags [P.], seq 1322624:1322780, ack 757, win 501, length 156
02:45:23.775775 IP 137.184.172.1.22 > 174.91.170.42.56476: Flags [P.], seq 1322780:1322936, ack 757, win 501, length 156
02:45:23.775930 IP 137.184.172.1.22 > 174.91.170.42.56476: Flags [P.], seq 1322936:1323092, ack 757, win 501, length 156
02:45:23.776315 IP 137.184.172.1.22 > 174.91.170.42.56476: Flags [P.], seq 1323092:1323248, ack 757, win 501, length 156
02:45:23.776416 IP 174.91.170.42.56476 > 137.184.172.1.22: Flags [.], ack 1321740, win 8337, length 0
02:45:23.776563 IP 137.184.172.1.22 > 174.91.170.42.56476: Flags [P.], seq 1323248:1323404, ack 757, win 501, length 156
02:45:23.776646 IP 137.184.172.1.22 > 174.91.170.42.56476: Flags [P.], seq 1323404:1323700, ack 757, win 501, length 296
02:45:23.776808 IP 137.184.172.1.22 > 174.91.170.42.56476: Flags [P.], seq 1323700:1323856, ack 757, win 501, length 156
02:45:23.776934 IP 137.184.172.1.22 > 174.91.170.42.56476: Flags [P.], seq 1323856:1324012, ack 757, win 501, length 156
02:45:23.777039 IP 137.184.172.1.22 > 174.91.170.42.56476: Flags [P.], seq 1324012:1324168, ack 757, win 501, length 156
02:45:23.777137 IP 137.184.172.1.22 > 174.91.170.42.56476: Flags [P.], seq 1324168:1324324, ack 757, win 501, length 156
02:45:23.777766 IP 137.184.172.1.22 > 174.91.170.42.56476: Flags [P.], seq 1324324:1324480, ack 757, win 501, length 156
02:45:23.777949 IP 137.184.172.1.22 > 174.91.170.42.56476: Flags [P.], seq 1324480:1324636, ack 757, win 501, length 156
02:45:23.778005 IP 137.184.172.1.22 > 174.91.170.42.56476: Flags [P.], seq 1324636:1324792, ack 757, win 501, length 156
02:45:23.778047 IP 137.184.172.1.22 > 174.91.170.42.56476: Flags [P.], seq 1324792:1324948, ack 757, win 501, length 156
02:45:23.778213 IP 137.184.172.1.22 > 174.91.170.42.56476: Flags [P.], seq 1324948:1325104, ack 757, win 501, length 156
02:45:23.778261 IP 137.184.172.1.22 > 174.91.170.42.56476: Flags [P.], seq 1325104:1325260, ack 757, win 501, length 156
02:45:23.778301 IP 137.184.172.1.22 > 174.91.170.42.56476: Flags [P.], seq 1325260:1325416, ack 757, win 501, length 156
02:45:23.778340 IP 137.184.172.1.22 > 174.91.170.42.56476: Flags [P.], seq 1325416:1325572, ack 757, win 501, length 156
02:45:23.778403 IP 137.184.172.1.22 > 174.91.170.42.56476: Flags [P.], seq 1325572:1325728, ack 757, win 501, length 156
02:45:23.778445 IP 137.184.172.1.22 > 174.91.170.42.56476: Flags [P.], seq 1325728:1325884, ack 757, win 501, length 156
02:45:23.778573 IP 137.184.172.1.22 > 174.91.170.42.56476: Flags [P.], seq 1325884:1326040, ack 757, win 501, length 156
02:45:23.778622 IP 137.184.172.1.22 > 174.91.170.42.56476: Flags [P.], seq 1326040:1326196, ack 757, win 501, length 156
02:45:23.778753 IP 137.184.172.1.22 > 174.91.170.42.56476: Flags [P.], seq 1326196:1326352, ack 757, win 501, length 156
02:45:23.778798 IP 137.184.172.1.22 > 174.91.170.42.56476: Flags [P.], seq 1326352:1326508, ack 757, win 501, length 156
02:45:23.778838 IP 137.184.172.1.22 > 174.91.170.42.56476: Flags [P.], seq 1326508:1326664, ack 757, win 501, length 156
02:45:23.778887 IP 137.184.172.1.22 > 174.91.170.42.56476: Flags [P.], seq 1326664:1326820, ack 757, win 501, length 156
02:45:23.778928 IP 137.184.172.1.22 > 174.91.170.42.56476: Flags [P.], seq 1326820:1326976, ack 757, win 501, length 156
02:45:23.779057 IP 137.184.172.1.22 > 174.91.170.42.56476: Flags [P.], seq 1326976:1327132, ack 757, win 501, length 156
02:45:23.779489 IP 174.91.170.42.56476 > 137.184.172.1.22: Flags [.], ack 1322936, win 8332, length 0
02:45:23.779620 IP 137.184.172.1.22 > 174.91.170.42.56476: Flags [P.], seq 1327132:1327392, ack 757, win 501, length 260
02:45:23.779862 IP 137.184.172.1.22 > 174.91.170.42.56476: Flags [P.], seq 1327392:1327548, ack 757, win 501, length 156
02:45:23.779949 IP 137.184.172.1.22 > 174.91.170.42.56476: Flags [P.], seq 1327548:1327704, ack 757, win 501, length 156
02:45:23.780001 IP 137.184.172.1.22 > 174.91.170.42.56476: Flags [P.], seq 1327704:1327860, ack 757, win 501, length 156
02:45:23.780242 IP 137.184.172.1.22 > 174.91.170.42.56476: Flags [P.], seq 1327860:1328016, ack 757, win 501, length 156
02:45:23.780423 IP 174.91.170.42.56476 > 137.184.172.1.22: Flags [.], ack 1324948, win 8337, length 0
02:45:23.780455 IP 137.184.172.1.22 > 174.91.170.42.56476: Flags [P.], seq 1328016:1328172, ack 757, win 501, length 156
02:45:23.780546 IP 137.184.172.1.22 > 174.91.170.42.56476: Flags [P.], seq 1328172:1328432, ack 757, win 501, length 260
02:45:23.780588 IP 137.184.172.1.22 > 174.91.170.42.56476: Flags [P.], seq 1328432:1328588, ack 757, win 501, length 156
02:45:23.780628 IP 137.184.172.1.22 > 174.91.170.42.56476: Flags [P.], seq 1328588:1328744, ack 757, win 501, length 156
02:45:23.780701 IP 137.184.172.1.22 > 174.91.170.42.56476: Flags [P.], seq 1328744:1328900, ack 757, win 501, length 156
02:45:23.780741 IP 137.184.172.1.22 > 174.91.170.42.56476: Flags [P.], seq 1328900:1329056, ack 757, win 501, length 156
02:45:23.780885 IP 137.184.172.1.22 > 174.91.170.42.56476: Flags [P.], seq 1329056:1329212, ack 757, win 501, length 156
02:45:23.780931 IP 137.184.172.1.22 > 174.91.170.42.56476: Flags [P.], seq 1329212:1329368, ack 757, win 501, length 156
02:45:23.780967 IP 137.184.172.1.22 > 174.91.170.42.56476: Flags [P.], seq 1329368:1329524, ack 757, win 501, length 156
02:45:23.781004 IP 137.184.172.1.22 > 174.91.170.42.56476: Flags [P.], seq 1329524:1329680, ack 757, win 501, length 156
02:45:23.781365 IP 137.184.172.1.22 > 174.91.170.42.56476: Flags [P.], seq 1329680:1329836, ack 757, win 501, length 156
02:45:23.781516 IP 137.184.172.1.22 > 174.91.170.42.56476: Flags [P.], seq 1329836:1329992, ack 757, win 501, length 156
02:45:23.781578 IP 137.184.172.1.22 > 174.91.170.42.56476: Flags [P.], seq 1329992:1330148, ack 757, win 501, length 156
02:45:23.781731 IP 137.184.172.1.22 > 174.91.170.42.56476: Flags [P.], seq 1330148:1330304, ack 757, win 501, length 156
02:45:23.781785 IP 137.184.172.1.22 > 174.91.170.42.56476: Flags [P.], seq 1330304:1330460, ack 757, win 501, length 156
02:45:23.781859 IP 137.184.172.1.22 > 174.91.170.42.56476: Flags [P.], seq 1330460:1330616, ack 757, win 501, length 156
02:45:23.781906 IP 137.184.172.1.22 > 174.91.170.42.56476: Flags [P.], seq 1330616:1330772, ack 757, win 501, length 156
02:45:23.781952 IP 137.184.172.1.22 > 174.91.170.42.56476: Flags [P.], seq 1330772:1330928, ack 757, win 501, length 156
02:45:23.781999 IP 137.184.172.1.22 > 174.91.170.42.56476: Flags [P.], seq 1330928:1331084, ack 757, win 501, length 156
02:45:23.782045 IP 137.184.172.1.22 > 174.91.170.42.56476: Flags [P.], seq 1331084:1331240, ack 757, win 501, length 156
02:45:23.782081 IP 137.184.172.1.22 > 174.91.170.42.56476: Flags [P.], seq 1331240:1331396, ack 757, win 501, length 156
02:45:23.782121 IP 137.184.172.1.22 > 174.91.170.42.56476: Flags [P.], seq 1331396:1331552, ack 757, win 501, length 156
02:45:23.782157 IP 137.184.172.1.22 > 174.91.170.42.56476: Flags [P.], seq 1331552:1331708, ack 757, win 501, length 156
02:45:23.782196 IP 137.184.172.1.22 > 174.91.170.42.56476: Flags [P.], seq 1331708:1331864, ack 757, win 501, length 156
02:45:23.782242 IP 137.184.172.1.22 > 174.91.170.42.56476: Flags [P.], seq 1331864:1332020, ack 757, win 501, length 156
02:45:23.782287 IP 137.184.172.1.22 > 174.91.170.42.56476: Flags [P.], seq 1332020:1332176, ack 757, win 501, length 156
02:45:23.782332 IP 137.184.172.1.22 > 174.91.170.42.56476: Flags [P.], seq 1332176:1332332, ack 757, win 501, length 156
02:45:23.782399 IP 174.91.170.42.56476 > 137.184.172.1.22: Flags [.], ack 1327704, win 8337, length 0
02:45:23.782426 IP 137.184.172.1.22 > 174.91.170.42.56476: Flags [P.], seq 1332332:1332488, ack 757, win 501, length 156
02:45:23.782487 IP 137.184.172.1.22 > 174.91.170.42.56476: Flags [P.], seq 1332488:1332748, ack 757, win 501, length 260
02:45:23.782524 IP 137.184.172.1.22 > 174.91.170.42.56476: Flags [P.], seq 1332748:1332904, ack 757, win 501, length 156
02:45:23.782562 IP 137.184.172.1.22 > 174.91.170.42.56476: Flags [P.], seq 1332904:1333060, ack 757, win 501, length 156
02:45:23.782605 IP 137.184.172.1.22 > 174.91.170.42.56476: Flags [P.], seq 1333060:1333216, ack 757, win 501, length 156
02:45:23.782648 IP 137.184.172.1.22 > 174.91.170.42.56476: Flags [P.], seq 1333216:1333372, ack 757, win 501, length 156
02:45:23.782691 IP 137.184.172.1.22 > 174.91.170.42.56476: Flags [P.], seq 1333372:1333528, ack 757, win 501, length 156
02:45:23.782744 IP 137.184.172.1.22 > 174.91.170.42.56476: Flags [P.], seq 1333528:1333684, ack 757, win 501, length 156
02:45:23.782785 IP 137.184.172.1.22 > 174.91.170.42.56476: Flags [P.], seq 1333684:1333840, ack 757, win 501, length 156
02:45:23.782829 IP 137.184.172.1.22 > 174.91.170.42.56476: Flags [P.], seq 1333840:1333996, ack 757, win 501, length 156
02:45:23.782864 IP 137.184.172.1.22 > 174.91.170.42.56476: Flags [P.], seq 1333996:1334152, ack 757, win 501, length 156
02:45:23.782902 IP 137.184.172.1.22 > 174.91.170.42.56476: Flags [P.], seq 1334152:1334308, ack 757, win 501, length 156
02:45:23.782942 IP 137.184.172.1.22 > 174.91.170.42.56476: Flags [P.], seq 1334308:1334464, ack 757, win 501, length 156
02:45:23.782978 IP 137.184.172.1.22 > 174.91.170.42.56476: Flags [P.], seq 1334464:1334620, ack 757, win 501, length 156
02:45:23.783015 IP 137.184.172.1.22 > 174.91.170.42.56476: Flags [P.], seq 1334620:1334776, ack 757, win 501, length 156
02:45:23.783060 IP 137.184.172.1.22 > 174.91.170.42.56476: Flags [P.], seq 1334776:1334932, ack 757, win 501, length 156
02:45:23.783494 IP 137.184.172.1.22 > 174.91.170.42.56476: Flags [P.], seq 1334932:1335088, ack 757, win 501, length 156
02:45:23.783598 IP 137.184.172.1.22 > 174.91.170.42.56476: Flags [P.], seq 1335088:1335244, ack 757, win 501, length 156
02:45:23.783707 IP 137.184.172.1.22 > 174.91.170.42.56476: Flags [P.], seq 1335244:1335400, ack 757, win 501, length 156
02:45:23.783802 IP 137.184.172.1.22 > 174.91.170.42.56476: Flags [P.], seq 1335400:1335556, ack 757, win 501, length 156
02:45:23.783863 IP 137.184.172.1.22 > 174.91.170.42.56476: Flags [P.], seq 1335556:1335712, ack 757, win 501, length 156
02:45:23.783915 IP 137.184.172.1.22 > 174.91.170.42.56476: Flags [P.], seq 1335712:1335868, ack 757, win 501, length 156
02:45:23.783962 IP 137.184.172.1.22 > 174.91.170.42.56476: Flags [P.], seq 1335868:1336024, ack 757, win 501, length 156
02:45:23.784014 IP 137.184.172.1.22 > 174.91.170.42.56476: Flags [P.], seq 1336024:1336180, ack 757, win 501, length 156
02:45:23.784058 IP 137.184.172.1.22 > 174.91.170.42.56476: Flags [P.], seq 1336180:1336336, ack 757, win 501, length 156
02:45:23.784104 IP 137.184.172.1.22 > 174.91.170.42.56476: Flags [P.], seq 1336336:1336492, ack 757, win 501, length 156
02:45:23.784174 IP 137.184.172.1.22 > 174.91.170.42.56476: Flags [P.], seq 1336492:1336648, ack 757, win 501, length 156
02:45:23.784227 IP 137.184.172.1.22 > 174.91.170.42.56476: Flags [P.], seq 1336648:1336804, ack 757, win 501, length 156
02:45:23.785645 IP 174.91.170.42.56476 > 137.184.172.1.22: Flags [.], ack 1330928, win 8337, length 0
02:45:23.785705 IP 137.184.172.1.22 > 174.91.170.42.56476: Flags [P.], seq 1336804:1336960, ack 757, win 501, length 156
02:45:23.785860 IP 137.184.172.1.22 > 174.91.170.42.56476: Flags [P.], seq 1336960:1337220, ack 757, win 501, length 260
02:45:23.785915 IP 137.184.172.1.22 > 174.91.170.42.56476: Flags [P.], seq 1337220:1337376, ack 757, win 501, length 156
02:45:23.785969 IP 137.184.172.1.22 > 174.91.170.42.56476: Flags [P.], seq 1337376:1337532, ack 757, win 501, length 156
02:45:23.786133 IP 137.184.172.1.22 > 174.91.170.42.56476: Flags [P.], seq 1337532:1337688, ack 757, win 501, length 156
02:45:23.786909 IP 174.91.170.42.56476 > 137.184.172.1.22: Flags [.], ack 1334776, win 8337, length 0
02:45:23.786909 IP 174.91.170.42.56476 > 137.184.172.1.22: Flags [.], ack 1335868, win 8333, length 0
02:45:23.786962 IP 137.184.172.1.22 > 174.91.170.42.56476: Flags [P.], seq 1337688:1337844, ack 757, win 501, length 156
02:45:23.787488 IP 137.184.172.1.22 > 174.91.170.42.56476: Flags [P.], seq 1337844:1338208, ack 757, win 501, length 364
02:45:23.787736 IP 137.184.172.1.22 > 174.91.170.42.56476: Flags [P.], seq 1338208:1338364, ack 757, win 501, length 156
02:45:23.787809 IP 137.184.172.1.22 > 174.91.170.42.56476: Flags [P.], seq 1338364:1338520, ack 757, win 501, length 156
02:45:23.787859 IP 137.184.172.1.22 > 174.91.170.42.56476: Flags [P.], seq 1338520:1338676, ack 757, win 501, length 156
02:45:23.787905 IP 137.184.172.1.22 > 174.91.170.42.56476: Flags [P.], seq 1338676:1338832, ack 757, win 501, length 156
02:45:23.787952 IP 137.184.172.1.22 > 174.91.170.42.56476: Flags [P.], seq 1338832:1338988, ack 757, win 501, length 156
02:45:23.787991 IP 137.184.172.1.22 > 174.91.170.42.56476: Flags [P.], seq 1338988:1339144, ack 757, win 501, length 156
02:45:23.788029 IP 137.184.172.1.22 > 174.91.170.42.56476: Flags [P.], seq 1339144:1339300, ack 757, win 501, length 156
02:45:23.788077 IP 137.184.172.1.22 > 174.91.170.42.56476: Flags [P.], seq 1339300:1339456, ack 757, win 501, length 156
02:45:23.788122 IP 137.184.172.1.22 > 174.91.170.42.56476: Flags [P.], seq 1339456:1339612, ack 757, win 501, length 156
02:45:23.788165 IP 137.184.172.1.22 > 174.91.170.42.56476: Flags [P.], seq 1339612:1339768, ack 757, win 501, length 156
02:45:23.788200 IP 137.184.172.1.22 > 174.91.170.42.56476: Flags [P.], seq 1339768:1339924, ack 757, win 501, length 156
02:45:23.788237 IP 137.184.172.1.22 > 174.91.170.42.56476: Flags [P.], seq 1339924:1340080, ack 757, win 501, length 156
02:45:23.788389 IP 137.184.172.1.22 > 174.91.170.42.56476: Flags [P.], seq 1340080:1340236, ack 757, win 501, length 156
02:45:23.788554 IP 137.184.172.1.22 > 174.91.170.42.56476: Flags [P.], seq 1340236:1340392, ack 757, win 501, length 156
02:45:23.788817 IP 137.184.172.1.22 > 174.91.170.42.56476: Flags [P.], seq 1340392:1340548, ack 757, win 501, length 156
02:45:23.788911 IP 137.184.172.1.22 > 174.91.170.42.56476: Flags [P.], seq 1340548:1340704, ack 757, win 501, length 156
02:45:23.788969 IP 137.184.172.1.22 > 174.91.170.42.56476: Flags [P.], seq 1340704:1340860, ack 757, win 501, length 156
02:45:23.789014 IP 137.184.172.1.22 > 174.91.170.42.56476: Flags [P.], seq 1340860:1341016, ack 757, win 501, length 156
02:45:23.789075 IP 137.184.172.1.22 > 174.91.170.42.56476: Flags [P.], seq 1341016:1341172, ack 757, win 501, length 156
02:45:23.789240 IP 137.184.172.1.22 > 174.91.170.42.56476: Flags [P.], seq 1341172:1341328, ack 757, win 501, length 156
02:45:23.789358 IP 137.184.172.1.22 > 174.91.170.42.56476: Flags [P.], seq 1341328:1341484, ack 757, win 501, length 156
02:45:23.789417 IP 137.184.172.1.22 > 174.91.170.42.56476: Flags [P.], seq 1341484:1341640, ack 757, win 501, length 156
02:45:23.789471 IP 174.91.170.42.56476 > 137.184.172.1.22: Flags [.], ack 1337376, win 8337, length 0
02:45:23.789545 IP 137.184.172.1.22 > 174.91.170.42.56476: Flags [P.], seq 1341640:1341900, ack 757, win 501, length 260
02:45:23.789628 IP 137.184.172.1.22 > 174.91.170.42.56476: Flags [P.], seq 1341900:1342056, ack 757, win 501, length 156
02:45:23.789673 IP 137.184.172.1.22 > 174.91.170.42.56476: Flags [P.], seq 1342056:1342212, ack 757, win 501, length 156
02:45:23.789795 IP 137.184.172.1.22 > 174.91.170.42.56476: Flags [P.], seq 1342212:1342368, ack 757, win 501, length 156
02:45:23.789862 IP 137.184.172.1.22 > 174.91.170.42.56476: Flags [P.], seq 1342368:1342524, ack 757, win 501, length 156
02:45:23.789914 IP 137.184.172.1.22 > 174.91.170.42.56476: Flags [P.], seq 1342524:1342680, ack 757, win 501, length 156
02:45:23.789966 IP 137.184.172.1.22 > 174.91.170.42.56476: Flags [P.], seq 1342680:1342836, ack 757, win 501, length 156
02:45:23.790014 IP 137.184.172.1.22 > 174.91.170.42.56476: Flags [P.], seq 1342836:1342992, ack 757, win 501, length 156
02:45:23.790091 IP 137.184.172.1.22 > 174.91.170.42.56476: Flags [P.], seq 1342992:1343148, ack 757, win 501, length 156
02:45:23.790164 IP 137.184.172.1.22 > 174.91.170.42.56476: Flags [P.], seq 1343148:1343304, ack 757, win 501, length 156
02:45:23.790405 IP 174.91.170.42.56476 > 137.184.172.1.22: Flags [.], ack 1338676, win 8332, length 0
02:45:23.790430 IP 137.184.172.1.22 > 174.91.170.42.56476: Flags [P.], seq 1343304:1343460, ack 757, win 501, length 156
02:45:23.790495 IP 137.184.172.1.22 > 174.91.170.42.56476: Flags [P.], seq 1343460:1343720, ack 757, win 501, length 260
02:45:23.790534 IP 137.184.172.1.22 > 174.91.170.42.56476: Flags [P.], seq 1343720:1343876, ack 757, win 501, length 156
02:45:23.790573 IP 137.184.172.1.22 > 174.91.170.42.56476: Flags [P.], seq 1343876:1344032, ack 757, win 501, length 156
02:45:23.790616 IP 137.184.172.1.22 > 174.91.170.42.56476: Flags [P.], seq 1344032:1344188, ack 757, win 501, length 156
02:45:23.790663 IP 137.184.172.1.22 > 174.91.170.42.56476: Flags [P.], seq 1344188:1344344, ack 757, win 501, length 156
02:45:23.790706 IP 137.184.172.1.22 > 174.91.170.42.56476: Flags [P.], seq 1344344:1344500, ack 757, win 501, length 156
02:45:23.790743 IP 137.184.172.1.22 > 174.91.170.42.56476: Flags [P.], seq 1344500:1344656, ack 757, win 501, length 156
02:45:23.790780 IP 137.184.172.1.22 > 174.91.170.42.56476: Flags [P.], seq 1344656:1344812, ack 757, win 501, length 156
02:45:23.790826 IP 137.184.172.1.22 > 174.91.170.42.56476: Flags [P.], seq 1344812:1344968, ack 757, win 501, length 156
